Course Title,Course Description,Course Areas,Course Id
 Financial Modeling,"FI347 Financial Modeling Prerequisite(s): (FI 320 or FI 306) or (FI 380 or FI 307)Financial Modeling is an advanced elective focused on applying sophisticated Excel techniques to the most common modeling problems in finance. First, the skill set is expanded to include advanced features of Excel including TVM and statistical functions, array manipulation, text and date usage, regression, conditionals, Boolean operators, data tables and random number generation. Subsequently the course will cover macro recording as well as custom subroutine and function construction in the Visual Basic for Applications (VBA) development environment. All techniques learned will be applied to the most common financial modeling problems of the day including present value, cost of capital, financial statement forecasting, valuation, portfolio theory and options. Lectures will not only discuss the Excel application and relevant financial theory, they will also cover topics such as linear algebra, programming style, enhanced readability, reuse and large-scale deployable model development. ",FI,FI347
 International Finance,"FI351 International Finance Prerequisite(s): (FI 320 or FI 380) or (FI 306 or FI 307).Surveys systematically the theory of international finance, international investing and international business. Areas covered include foreign exchange with emphasis on exchange rate determination, exchange risk, hedging and interest rate arbitrage, international money and capital markets and international financing, multinational capital budgeting and the cost of capital. ",FI,FI351
 International Project Finance,"FI352 International Project Finance Prerequisite(s): FI 380 or FI 307Note: Formerly: FI 392The course relies on a case-study approach to an increasingly important field that requires excellent financial management skills. We provide an overview of project finance employing the latest techniques for structuring transactions, including risk mitigation by financial intermediaries. Students will be introduced to substantial research data and informational resources. The course stresses decision making and prioritization of tasks, policy formulation, the selection of world-class partners and on-the-ground operational skills necessary to ensure timely completion of construction, budget adherence and efficient start-up. Large investment projects across a variety of geographic regions, industrial sectors, and stages of project execution are examined, including relevant data on default and loss characteristics.  We will contrast the important differences in risk between domestic and export sector projects, including management of foreign exchange issues and the role of host gov. ",FI,FI352
 Introduction to Professional Financial Planning,"FI360 Introduction to Professional Financial Planning Pre or Corequisite(s): (FI 320 or FI 306) or (FI 380 or FI 307)Note: Formerly FI 340Provides an overview of the personal financial planning process, including the establishment of goals and objectives, forecasting of lifetime income and expenditures, evaluation of alternative investments, money management, taxation, and retirement and estate planning. Covers the concepts, theories and analytical methods used in professional financial planning. Investments considered include home ownership, securities, money market funds, investment partnerships, insurance, business ownership, real estate, and retirement programs. Analyzes the effects of inflation, changing interest rates and taxation on these investments. Designed to give an in-depth exposure to financial planning issues to students with a professional interest in the field. ",FI,FI360
 Advanced Topics in Financial Planning,"FI361 Advanced Topics in Financial Planning Prerequisite(s): FI 340 or FI 360This course explores the complex issues involved in planning for specialized client circumstances. As a result, the course highlights the effects of marriage, separation, and divorce, childbirth, career changes, inheritance, health difficulties, and the retirement or death of household members on financial planning activities. The course work also illustrates actual uses of financial planning tools and a technology in the development of segmented and comprehensive plans to help refine students' research, communication, and decision-making abilities. ",FI,FI361
 Insurance and Risk Management,"FI362 Insurance and Risk Management Pre or Corequisite(s): FI 380 or FI 307Note: Formerly FI 327Studies insurance as an economic and legal relationship dealing with personal and property risks, subjective and objective risks, and insurability. Reviews contract and agency law; insurance coverages including life, health, liability, fire, homeowners and commercial special multiperil policies; Social Security and social insurance; pension plans including IRA accounts; estate planning; and risk management and self-insurance. Surveys the insurance industry, including its structure and regulation. ",FI,FI362
 Mergers and Acquisitions,"FI372 Mergers and Acquisitions Prerequisite(s): (FI 320 or FI 380) or (FI 306 or FI 307)Mergers and Acquisitions is an advanced finance course which is designed to examine various aspects of corporate mergers, acquisitions and other changes in control of a company. The course will discuss such matters as the strategy and rationale for such transactions, corporate governance, valuation, structuring, due diligence, private equity and leveraged buyouts and the seller's perspective in a transaction. Other topics will include a discussion of alternatives to mergers and acquisitions such as joint ventures and licensing, as well as a discussion of post-merger integration. ",FI,FI372
 Advanced Managerial Finance,"FI380 Advanced Managerial Finance Prerequisite(s): FI 305 and junior level standingThis course builds on materials covered in FI 305. Topics covered include capital budgeting under uncertainty, capital structure and payout policy, investment banking and public offerings of securities, lease financing and hybrid securities, mergers, acquisitions and other forms of corporate restructuring, bankruptcy and liquidations, and an introduction to derivative securities and corporate risk management. Course pedagogy includes the use of cases to bridge the gap between finance theory and real-world applications. ",FI,FI380
 International Project Finance,"FI392 International Project Finance Prerequisite(s): FI 320 and junior level standingThe course relies on a case-study approach to an increasingly important field that requires excellent financial management skills. We provide an overview of project finance employing the latest techniques for structuring transactions, including risk mitigation by financial intermediaries. Students will be introduced to substantial research data and informational resources. The course stresses decision making and prioritization of tasks, policy formulation, the selection of world-class partners and on-the-ground operational skills necessary to ensure timely completion of construction, budget adherence and efficient start-up. Large investment projects across a variety of geographic regions, industrial sectors, and stages of project execution are examined, including relevant data on default and loss characteristics.  We will contrast the important differences in risk between domestic and export sector projects, including management of foreign exchange issues and the role of host gov. ",FI,FI392
 Advanced Topics in Financial Planning,"FI398 Advanced Topics in Financial Planning Prerequisite(s): FI 340This course explores the complex issues involved in planning for specialized client circumstances. As a result, the course highlights the effects of marriage, separation, and divorce, childbirth, career changes, inheritance, health difficulties, and the retirement or death of household members on financial planning activities. The course work also illustrates actual uses of financial planning tools and a technology in the development of segmented and comprehensive plans to help refine students' research, communication, and decision-making abilities. ",FI,FI398
 Directed Study in Finance,FI401 Directed Study in Finance Prerequisite(s): FI 380 and department chairperson's permissionPermits selected superior students to study special topics. (Allows repetition for credit.) ,FI,FI401
 Seminar in Finance (Special Topics),"FI402 Seminar in Finance (Special Topics) Prerequisite(s): Depends upon the topic, and can include FI 320 and/or FI 380 and FI 351 as a co-requisite; and/or department chairperson's permission.Note: Not offered regularly.  Check with department chair for availability.Covers a broad range of topics in corporate finance and financial services. The seminars offered under this designation focus on contemporary issues to which financial principles and information technology can be applied. ",FI,FI402
 Internship in Finance,"FI421 Internship in Finance Prerequisite(s): At least nine hours of finance courses earned before the beginning of the internship period and permission of the internship coordinatorNote: Open to superior full-time students, selected by the finance faculty.Provides the student with an on-the-job opportunity to apply principles of the finance discipline to a work situation in the business world. Requires the student to work with the faculty adviser to develop a report relating academic course work to the work experience. ",FI,FI421
 US Government and Politics,"GLS100 US Government and Politics Note: Formerly GO 100Introduces the institutions, background and processes of American national government. Surveys the governmental structures created by the Constitution as well as the informal substructures (parties, interest groups, etc.) that animate our political system. ",GL,GLS100
 Globalization,"GLS101 Globalization Note: Formerly Experimetal Course: INT 199  GlobalizationThe world is becoming increasingly interconnected and interdependent. The revolutionary changes in information and communication technology and the collapse of the Cold War international system in recent decades have been driving the flow of goods, services, capital, people, ideas, and images across the globe at an unprecedented speed. This course begins with an introduction defining what globalization is and is not, why everyone is talking about it, and what forces are pushing it. The course then engages the students in the theoretical debates about the nature of globalization, after which it examines the political, economic, security, and cultural impact of globalization. Furthermore, we will use the case of China, India, the United States and the developing world to show how nations react to the challenges of globalization. ",GL,GLS101
 Comparative Government and Politics,"GLS102 Comparative Government and Politics Note: Formerly GO 120This course offers an introduction to comparative politics. It provides students with the basic knowledge and conceptual tools for analyzing the varieties of national states, regimes (democratic, nondemocratic and hybrid), political institutions and processes. It is designed to help students learn about the historical, economic and cultural contexts of political change (such as democratization, revolution or reform), and understand how and why political systems function differently and the consequences of the differences. ",GL,GLS102
 US State and Local Government and Politics,"GLS105 US State and Local Government and Politics Note: Formerly GO 105Sub-national governments (localities, states, regions) are involved in tackling many of the most challenging problems facing nations and are on the front lines responding to social and economic change. This course will help students understand how sub-national institutions and decision-makers operate, what kinds of public policies they produce, how they interact with the national government, and how the balance of power between sub-national and national government shifts over time. ",GL,GLS105
 Global Regions,"GLS110 Global Regions Note: Formerly INT 100In this survey course, we examine the worlds major global regions, adopting a geographic perspective to better understand contemporary global landscapes, people, and events. In other words, we consider the ways in which attributes of location and geography underlie cultural, economic, and political circumstances around the world. For each region, associated themes are discussed. For example, North Africa/Southwest Asia tends to be associated with oil and Islam, while North America is often associated with themes of urbanization and mobility. Our region-centered class materials and discussions are then complemented by students country-specific current events studies that narrow the scale of analysis and thereby reinforce knowledge acquired in the course. ",GL,GLS110
 Cross-Cultural Understanding,"GLS114 Cross-Cultural Understanding Note: Formerly INT 104Offers an introduction to effective communication between people of different cultures. Helps students develop and clarify their own concept of culture, and see how differences and similarities in this concept affect communication. Students learn to identify cultural assumptions and perceive how differences in assumptions affect cross-cultural communication. Cultural elements of several specific countries are examined, and strategies for effective communication are developed and applied through readings, case studies and experiential exercises. The course also includes guest speakers, films, and small-group discussions. ",GL,GLS114
 International Relations,"GLS116 International Relations Note: Formerly INT 106This survey course introduces students to International Relations (IR) as a field of study in political science. Students will learn key terms, analytical tools, and theories of IR, through which they can better understand and analyze important issues in global politics and the world economy. The course begins with an overview of the central themes, core principles, and key concepts of IR as well as the changing nature of the international system in both the pre-Cold War and post-Cold War eras. It discusses various theoretical approaches of IR and then focuses on several key issue areas including peace and security, conflict and terrorism, weapons of mass destruction, international cooperation and organizations, international law and regimes, global trade and finance, relations between developed and developing regions, poverty and economic development, and the challenges of managing the environment, resources, and technological and information revolution in the age of globalization. ",GL,GLS116
 Social Policy: Privatization of Public Benefits,"GLS205 Social Policy: Privatization of Public Benefits Note: Formerly GO 305. May be used toward INT major and in the GOV minor as well as in the American Perspectives LSM.The United States stands out in international comparison for the degree to which it has relied on the private sector to provide social benefits, like healthcare and pensions, to its citizens.  The course will begin by exploring the courses and consequences of this heavy reliance on the private sector for the provision of public benefits.  The course will then consider the ways in which this trend continues to strengthen as policymakers increasingly emphasize the privatization of social policy.  In particular, we will consider current social policy debates that emphasize shifts in the role of the private sector:  Should social security be privatized?  Who should provide health insurance and who should pay for it?  Should employers be obligated to pay a living wage?  Would market-based reforms improve public schools? ",GL,GLS205
 US Foreign Policy,GLS226 US Foreign Policy Note: Formerly GO 242Examines briefly the historical trends in U.S. foreign relations. Devotes major attention to the forces affecting the development of foreign policy and the problems facing the United States worldwide since World War II. ,GL,GLS226
 Politics and Public Policy,"GLS230 Politics and Public Policy Note: Formerly GO 250This course provides an introduction to the making of public policy.  The first part of the course considers questions about the appropriate role of government and why and when do we need public policy?   The course then examines the broad context for policy making in specific countries and considers a number of important and difficult questions:  What determines which of the many issues that might command popular attention actually make it to the political agenda?  What is political influence and how do we identify who has it?  How do various organized interests like labor and business shape policy choices?  How do the various institutions of government affect the types of policies that are considered and adopted?  How do ideas and culture influence the nature of government intervention in society and the economy?   In order to answer these questions, students will analyze case studies of current policy debates. ",GL,GLS230
 Campaigns and Elections,"GLS236 Campaigns and Elections Examines political campaigns and elections in the United States and other democracies.  The course covers the core principles and practices of modern campaigns, including who runs for office and why; how are campaigns organized; what makes a good campaign strategy, and what is the best way to communicate a theme to the voters; how are campaigns financed; what is the impact of money, polling, political advertising, and grass-roots mobilization; how is technology transforming campaigns; and how do voters make their electoral decisions? These questions will be answered by closely tracking and analyzing current races, assessing the performance of the news media, comparing the U.S. electoral system with systems abroad, suggesting reforms for the U.S. system, and discussing the implications of the most recent election outcomes for future governing and policymaking. ",GL,GLS236
 Immigration,"GLS238 Immigration Note: Formerly GO 258Considers America's love-hate relationship with its immigration legacy - a nation of immigrants that now favors stricter immigration policies. Focuses on the country's immigration legacy, immigration institutions, legal and undocumented immigration, political refugees and human rights issues at America's borders. It also examines foreign policy influences on immigration policy and places immigration within a global context to examine the origins of immigration as well as international migration patterns. ",GL,GLS238
 Special Topics: Global Studies,GLS240 Special Topics: Global Studies Note: Formerly INT 402Permits students to study selected topics in Global Studies. (Allows repetition for credit). ,GL,GLS240
 Current Political Issues,"GLS242 Current Political Issues Note: Formerly GO 230Focuses on a specific current event or public policy debate at the forefront of U.S. or international politics. The course will examine current issues in their political context, with emphasis on the actors, institutions or organizations, and processes that shape them.Topic changes: With department approval, course may be taken more than once. ",GL,GLS242
 The Developing World,"GLS243 The Developing World Note: Formerly INT 108As the forces of globalization increase the flow of goods, services, capital, people, ideas and images across borders, many social, political and economic consequences have arisen for developing, as well as developed, countries. This course takes an interdisciplinary approach to examining the dynamic interaction of the social and political factors with regional and transnational economic forces in the developing world. More specifically, it discusses the social and political conditions for successes or failures of development as well as the consequences of development and underdevelopment. The United Nations Human Development Index is used to analyze the consequences of global socioeconomic interactions. Students in this course will acquire a deep understanding of the global and socioeconomic interactions measured by HDI and develop skills to analyze the multifaceted impact of globalization on the developing world. ",GL,GLS243
 Business and Politics of News Media,"GLS248 Business and Politics of News Media Note: formerly GO 218This course analyzes the role of the media in politics and its relationship with the public, business, government, and candidates for office in a democratic society. Examined is the role and structure of the news media as a political and economic institution in the United States and other democracies and how it is being transformed by the ""alternative"" media, new technologies and globalization; the conventions and controversies associated with the journalism profession, including news reporting and the newsgathering process, questions of bias and objectivity, investigative journalism, and news coverage of political campaigns, public policy, and global affairs; news making strategies and the effects that media have on citizens' attitudes and behaviors. ",GL,GLS248
 Latin American Cinema,"GLS251 Latin American Cinema We will look at how Latin American cinema addresses issues of cultural identity, history, politics, and society and will investigate how this cinema fits into the larger socio-historical-political context of Latin America in our modern globalized world. One of the central objectives of this course is to consider the ways in which cinema has shaped perceptions and understandings of recent and contemporary Latin American experiences for audiences inside and outside of Latin America.  In addition, we will learn about styles, forms, and techniques of Latin American film production and how various films have influenced as well as been influenced by recent history, politics, violence, and culture in Latin America and the Latin American diaspora.  One of the goals of this course is to identify key themes and styles of representation in Latin American cinema and investigate the ways in which this cinema expresses concerns and experiences of Latin Americans. ",GL,GLS251
 Global Commerce and Human Rights:STP Chile,"GLS255 Global Commerce and Human Rights:STP Chile We will look at Chile as a test case for global commerce and a free market economy ' noting the benefits and opportunities that are available to Chileans who live in a nation whose recent governments have embraced a liberal marketplace and free trade, as well as the hardships that the Chilean people and their environment have endured as a result of such unrestricted free trade combined with a lack of  human rights, social services, and environmental protections.  Staying in Santiago, Temuco, and Renaca while visiting some of the surrounding coastal and mountainous regions in central and south-central Chile, we will speak with representatives from the Central Bank of Chile, the Santiago chapter of the Association of Relatives of the Detained-Disappeared, the Mapuche indigenous people of Chile, a journalist and communication professor, a filmmaker and blogger, and a TV journalist/host, among others. ",GL,GLS255
 Politics in the Middle East,"GLS262 Politics in the Middle East Note: Formerly INT 205This course examines the modern (post World War I) origins of states in the Middle East and attempts to explain the various forces at flux, which determine the national and regional politics of the region. For the purposes of this course the Middle East is defined as the Arab countries of Egypt, Iraq, Jordan, Lebanon, and Syria, and the non-Arab countries of Iran, Israel and Turkey. The course will also consider non-state actors such as the Kurds and the Palestinians and their relations with the states that they operate in. ",GL,GLS262
 Study Tour  to Asia,"GLS265 Study Tour  to Asia Note: Formerly INT 252Examines the on-going socio-economic transformation of China as 1.3 billion people are developing a market-based economy and coping with the challenges of globalization. The course involves a two-week study tour to China, preceded by two evening seminars and one Saturday orientation on the Bentley campus. During the two-week stay in China, the group will visit the city of Beijing, Xi'an, and Shanghai where the participants will study the Chinese economy, society, history, and foreign relations, visit key historical and cultural sites, and exchange views with Chinese scholars and students. Students are required to complete a term paper as part of the requirement in this course. ",GL,GLS265
 Contemporary Europe,"GLS270 Contemporary Europe Note: Formerly INT 270.The course offers a topical and regional approach to the geography of contemporary Europe. The topical --or thematic-- approach investigates Europes complex physical, cultural, economic, and political landscapes. Throughout the course, we focus upon contemporary issues including European Union integration and the competing forces of devolution, as well as the Euro, the welfare state, tourism management, and environmental issues. The ultimate objective of the course is to build a fundamental understanding of Europes landscapes, diverse populations, and contemporary issues, and for each student to develop a geographic expertise on one European state. This course may be offered with an intensive travel component to Europe over spring or summer break. ",GL,GLS270
