Course Title,Course Description,Course Areas,Course Id
 Legal & Ethical Environment of Business*,"GB110 Legal & Ethical Environment of Business* Prerequisite(s): Class Code (CC) 1Note: *Available starting in Fall 2009Provides an overview of the legal and ethical issues that confront business managers and executives in both starting a business and operating an existing business. Provides an analytical framework to identify legal and ethical issues. Discusses the relationship between business professionals and legal counsel. Discusses topics in contracts, sales, torts, crimes, securities law and Sarbanes-Oxley, business organizations, employment and discrimination and E-commerce. Interweaves international and ethical issues into the topics covered. Includes team assignments where appropriate. ",GB,GB110
 Tools & Concepts in Accounting & Finance*,GB112 Tools & Concepts in Accounting & Finance* Prerequisite(s): CC1Note: *Available starting Fall 2009The primary objective of this course is to provide a foundational understanding of accounting and finance concepts and tools.  This course takes students from double-entry accounting through to an elementary understanding of how to construct financial statements. It introduces the use of these statements as the basis for ratio analysis and budgeting.  Students begin their study of the basic time value of money concepts that are the foundation for basic valuation techniques for both financial securities and projects valuation. ,GB,GB112
 Practice & Applications in Accounting & Finance*,GB212 Practice & Applications in Accounting & Finance* Prerequisite(s): GB 110 and GB 112Note: *Available starting in Fall 2010The primary objective of this course is to extend the foundational understanding of accounting and finance concepts and tools introduced in GB112.  This course takes students from an elementary understanding of the prepared financial statements and introduces how to use them in financial decision-making. It covers the analysis of these statements using ratio analysis and the budgeting process using these statements as a starting point for future forecasts.  Students will study the funding decisions facing the firm. They will extend their understanding of basic valuation techniques by learning more advanced techniques for valuing both the securities used to raise these funds and the projects to be funded. ,GB,GB212
 Business Statistics,"GB213 Business Statistics Prerequisite(s): IT 101 & GB 112 & Sophomore standingPre or Corequisite(s): Math IIModern businesses rely on well-educated professionals who can effectively use data to enhance and support decision-making processes. The primary objective of this course is to use data to illustrate key concepts for making decisions throughout each of the primary business disciplines; accounting, economics, finance, information systems, management, and marketing. Focuses on learning skill sets necessary to access and manipulate large amounts of data and the techniques that enhance the individuals' decision-making process. Introduces some elementary Microsoft Access methods for transferring a sample of data from a database into Microsoft Excel. Illustrates how to make effective decisions using simple and multiple regression models. Provides balanced presentations illustrating the manual use of statistical techniques for understanding purposes and how to implement those techniques using the computer. ",GB,GB213
 Marketing-Operations Fundamentals*,"GB214 Marketing-Operations Fundamentals* Prerequisite(s): Class Code 3Note: *Available starting in Fall 2010Strategic competitive advantage is derived from the value a company creates for its customers through five primary value-adding activities: Designing products and services, logistics, operations, marketing and sales strategies, and bringing products and services to the market to meet customer needs and requirements. Most of these activities fall within the boundaries of operations and marketing, the two primary value adding functions within organizations. This course, therefore, covers topics that span the marketing and operational disciplines, and focuses on the fundamental concepts and processes of marketing and operations management and how effective coordination and the interface between these two primary functional areas create value for the customer, the company, and society at large. ",GB,GB214
 Human Behavior & Organizations*,"GB215 Human Behavior & Organizations* Prerequisite(s): Class Code 3Note: *Available starting in Fall 2010Human Behavior and Organizations examines the behavior of people in organizations and the relationship between this behavior and organizational effectiveness. Particular attention is given to the issues and dynamics that result from the increasing diversity of the workforce and the global contexts in which people work. The course introduces students to analytical frameworks for understanding and influencing individual, group, inter-group and total organization dynamics. It increases students' awareness of and competence in dealing with people different from themselves. Through case studies, self-reflection instruments, experiential exercises, lectures and readings students develop knowledge and skills for working effectively with a diverse set of people in complex environments, diagnosing managerial problems and developing effective plans for action, taking into account the impact of external stakeholders on internal organizational dynamics. ",GB,GB215
 Business Processes & Systems,"GB310 Business Processes & Systems Prerequisite(s): GB 212, GB 213, GB214This course introduces students to the concept of a business as an integrated set of business processes and associated systems designed to deliver value to customers.  Hands-on experience with SAP, a market leading enterprise system, will demonstrate how information systems can be used to support and improve business processes.  Hands-on experience with a process modeling application will demonstrate how information technology can be used to model, analyze, and simulate typical business processes.  Learning about emerging technologies and basic infrastructure concepts will enable students to envision creative IT solutions to business problems.  Throughout the course, students will be learning how people, processes, and systems can be integrated most effectively to achieve organizational objectives. ",GB,GB310
 Integrated Business Project,"GB320 Integrated Business Project Prerequisite(s): GB 212 & GB 213 & GB 214 & GB 215 & Junior StandingIn this course, students work on a project team to solve real world problems for real organizations. The project enables students to develop a better understanding of how the traditional business functions are integrated in the workplace. Students review key principles in accounting, business processes, finance, management, marketing and operations within the context of project management.  They will analyze the problem facing the client company, develop and evaluate a set of alternative solutions and present a program of recommendations to the sponsoring organization at the end of the semester. The project enables teams to analyze real firms' potential to introduce new goods and/or services, introduce existing goods and/or services to new markets, and/or develop other growth opportunities, as well as to present a business proposal. ",GB,GB320
 Global Strategy,"GB410 Global Strategy Prerequisite(s): GB 310 & (Corequisite or Prerequisite GB 320)Global strategy focuses on the role of the general manager or top management team in formulating and implementing short and long-term business and corporate level strategies. In business, strategy is formulated in a multi-faceted, international environment of social, political, economic, and legal entities. In global strategy students will be analyzing the internal and external environments of the organization, formulating recommendations with respect to actions firms can take to enhance firm-level performance and sustainable competitive advantage, and suggesting ways in which those actions can be implemented which recognizing the critical long and short-term implications of their recommendations for the total enterprise. ",GB,GB410
 Cost Management,"AC310 Cost Management Prerequisite(s): GB 202 or GB 212Introduces the concepts of cost management and strategic cost management. Presents comprehensive coverage of principles involved in the determination of the cost of a product or service. Covers operational budgeting, standard costing, and activity-based costing as tools for planning and control. Emphasizes analysis, interpretation and presentation of information for management decision making purposes, especially those decisions as they relate to cost management. ",AC,AC310
 Financial Accounting and Reporting I,"AC311 Financial Accounting and Reporting I Prerequisite(s): GB 202 or GB 212Note: Not open to students who completed AC 211. Students will not receive academic credit for both AC 311 and AC 260.First in a two-course sequence of financial accounting courses at the professional level. Examines the principles and practices of external financial reporting, with particular emphasis on balance sheet valuations and their relationship to income determination. Reviews basic accounting concepts and the essentials of the accounting process. Covers the application of present value techniques to accounting valuations. Studies in depth the measurement and disclosure problems associated with cash, receivables, inventories, fixed assets and intangibles. Alternative accounting procedures and their impact on financial statements are also examined. ",AC,AC311
 Financial Accounting and Reporting II,"AC312 Financial Accounting and Reporting II Prerequisite(s): AC 311Note: Not open to students who completed AC 212Continues the two-course sequence begun in AC 311 by exploring additional topics involving external reporting and disclosure. Covers, in depth, such topics as current liabilities, long-term debt, stockholders' equity, earnings per share, revenue recognition, accounting for income taxes, accounting changes, and Statement of Cash Flows. ",AC,AC312
 Governmental and Not-for-Profit Reporting,"AC331 Governmental and Not-for-Profit Reporting Prerequisite(s): GB 202 or GB 212Introduces financial and reporting issues related to state and local government and nonprofit organizations. Deals with the preparation, analysis and interpretation of financial statements. The course incorporates a project to enrich the student's classroom experience. Students research, analyze, and interpret the financial performance of an actual governmental or nonprofit organization. Web sites unique to governmental and nonprofit organizations are used in the course. ",AC,AC331
 Fraud Examination,"AC332 Fraud Examination Prerequisite(s): GB 202 or GB 212Fraud Examination introduces concepts and techniques useful for accountants, managers, business owners, and criminal investigators.  The course covers many types of financial statement fraud, including asset misappropriation, fraudulent financial statements, tax fraud, and electronic fraud.  Topics include the detection, prevention, investigation and resolution of various types of fraud, and guest speakers and videos will be used to enhance the real-world nature of the course. ",AC,AC332
 Accounting Information Systems,"AC340 Accounting Information Systems Prerequisite(s): AC 311 (CPR) and GB 310 (CPR)Prepares students to be effective users, evaluators, developers, and auditors of accounting information systems (AIS). Examines several typical business processes, such as order entry/sales, billing/accounts receivable/cash receipts, and purchasing/accounts payable/cash disbursements and their associated AIS. Major themes throughout the course include oral and written communication, objectives and procedures of internal control, typical business documents and reports, proper system documentation through flowcharts and other techniques, systems analysis and design methodologies, and assessment of information processing in support of operational and strategic objectives in the context of rapidly changing technology advances. Hands-on experience with the process and control implications of enterprise systems coupled with an in-depth field-based business process analysis gives the student exposure to state-of-the-art AIS. ",AC,AC340
 Federal Taxation,"AC350 Federal Taxation Prerequisite(s): GB 202 or GB 212Note: Not open to students who completed AC 352Gives a broad training in federal income tax law and Treasury Department regulations. Introduces a broad range of tax philosophy, tax concepts, and types of taxpayers. Emphasizes the role of taxation in a business decision-making environment for all types of entities. Introduces basic skills of tax planning and tax research. ",AC,AC350
 International Accounting,AC381 International Accounting Pre or Corequisite(s): AC 312 or with permission of instructorProvides an overview of the unique accounting problems and issues posed by an international business environment. Examines the causes of international accounting diversity and its implications for financial analysis. Presents the external financial reporting and management control systems issues faced by multinational enterprises. ,AC,AC381
 Seminar in Accounting,AC402 Seminar in Accounting Prerequisite(s): Department chairperson's permissionNote: Not offered regularly.  Check with department chair for availability.Offers opportunity for advanced students to study selected topics in small groups. Allows repetition for credit. ,AC,AC402
 Advanced Accounting (Formerly AC 320),"AC412 Advanced Accounting (Formerly AC 320) Prerequisite(s): Junior-level standingPre or Corequisite(s): AC 312 (or AC 212)Note: Not open to students who completed AC 320Presents the theory and related problems of specialized topics in financial accounting. Examines leases, pensions, investments, and the particular problems associated with the partnership form of business organization. Topics also include business combinations through purchase and pooling of interests, with emphasis on consolidated financial statements of parents and subsidiaries and elimination of intercompany transactions; and accounting for foreign operations. ",AC,AC412
 Internship in Accountancy,"AC421 Internship in Accountancy Prerequisite(s): By the beginning of the internship period, the student must have completed 10.5 credit hours of accounting (including GB 201 and GB 202) or (GB 112 and GB 212). In addition, two semesters of full-time course work, including a minimum of six credit hours in accountancy, must be completed at Bentley.The course is open to superior students recommended by a committee of the Accountancy Department. Involves each student in an internship of a minimum of three months' duration in the spring semester of the junior year, the summer following junior year, or the fall of senior year. Provides the interning student with a valuable experiential learning opportunity. Includes on-the-job training in either public, corporate or government accounting. Requires the student to work closely with a faculty adviser to develop a term project related to the work experience and to complete other relevant academic assignments. ",AC,AC421
 Design and Control of Data and Systems,"AC440 Design and Control of Data and Systems Prerequisite(s): AC 340Develops an integrating framework to illustrate the evolving role of current and emerging information technologies in supporting accounting and business activities. Students explore several current issues, including data and knowledge management, using contemporary tools to capture, store, retrieve and analyze data; the design and control of complex information systems, such as a networked interorganizational system; and an overview of assurance services. A group project showing the integration of all the major business processes in a typical business provides a capstone experience. ",AC,AC440
 Advanced Federal Taxation,"AC450 Advanced Federal Taxation Prerequisite(s): AC 350Note: Not open to students who completed AC 362Examines tax topics for corporations, partnerships and proprietorships at a more complex level. Focuses on a life-cycle approach for each of the entities. Includes, at a basic level, topics of estate and gift tax and tax-exempt entities. Reinforces competent tax research and tax planning skills. ",AC,AC450
 Financial Statement Auditing,"AC470 Financial Statement Auditing Prerequisite(s): AC 311 and AC 340Note: Not open to students who have previously taken AC 371 or AC 400 or AC 471Develops an understanding and appreciation of the philosophy of the audit process and its practice.  Presents the preparation of audit working papers supporting an examination of the records and procedures of an enterprise.  Covers the report and opinion of the auditor to management, stockholders and others.  Discusses internal auditing procedures as opposed to those performed by the independent public accountant.  Considers the ethical and legal responsibilities of the auditor.  Includes an introduction to operational auditing as a tool to increase the efficiency and effectiveness of a firm's accounting system. ",AC,AC470
 Internal Auditing,"AC472 Internal Auditing Prerequisite(s): AC 311 and AC 340Develops an understanding and appreciation of the role of internal auditing in an organization. Discusses the operational approach of the internal auditor in areas such as purchasing, production, personnel, financial management, computer operations and international operations. Considers the planning and organizing of an internal audit department and coordination with the outside auditor. Uses sampling and statistical techniques and various software packages available to the internal auditor. ",AC,AC472
 Information Technology Auditing Principles and Practice,"AC475 Information Technology Auditing Principles and Practice Prerequisite(s): AC 470 or AC 472Note: Not open to students who completed AC 477 or AC 478Introduces three typical aspects of information technology (IT) audits: the audits of computerized information systems, the computer facility, and the process of developing and implementing information systems. Through readings, case studies, exercises, and discussion, students will learn to plan, conduct, and report on these three types of IT audits. Additional topics may include challenges posed by emerging information technologies, advanced audit software, business continuity planning, and the role of the IT auditor as an adviser to management. ",AC,AC475
 Performance Management and Evaluation,"AF450 Performance Management and Evaluation Prerequisite(s): FI 380Modern finance professionals need to evaluate the effectiveness of business strategy, which is very reliant on the way companies manage their internal processes and external opportunities to accomplish strategic objectives. Students will develop the necessary business analysis skills and be given the opportunity to apply them to business situations in this course. ",AF,AF450
 Law and Society,"LA101 Law and Society Note: May be used as social science, art science or unrestricted elective.This course explores the subject of law and the social order. It illustrates how changes in our laws reflect changes in society and vice versa. In this way, the course provides a focused study of the law as a dynamic force in social change.  It presents tangible examples of the power (and the limits) of law to address contemporary social problems. Themes of the course include: the legal ramifications of membership in certain societal groups (e.g. non-citizens, homeless, mentally ill, criminals); the legal impact of changing religious demographics and social attitudes (e.g., euthanasia, legalization of marijuana and/or prostitution, LGBTQ rights); and the legal impact of STEM advances (e.g., guns, reproductive rights, education). Students will learn to critically examine current laws as well as to articulate suggestions for improvements to these that will be true to our constitutional framework. ",LA,LA101
 Environmental Law,"LA102 Environmental Law Prerequisite(s): GB 103 or GB 110Note: May be used as social science, art science or unrestricted elective.This course will discuss the origins, history and trends that have evolved in environmental law.  It will explore the basic legal and ethical issues related to environmental law with major emphasis on how these issues, and the applicable laws, past and present, impact the business and personal environments. The course will focus on relevant statutes and laws at the federal, state and local levels of government. Important federal and state case decisions will also be discussed. The course will attempt to put into perspective the extent of the impact environmental laws have on society and business as the attempt to protect and preserve the environment from the effects of global warming and other threats continue to be a major concern to life as we know it. ",LA,LA102
 Gender and the Law,"LA104 Gender and the Law Prerequisite(s): GB 110Note: May be used as social science, art science or unrestricted elective.Explores the law both as a force in maintaining the second-class citizenship of women and as a tool in dismantling gender discrimination throughout society. Examines ways in which the law, in the name of patriarchy and protection of women, has been unfair to men. Reviews legal milestones in women's history whereby women gained such rights as the right to vote, to serve as jurors, to serve in the military. Studies the evolution of law as a tool for empowerment of women from early caselaw through modern statutes that seek to prevent gender discrimination in such societal arenas as the workplace, education, and health care. Addresses what many believe is the failure of the legal system to adequately handle areas in which women arguably have unique needs, by examining such topics as the laws surrounding pregnancy, rape and domestic violence. ",LA,LA104
 Race and the Law,"LA105 Race and the Law Prerequisite(s): GB 110Note: May be used as social science, art science or unrestricted elective.Examines the role of the law both as a force in maintaining the second-class citizenship of racial minorities and as a tool in dismantling racial discrimination throughout society. Considers the law as an instrument of oppression of racial minorities through historical reviews of laws and court decisions that have treated whites and non-whites differently; examines legal efforts to liberate and empower racial minorities. Focuses on selected topics particular to Native Americans, Asian Americans, Hispanic/Latino Americans, and African Americans, as well as legal issues common to all racial minorities (hate crimes, housing segregation, equal education opportunity, discrimination in the criminal justice system, workplace discrimination, affirmative action). Looks at the intersection of gender and race to identify issues unique to female members of racial minorities. ",LA,LA105
" ""Outsiders"" and the Law","LA106 ""Outsiders"" and the Law Prerequisite(s): GB 110Note: May be used as social science, art science or unrestricted elective.This course provides a focused study of the law as a dynamic force in social change by examining law as both an instrument of institutionalized oppression and a tool for liberation and empowerment of oppressed groups-those ""outside"" the majority.  This particular course will focus on traditionally disenfranchised groups other than women and racial minorities. (For a parallel study of these groups, the Law Department offers LA 104, Gender and the Law, and LA 105, Race and the Law, respectively.) Groups studied in this course include: religious minorities, the physically challenged, the elderly, minors (including students), gay and bisexual persons, non-citizens, the homeless, the mentally ill, and criminals. The course will address the law's historical and current role both in maintaining the second class citizenship of these groups and in dismantling discrimination against them. ",LA,LA106
 Moot Court,"LA108 Moot Court Prerequisite(s): GB 110 or LA 101Note: May be used as social science, art science or unrestricted elective.This upper-level law course simulates a moot court exercise as conducted in law school. In the course, you prepare and present a legal argument before a simulated appeals court. Working in teams of two, you are assigned a contemporary legal problem, which you are required to analyze, research, prepare, and argue. Argument is made both in writing with the submission of a formal legal memorandum and orally in a simulated appellate court setting. The course also includes a visit to the Supreme Judicial Court of Massachusetts where students observe an actual hearing. ",LA,LA108
 English Origins of the Law,"LA145 English Origins of the Law Prerequisite(s): (Formerly ID 245)  Instructor permission required.Note: Includes travel to England dudring Spring break.Students study the developments in early English history that form the basis of the American common law system. As part of the study students travel to London during spring break to enrich their understanding of this English foundation by visiting places and people relevant to course materials. The materials are in the form of readings, case studies, and discussion that focus on the period 1066-1215. Specifically, topics include the historical origins of the common law system under Henry II and the establishment of limits on royal authority under Magna Carta. These topics are developed in relation to the kings interest in protecting real property rights and protecting individuals from criminal activity, both of which came to be the basis of common law jurisdiction in the royal courts. ",LA,LA145
