Course Title,Course Description,Course Areas,Course Id
 Continuous Probability for Risk Management,"MA263 Continuous Probability for Risk Management Prerequisite(s): (GB 210 or GB 213) and (MA 139 or MA 141)This course focuses on concepts and techniques of continuous probability and their applications to risk management in insurance and finance. Among other topics, the most commonly used single- and multi-variable continuous probability distributions are addressed. Concepts are illustrated with a large number of applied risk management problems. Calculus tools such as single and double integration are used extensively. ",MA,MA263
 Discrete Mathematics,"MA267 Discrete Mathematics Prerequisite(s): MA 126 or MA 139 or MA 141In contrast to the continuous real number line from calculus, ""discrete"" mathematical structures are made up of distinct, separate parts. The instructor chooses a few topics to cover from the many available discrete mathematics topics, including mathematical language and syntax, proofs and logic, circuits, cryptography, graphs (i.e., relationships among people, agencies, machines, etc.), number theory, combinations and permutations, etc. The relationship of mathematics to computer science features prominently. ",MA,MA267
 Selected Topics in the Mathematical Sciences,"MA280 Selected Topics in the Mathematical Sciences Prerequisite(s): Prerequisites will be announced at registration depending on the particular topic being addressed.Note: With department approval,  MA 280 may be taken more than once.Examines a particular area of mathematics or its applications. May include such topics as the use of mathematical models in environmental science, the history of mathematics, elementary measure theory or financial mathematics. The topic will be announced prior to registration. ",MA,MA280
 Mathematical Logic,"MA305 Mathematical Logic Prerequisite(s): Completion of any freshman mathematics sequenceNote: This course is also listed as PH 305; it can be used as either a philosophy or mathematical sciences elective depending on which designator the student chooses at registration.Mathematics analyzes the world in a precise, quantitative way.  Mathematical logic applies that same precise analysis to mathematics itself.  Analysis of mathematical formulas, how they are constructed and how they relate, lead to the two most famous formal reasoning systems, classical propositional logic and classical predicate logic.  Arguments constructed through formal reasoning in these systems are compared to informal reasoning. Examples of logic in algebra and the foundations of calculus lead to consideration of historically important questions such as, ""Do we know that the generally accepted rules for reasoning are correct, or reliable?""  This leads to the study of historical roots of non-classical logics and their relationship to computer science. ",MA,MA305
 The Mathematics of Computer Graphics,"MA307 The Mathematics of Computer Graphics Prerequisite(s): MA 123 or MA 131 or MA 141This course introduces mathematics for analyzing and describing images and scenes. Manipulations of two-and three-dimensional figures and spaces are analyzed using geometry, vectors, matrices and polynomials. A significant aspect of the course involves using these mathematical methods to generate images and animations that are both attractive and informative. ",MA,MA307
 Game Theory,"MA309 Game Theory Prerequisite(s): 6 credits of mathGame theory is the study of strategic behavior of rational actors who are aware of the interdependence of their actions. Course topics include the extensive form tree representation and the key concepts of strategy space and strategy profile. The normal form game representation is developed and illustrated with classical games such as the Prisoner's dilemma and Hawk-Dove. The discrete probability model is developed and applied to the concepts of player beliefs and mixed strategies. Solution concepts for games such as dominance and iterated dominance, best response curves, Nash equilibrium and security strategies are developed and compared.  Additional topics may also be included, such as evolutionary games and fair division strategies. ",MA,MA309
 Actuarial Topics in Probability and Risk Management,MA310 Actuarial Topics in Probability and Risk Management Prerequisite(s): MA 233 and (MA 243 or MA 263)An advanced course focused on further developing fundamental tools in discrete and continuous probability necessary for the analysis and solution of risk management problems. Significant time is spent examining complex problems and determining which mathematical technique(s) to apply. Success in mastering the techniques presented requires a substantial commitment to independent study.  Students doing well in this course should be prepared to take the Society of Actuaries Exam P (Probability) or Casualty Actuarial Society Exam 1. ,MA,MA310
 Financial Calculus and Derivative Pricing,"MA335 Financial Calculus and Derivative Pricing Prerequisite(s): (MA 139 or MA 141) and (GB 210 or GB 213)This course provides an introduction to the basic mathematical concepts underlying the famous Black-Scholes-Merton option pricing formula and the associated financial market model, including model limitations and alternatives.  Selected topics from ordinary differential equations, probability theory and statistics are used to develop and analyze the economic concepts. Hedging strategies and portfolio sensitivity parameters associated with options are also developed and discussed. ",MA,MA335
 The Mathematics of Discrete Options Pricing,"MA343 The Mathematics of Discrete Options Pricing Prerequisite(s): 6 credits of mathThis course is devoted to basic principles and techniques of no-arbitrage discrete derivative pricing. Using elementary probability and linear algebra, the binomial option pricing model is developed. No-arbitrage option pricing and hedging are addressed using binomial trees. Real market data is used to explore the computational aspects of options pricing. This course should be of interest to strong math students who would like to see how fundamental mathematics is applied to a significant area of finance and to strong finance and economics students who would like to better understand the concepts behind the standard options pricing models. ",MA,MA343
 Data Mining,"MA347 Data Mining Prerequisite(s): GB 213This course will introduce participants to the most popular data mining techniques, withan emphasis on getting a general understanding of how the method works, how toperform the analysis using suitable available software and how to interpret the results in abusiness context. Topics will include linear regression models, logistic regressionmodels, association rules analysis (also known as market basket analysis), clusteranalysis, k-nearest neighbors, decision tree analysis, and Nave Bayes. Additionaltechniques may be introduced if time allows. ",MA,MA347
 Mathematical Theory of Interest,MA357 Mathematical Theory of Interest Prerequisite(s): MA 139 or MA 141Note: We recommend that students preparing for Exam FM/2 also take MA 335The theory of interest addresses the critical financial question of determining the value of a stream of cash flows. This is a problem-solving intensive course aimed at preparing the highly motivated student for the interest theory portion of the Society of Actuaries Exam FM and the Casualty Actuary Society Exam 2.  Emphasis is placed on learning efficient and effective techniques for solving interest theory problems. ,MA,MA357
 Models for Financial Economics,"MA370 Models for Financial Economics Prerequisite(s): MA 233 and MA 335This course will develop the students knowledge of the theoretical basis of certain actuarial models and the application of those models to insurance and other financial risks. The topics covered include rational valuation of derivative securities using the binomial as well as the Black-Scholes option pricing models; risk management techniques (such as delta-hedging); interest rate models as well as elements of Stochastic Calculus.This is an intensive problem-solving course aimed at helping highly motivated students prepare for Exam MFE, the financial economics portion of the third exam offered by the Society of Actuaries (SOA) and the Casualty Actuarial Society (CAS).  The ideal candidate will have passed Exam P/1 and/or Exam FM/2 prior to taking this course and be willing to invest the extensive time and effort required to pass Exam MFE. ",MA,MA370
 Models Life Contingencies I,"MA375 Models Life Contingencies I Prerequisite(s): MA 310 and MA 357Note: Formerly MA 402The goal of this course is to develop student knowledge of the theoretical basis of life contingent acturial models and the application of these models to insurance and other financial risks. Specific topics include the mathematics of survival distributions, life tables, life insurances, life annuities, benefit premiums and premium reserves. Emphasis will be placed on developing familiarity with the theory behind these acturial models. This is an intensive problem-solving course aimed at helping highly motivated students prepare for Exam MLC, the life contingent modeling exam offered by the Society of Actuaries (SOA). ",MA,MA375
 Models Life Contingencies II,"MA376 Models Life Contingencies II Prerequisite(s): MA 375Note: Formerly MA 402The goal of this course is to develop student knowledge of the theoretical basis of life contingent acturial methods and the application of those models to insurance and other financial risks. Specifics topics include discrete and continuous Markov models, multiple decrement models, multiple life models, universal life models and profit tests. Emphasis will be placed on developing familiarity with the theory behind these acturial models. This is an intensive problem-solving course aimed at helping highly motivated students prepare for Exam MLC, the life contingent modeling exam offered by the Scoiety of Actuaries (SOA). ",MA,MA376
 Directed Study in Mathematical Sciences,MA401 Directed Study in Mathematical Sciences Prerequisite(s): Junior- or senior-level standing and department chairperson's permissionPermits superior students to study special topics. (May be repeated for credit.) ,MA,MA401
 Seminar in Mathematical Sciences,MA402 Seminar in Mathematical Sciences Prerequisite(s): Junior- or senior-level standing and department chairperson's permissionNote: Not offered regularly.  Check with department chair for availability.Permits small-group study of selected topics by advanced students. (May be repeated for credit.) ,MA,MA402
 Internship in Mathematical Sciences,"MA421 Internship in Mathematical Sciences Prerequisite(s): Junior-level standing, 3.0 cumulative average, and permission of mathematical sciences internship coordinator.An internship provides the student with an opportunity to gain on-the-job experience and apply principles and issues raised in the academic discipline to a work environment. The student is required to attend pre-internship workshops sponsored by the Center for Career Services, meet regularly with a faculty adviser, and develop a final paper or special project. ",MA,MA421
 Applied Business Statistics,"ST242 Applied Business Statistics Prerequisite(s): (MA 126 or MA 139 or MA 141) and (GB 210 or GB 213)Presents a practical development of several advanced methods of statistical inference that are useful in a wide range of business contexts. Topics include multiple regression and correlation analysis, analysis of variance, contingency tables and the chi square test for independence and statistical decision theory. Considers additional topics such as time series analysis and forecasting, non-parametric statistics, index numbers and survey sampling. The computer is used throughout the course as a means to efficiently solve practical problems. ",ST,ST242
 Astronomy: Solar System,"NASC100 Astronomy: Solar System Note: Satisfies 4-credit Natural Sciences requirement.The astronomer's role has changed drastically during the past two millenia, from analyzing the motions of the planets, to theorizing about Earth's place in the universe, to directly observing and analyzing astronomical objects with telescopes and space probes. Using a variety of approaches, we will examine the tools and methods of the astronomer, and apply them in fully surveying solar system objects. Students will gain insight into the role of modern astronomy, through both telescopes and NASA, in both the scientific world and in areas of business. The Earth's atmosphere, interior, climactic, and 21st century environmental issues facing our planet will also be covered, as well as how studying other planets provides key insights to better understanding the Earth. ",NA,NASC100
 Astronomy: Stars & Universe,"NASC101 Astronomy: Stars & Universe Note: Satisfies 4-credit Natural Sciences requirement.While most students are somewhat familiar with the inhabitants of the solar system: planets, moons, and comets, very little attention is given to the subject of the stars in the pre-collegiate curriculum. This course introduces the student to a subject that makes up more than two thirds of  the effort of the observational and the theoretical astronomer.  It stresses not descriptive detail, but the ""detective"" aspect of the science: the how, why and what for, and the application of various discoveries to extract further understanding. In addition, astronomy beyond the solar system provides the scientist with a laboratory for energetic phenomena that cannot be reproduced on earth and can tell us about the ultimate nature of matter both at the subatomic and at the cosmic levels. ",NA,NASC101
 Human Biology,"NASC110 Human Biology Note: Satisfies 4-credit Natural Sciences requirement.Introduces students to the essential mechanisms of human biology and their applications. The course builds an understanding of how complex human systems represent consequences of the genes comprising the human genome and their expression, the functions of biological pathways, and the electrochemical properties of cells. An understanding of these mechanisms on a molecular level is applied to explore mechanisms of health and disease, recent scientific discoveries, the development of biopharmaceutical products, and controversies in biomedicine. The emphasis on this course is on the understanding the broad applicability of basic biological mechanisms to issues of personal, temporal, or business interest. ",NA,NASC110
 Green Biology: Ecological and Botanical Connections,"NASC111 Green Biology: Ecological and Botanical Connections Note: Satisfies 4-credit Natural Sciences requirement.Ecological and botanical examples and models will provide connections to basic concepts of biology. These concepts will be investigated through lectures, field trips, laboratory exercises, demonstrations, computer simulations, and internet resources. For example, cell structure and function and resulting tissues will be related to sources of economically important botanical products and primary productivity in ecosystems. Natural selection and genetic inheritance will be applied to plant breeding, conservation of genetic diversity, and management of natural and human-made ecosystems. Topics related to the study of human populations will include population growth rates, complete nutrition from botanical sources, spread of disease, and environmental impacts. Throughout the course an understanding of the evolutionary implications of past environments, species interactions, and human activities will be emphasized. ",NA,NASC111
" Evolution, Human Genetics and Behavior","NASC112 Evolution, Human Genetics and Behavior Note: This is an Honors-only courseIn this interactive honors seminar, students critically analyze in papers and student-led class discussions readings from a wide variety of sources not normally used in traditional science classes.  In readings about the Salem witch trials, satanic cults, recovered memories of abuse, UFOs, and the FDA drug approval process, students examine the scientific process. Students will critically debate the application of evolutionary thinking to modern problems in evolutionary psychology and behavioral genetics: Is there an evolutionary explanation for rape?  Is there a gay gene?  Each student will be responsible for collaboratively teaching one seminar focused on one gene or group of genes on one chromosome as a means to understand a basic concept of human genetics, including its potential application to a wide range of other topics. ",NA,NASC112
 Chemistry of Sustainable Products,"NASC121 Chemistry of Sustainable Products Note: Satisfies 4-credit Natural Sciences requirement.Provides a secure foundation of the principles of chemistry as they are applied to the study of consumer materials. To gain an understanding of the role of chemicals in consumer materials, students will investigate the composition and properties of selected consumer products. Of special interest and consideration are the potential toxicity of all chemicals, the basic nutritional value of food, the function of food additives, the role of pesticides in pest control, the positive and negative attributes of drugs, the composition of cosmetics, the carbon-based fuels, and the utility of household chemicals. Brand comparisons are conducted in the laboratory by exploring the ingredients and the properties of selected consumer products. ",NA,NASC121
 Environmental Chemistry,"NASC122 Environmental Chemistry Note: Satisfies 4-credit Natural Sciences requirement.Explores the nature of environmental problems through chemistry.   Students examine the movement and change of matter in order to understand the relationships among air pollution, water pollution, greenhouse gas emissions, climate change and energy production.  In the laboratory, students conduct analyses of air and water samples and produce alternative fuels like ethanol and biodiesel. ",NA,NASC122
 Principles of Geology,"NASC130 Principles of Geology Note: Satisfies 4-credit Natural Sciences requirement.Introduces the basic principles of geology and the societal relevance of the discipline through classroom discussions and laboratory activities. Exploration centers on the process of scientific inquiry, building around systems of plate tectonics and the rock cycle, followed by an examination of Earth's surficial processes, including the role of water, ice, wind, and gravity in breaking down, transporting, and depositing Earth materials. Specific topics include the origins and classification of rocks and minerals, earthquakes, volcanoes, geologic time, rivers, glaciers, and coastal processes. Throughout the course students relate Earth processes and materials to human concerns, such as natural hazards, environmental degradation, and economic resources. ",NA,NASC130
 Energy And The Environment,"NASC140 Energy And The Environment Note: Satisfies 4-credit Natural Sciences requirement. Formerly Environmental Physics.Earth is a dynamic planet. The changes that occur, regardless of duration,magnitude or location, are the direct result of energy transformations between systems, both natural andmanmade. As science and technology evolve, we develop a deeper understanding of how energy is adriving force to human life, our businesses, and the natural processes that shape the Earth. This coursewill examine how energy molds the built and natural environments and the behavior at the interfacebetween the two systems. We will study these systems using a triple bottom line approach to trackingenergy flows, assessing the impact of energy use, and making informed energy decisions throughinteractive classroom discussions, laboratory exercise, and an embedded research experience. Finally, wewill study how technology is enabling more innovative solutions to address the transdisciplinary problemsassociated with energy use and its connection to climate change. ",NA,NASC140
 Planetary Exploration in the Space Age,"NASE301 Planetary Exploration in the Space Age Prerequisite(s): NASC 100, 101, or 140Note: Satisfies the MA/NS or Arts and Sciences elective requirementThis course carefully examines our successful interplanetary space missions which image planets and their systems, measure their astronomical characteristics, and establish their histories and evolution.  A key theme in these investigations is a detailed study of the Earth, in order to perform ""comparative planetology"" with other planets.  Various themes in this comparison approach include planetary formation, temperature and environment, atmosphere and greenhouse effects, Terrestrial evolution and sustainability, magnetic fields, and planetary mass consequences.  The most recent NASA missions, including those to Mars, Jupiter, and Saturn, will be covered in great detail.  Topics include their technologies, flight paths, scientific goals and results, and key business aspects relating to their funding, construction, and operation. ",NA,NASE301
 Life in the Universe,"NASE303 Life in the Universe Prerequisite(s): Any NASCNote: Satisfies the MA/NS or Arts and Sciences elective requirement.To better understand where we should search for life beyond Earth, we must first establish the key astronomical characteristics which support Earths sustained habitability. This quest continues by studying Venus and Mars, the two planets near the Suns habitable zone, as well as several potentially habitable Jovian satellites, using information provided by NASA space probes.Beyond the solar system, stellar and planetary characteristics will be used to evaluate which types of stars might host Earth-like planets, and which of those planets could possibly support life. Incorporating other astronomical, biological, and philosophical concepts, we develop the Drake Equation to estimate the potential number of current, intelligent, communicative civilizations that may exist in the Galaxy right now. We will also examine newly discovered exoplanets, and discuss methods that have been used in attempting to detect signals from extraterrestrial civilizations. ",NA,NASE303
 U.S. Space Program: Going Beyond,"NASE305 U.S. Space Program: Going Beyond Prerequisite(s): Any NASC courseNote: Satisfies the MA/NS or Arts and Sciences elective requirement.The National Aeronautics and Space Administration, better known as NASA,has made substantial contributions to our world, many of which are not known,recognized, understood, or fully appreciated by the general public. This course isdesigned to introduce students to the full scope of the U.S. space program bypresenting NASA's organizational structure, strategic plan and exploration policy,by focusing on its current and future projects in various fields of astronomicalresearch, robotic and human exploration, and by carefully examining its manyachievements that impact society on a daily basis, at the intersection of science,technology, and business. ",NA,NASE305
 Health of Nations:  Anatomy and Function of Health Systems in the Us and Around the World,"NASE308 Health of Nations:  Anatomy and Function of Health Systems in the Us and Around the World Good health systems contribute to the prosperity of nations. The USA stands nearly alone among developed nations in not providing universal health care to its citizens. Although no system is perfect, more than 35 countries rated higher in quality, equity and efficiency than the USA according to a World Health Organization assessment conducted in 2001. Yet Americans pay far more per capita for healthcare than citizens of any other country. What factors account for this disparity? This course will examine how health care is currently delivered in the USA, how this differs from other countries, and what we might learn from other countries about improving our system. Thus, we will compare the strengths and weaknesses of the present US healthcare system to the healthcare experiences of selected countries around the world towards learning what works in other places and what might or might not be applicable here as we move closer to reform. ",NA,NASE308
 The Science and Business of Biotechnology,"NASE309 The Science and Business of Biotechnology Prerequisite(s): GB 112Note: Formerly NSID 305.  Maybe used as an FI, MG or MK  elective with department chairperson's approval or as an MA/NS or Arts and Sciences elective requirement.Integrates science and business in studying all aspects of the current ""biotechnology revolution."" Using the case study method, the formation, organization, production, financing and marketing of biotech companies as well as the selling of biotech products are examined. In addition to lectures, case discussions, guest speakers and a field trip to a local biomanufacturing facility, students will be responsible for one short presentation on a biotechnology company as well as for researching and writing their own due diligence analysis report analyzing one specific marketplace. The potential long-range medical, economic, legal and ethical implications of applying this science are also examined. ",NA,NASE309
