description,title,Notes,Cross Listed Courses,credits,college,Corequisite,department,Prerequisite
"The opportunity to draw away from the confines ofthe school is both a valuable and an expansiveexperience.  Exploration of the city, throughit's parks, libraries, theaters, etc., leads todiscovery of how diverse the drawing experiencecan be. Students learn the skills necessary towork from observation, such as the use ofperspective to more convincingly depict space andthe ability to capture information quickly, inorder to effectively communicate their responses.Students' personal viewpoints, interpretations,and formats for communication are emphasized.",IFNDN1645 Drawing Elective: On-Site/Perspective,,,3,College of Art and Design,,IFNDN - Foundation,
"This course encourages critical thinking about visual culture and its impact on society. Both the means to analyze and discuss personal work in terms of its form, content, and meaning, and the development of a sense of visual acuity occur in this course. A clearer, more concise communication of ideas is enabled while providing a sense of artistic community and professional development.",IFNDN 1650 Visual Culture Seminar,,,3,College of Art and Design,,IFNDN - Foundation,
"This course explores various themes, materials,concepts and styles of drawing. Students have theopportunity to develop personal, subjective imageswithin the boundaries of assignments. Focus is onthe expansion and utilization of drawing skills toaccess personal vision. Drawing skills developedin first semester support the development of workfocusing on Concepts.",IFNDN 1653 Drawing Elective: Conceptual Drawing,,,3,College of Art and Design,,IFNDN - Foundation,
"Planning scenes with figures in environments, both observed and imagined, takes place in this course while examining the gamut of possibilities which arise. Dealing with single and multiple figures, students explore unusual viewpoints, various media, and personal responses to create a story, setting, and mood. Students are encouraged to approach projects within the frameworks of their own professional fields.",IFNDN 1654 Drawing Elective: Figures in Environment,,,3,College of Art and Design,,IFNDN - Foundation,
"This drawing course concentrates on the numerousapproaches to the self-portrait as subject matter.The continuing development of fundamental drawingskills within this context is a primary focus.Special emphasis is, nonetheless, placed onexpanding expressive potential through theexploration of techniques, materials, composition,historical context, and concept. Numerous projectsare done inside and outside of class, culminatingin a life-sized, head to toe self-portrait.",IFNDN 1655 Drawing Elective: Self-Portrait,,,3,College of Art and Design,,IFNDN - Foundation,
"Students make drawings in various media based onimportant perceptual concepts and challenges. Mostdrawings are made from the nude or clothed humanfigure, some from the student146s imagination.Emphasis is placed on developing skills needed tocreate sensitively observed and envisioned imagesand their environments. Some discussion of anatomyis covered. Slides and lectures are included.",IFNDN1656 Drawing Elective: Figure Drawing,,,3,College of Art and Design,,IFNDN - Foundation,
"This course introduces and develops students'understanding of and skill with drawing as a toolfor generating original abstract form toarticulate and discuss ideas. Students willdevelop drawing skills beyond observational toabstract, symbolic, constructivist andspeculative drawing, sketching, diagramming andrendering of simple and complex concepts, events,stories and processes. Student's will explore arange of drawing techniques that enable informaland formal presentation, discourse anddevelopment of original concepts, compositions,constructs and projects. Students will drawcomprehensive and coherent renderings to conveyunderstanding of elements and relationshipsinherent in simple and complex concepts. Studentswill practice habits of keeping a drawingnotebook. Students will present, interpret anddiscuss drawings as tools for testing theunderstanding of ideas and concepts with othersand conducting conversations with others aboutincremental and radical improvements to eachdrawing's effectiveness.",IFNDN1657 Exploratory Drawing,,,3,College of Art and Design,,IFNDN - Foundation,
"Image in Context is a Foundation course based in interdisciplinary practice. The course investigates both the image -- whether found, captured, created, or manipulated -- and its various contexts inclusive of fine arts, pop culture, sub-culture and/or specifically designed for purely communicative purposes. This is a studio course intended to introduce students to fundamental image making establishing the basic formal elements by practice. Through assignments and projects, students will address the following questions: How do images/objects function in our society? How do they accumulate and accrue meaning? How is our understanding of an image shaped by its context? How do different technologies mediate our engagement with images/objects? How do artists and designers use and think about ""imagery"" in their work? Students should see this course as a way to introduce and articulate their ideas through the work that they make and the imagery they archive.",IFNDN1665 Image in Context,,,3,College of Art and Design,,IFNDN - Foundation,
"This course focuses on the evolution of ideas in three-dimensional form in space. Formal issues and construction methods are considered as they arise. Materials may include but are not limited to: wire, wood, paper, cardboard and found objects. Studio work is supplemented by images, research, assigned readings, class discussions and group critiques.",IFNDN 1670 3D Concepts,,,3,College of Art and Design,,IFNDN - Foundation,
"Drawing with a Blade - Paper Cut Art offers anintroduction to history and various regionalstyles of paper cutting, explains anddemonstrates tools and techniques involved,teaches to design with paper shapes in 2-D and3-D and explores applications of paper cut artfor illustration, decoration, stenciling, lightprojection and fine art.",ISTUD 2100 Drawing with a Blade - Paper Cut Art,,,1.5,College of Art and Design,,IFNDN - Foundation,
"This course in stencil cutting and printing offers techniques and various stencil applications. The course offers students a simple technique and its use for self-publishing, t-shirt printing, decoration, etc. The idea of multiplication, repetition and reiteration of powerful image will be emphasized.",ISTUD 2110 Stencil Applications,,,1.5,College of Art and Design,,IFNDN - Foundation,
An examination of observed and imagined perspective. Perspective will be explored as a means of creating space and drama. Besides making connections between working from observation and imagination - demystifying the mechanics of perspective - the course will consider many methods of depicting space. The emphasis will be the artists' personal viewpoints and interpretations: developing a playful interaction between sight and intuition.,ISTUD2200 Perspective Real and Imagined,,,1.5,College of Art and Design,,IFNDN - Foundation,
"Students from any major work both traditionallyand digitally to explore how the properties ofcolor, hue, value, intensity and temperatureimpact the dynamics of subject matter andcontent.  After a series of exploratoryexercises students will develop a project inconsultation with faculty, which will serve as aplatform for this exploration. Through theiterative process students will compare andcontrast outcomes while assessing theeffectiveness their choices have on content.Students will develop a portfolio that includessketches, references, color studies and finalconclusions.",ISTUD2300 Color: Multi Media,,,1.5,College of Art and Design,,IFNDN - Foundation,
"Photography studies begin with this Photography Foundation course. The intention of Lecture & Lab I is to prepare students to deal with a vast palette of traditional, wet lab black & white photographic materials and to serve as the technical complement to the conceptual and critique based Visual Seminar I. In Lecture & Lab I, students learn the basic properties of light, camera and lens functions; control of exposure and development including basic exposure index testing and pushing and pulling of film stocks; basics of B&W printing including split filter printing and print toning; working with available light; and presentation options of the final imagery. The emphasis of this course is to reinforce good overall habits and make high quality negatives as well as fiber-based prints.",IPHOT 1200 Photography Lab I,,,3,College of Art and Design,,IPHOT - Photography,
"This second semester Photography Foundation course is designed to build on the skills developed in Lecture & Lab I and to serve as the technical complement to the conceptual and critique based Visual Seminar II. This course emphasizes the relationships of concept, context, materials, and techniques with particular emphasis on digital imaging, workflow, and printing. Specific areas of study include hand-held metering; working with strobes and flash; introduction to medium format cameras; and an introduction to basic Zone System principles.",IPHOT 1210 Photography Lab II,,,3,College of Art and Design,,IPHOT - Photography,
"This course is a basic, hands-on introduction to the photographic arts. It addresses both technical and aesthetic areas of photographic concern. Beginning with the basic properties of light, this course covers camera and lens functions, basic black and white printing processes, and presentation of the final image. Aesthetic concerns of space, composition, point of view, image rendering, manipulation and the intentions of the artist are covered in class critique.",IPHOT 1220 Introduction to Photo B&W,,,3,College of Art and Design,,IPHOT - Photography,
"Introduction to Photography for Non-Majors: Digital explores the traditional concepts, techniques, and language of photography via the use of contemporary digital technologies.",IPHOT 1240Introduction to Photo Digital,,,3,College of Art and Design,,IPHOT - Photography,
"This is an introductory (I) / intermediate (II) level seminar course in the contemporary, historical, and personal aesthetics of photography. Foundation Seminar is primarily a critique experience. The intention of the course is to investigate the personal, interdisciplinary, and subtle aspects of the medium, to help students become actively engaged with their own creative abilities and vision, and to cultivate, and support artistic risk within a nurturing and demanding environment.",IPHOT 1300 Foundation Seminar I,,,3,College of Art and Design,,IPHOT - Photography,
"This is an introductory (I) / intermediate (II) level seminar course in the contemporary, historical, and personal aesthetics of photography. Foundation Seminar is primarily a critique experience. The intention of the course is to investigate the personal, interdisciplinary, and subtle aspects of the medium, to help students become actively engaged with their own creative abilities and vision, and to cultivate, and support artistic risk within a nurturing and demanding environment.",IPHOT 1310 Foundation Seminar II,,,3,College of Art and Design,,IPHOT - Photography,
"This intermediate Lab course builds on the skills taught in Photo Lab I & II. Students will learn advanced cam-era, lighting and printing techniques in both digital and traditional formats. This course emphasizes the relation-ships of process and materials to create new photographic work. Students will be introduced to and become familiar with large-format cameras.",IPHOT 2005 Photography Lab III,,,3,College of Art and Design,,IPHOT - Photography,You must take IPHOT 1200 and IPHOT 1210 before registering for this course
"Intro to Alternative Photographic Processes is a hands-on and dynamic group learning experience. In this course you will investigate an extensive range of alternative photographic processes from the historical birth of the medium through digital negative production. You will be introduced to a variety of processes including salted paper, gum bichromate, Argyrotype, Kallitype, Cyanotype, Van Dyke, platinum / palladium, Ziatype, albumen, as well as options such as pinhole, Lazertran, and hand applied emulsions. You will see how these concepts, techniques, experiments, and shared ideas will result in new directions for each individual's vision and portfolio.",IPHOT 2100 Intro to Alternative Processes,,,3,College of Art and Design,,IPHOT - Photography,
"This advanced Lab course focuses on digital photography and workflow. Students will learn camera techniques, image preparation and advanced printing processes that are unique to the digital workflow. This course will introduce file management, color calibration and a variety of printing options. Students will learn to use the Digital Darkroom, and this course is required for students to be allowed to work in that space. This course emphasizes process and output, with priority placed on high quality printing.",IPHOT 2015 Photography Lab IV,,,3,College of Art and Design,,IPHOT - Photography,
"This course explores the potential of digital capture and output to transform the medium of color photography both aesthetically and technically. With the creation of the camera raw file format, the traditional pre-exposure concerns of color balance and exposure have now become post-exposure choices for the artist. Color: Digital investigates the artistic implications of this malleability of image capture. The course follows through to improved controls and archival quality attainable in digital color photography.",IPHOT 2120 Color: Digital,,,3,College of Art and Design,,IPHOT - Photography,
"This course is a thorough investigation of the view camera, with emphasis on solving particular technical problems. Students create their own technical resource notebooks as they experiment with the many artistic and technical options available to the photographer.",IPHOT 2150 Large Format,,,3,College of Art and Design,,IPHOT - Photography,
"Taking In introduces students to the professional publishing world. This class focuses on the organization, production, and printing of a photographic magazine. All the preparatory steps are taught, including: digital scanning, book layout, how to communicate with commercial printers and binders, advertising, distribution and exhibition. The class also organizes: a jury to select artwork, a gallery showcase, and gala opening to celebrate the release of the Taking In publication. The class culminates in the final presentation of Taking In: the best of LUCAD Photography, at the opening release party.",IPHOT 2215 Taking In: The Best of LUCAD Photography,,,3,College of Art and Design,,IPHOT - Photography,
"Students explore the nature and possibilities of artist's books as a medium for photographers. Sequencing, theme, techniques for binding books and various forms are considered. Using photographic images and words, students create their own artist's books.",IPHOT 2220 Visual Books I,,,3,College of Art and Design,,IPHOT - Photography,
"This core course examines the practices and philosophies of photojournalism and documentary photography. Areas of study include: freelance magazine and newspaper work, creation and execution of a documentary essay, editing, business practices, and portfolio preparation and presentation. There is a strong emphasis on shooting. Students meet in groups and individually with professors to work towards incorporating the language, skills, and practice of the photojournalist/documentary photographer.",IPHOT 2320 Intro to Documentary,,,3,College of Art and Design,,IPHOT - Photography,
"Students will be placed with families in the villages of San Bartolo, Coyotepec, and Sapata in the outskirts of Oaxaca City, Mexico. Students will be given access to photograph family life, farming, and the parties that inevitably happen! Options include documenting the process of making black pottery or making tortillas, always with a chicken or child underfoot. This course will demonstrate how to gain access to subjects in foreign cultures, how to photograph the daily moments of life in a new way, and how to make strong and intimate documentary photographs. Students will learn how to deal with cultural differences and will have the option of living in the village. This course truly offers an unforgettable experience and portfolio of images.",IPHOT 2321 Documenting Village Life,,,3,College of Art and Design,,IPHOT - Photography,
"This course is an introduction to the major trends in photography and in the cultural context for that photography since the 1970s. Our emphasis will be on identifying major and emerging figures in contemporary photography as well as bright young photographers just gaining attention. We will discuss the technical and philosophical strategies that photographers employ to create work and the concepts they try to tackle through photography. Our emphasis will be primarily on art-oriented and documentary photography, including visits to local museums and galleries, but will investigate photographers that are known for editorial work as well as fine art portfolios.",IPHOT 2330 Contemporary Trends in Photo,,,3,College of Art and Design,,IPHOT - Photography,
"This course introduces students to the work of major 19th century fine art and documentary photographers. The relationship between the concepts driving innovations and the practical, if often elegant, technical solutions arrived at by photography's practitioners is emphasized. Technique demonstrations are also included with various topics of discussion.",IPHOT 2340 Beauty and Fact: 19th Century,,,3,College of Art and Design,,IPHOT - Photography,
"Presents the wide variety of ideas and concepts currently used by photographers. This class will place emphasis on reading, writing and discussion of ideas, as well as visits to museums and galleries and presentations on the topics that are explored. Assignments are structured to encourage a broad understanding of the ways in which these ideas can be incorporated into your working methods.",IPHOT 2410 Sophomore Seminar I: Concepts,,,3,College of Art and Design,,IPHOT - Photography,
"Sophomore Seminar is an examination of the ideas behind photography and art making. This class places an equal emphasis on creative projects, readings on photography and art, visits to museums and galleries, and responses and presentations on the ideas brought forth by our investigations. Assignments are structured to encourage thoughtful, individual responses. The intent of this course is to encourage critical thinking about attitudes towards photography and art.",IPHOT 2420 Sophomore Seminar II: Projects,,,3,College of Art and Design,,IPHOT - Photography,
"This course will examine and explore varied approaches to: the art of cinema, the translation of literature into film and creative visual response. Using the translation of literature into film as a starting point, this course will introduce and illuminate literary and cinematic methods of analysis and re-synthesis. Students will develop an understanding of how creative responses to art can be a source - and resource for personal work. Throughout the semester, students will cull course texts, films and group discussion for themes, concepts and methods to use as a basis for individually designed visual projects.",IPHOT 2460 Cinema and Visual Reaction,,,3,College of Art and Design,,IPHOT - Photography,
"From the beginning of photographic practice, the displacement and reconsideration of the still image has been an ongoing intention. In a studio context this course explores the relationships formed between the still image and dynamic and evolving time-based works as illustrated by artists such as Muybridge, the Bechers, Etienne Jules Marey, Duane Michals, and Sam Taylor-Wood. The course will also encompass the contemporary use of still-based video as generated by contemporary artists in a methodology far different from cinema. The overall intent of the course is to explore the myriad possibilities, both technical and aesthetic, the still image encounters in its relationship to the moving image.",IPHOT 2540 Still in Motion,,,3,College of Art and Design,,IPHOT - Photography,
"This course is a dynamic survey of scientific principles and the photographic works they energize, ranging from macroscopic considerations of the nature of space and time, to microscopic issues of the chemistry of human emotions. Students will gain confidence in their own ability to think about science, will learn basic principles underlying scientific inquiry and modes of knowing, and will directly connect those to their own work as photographers. They will demonstrate this understanding through photographic work, collaborative art/science experiments, and in-class discussions and projects.",IPHOT 2625 Seeing: Photography & Science,,,3,College of Art and Design,,IPHOT - Photography,
"This class explores how the line between fine art photography and commercial fashion is slowly disappearing. Students are encouraged to find their own personal style through examining contemporary fashion photography and its impact on culture. History of the genre and its influences from other media are explored. Class time is divided between lectures, critique, visiting artists, field trips and location shooting.",IPHOT 2660 Fashion: World is Your Studio,,,3,College of Art and Design,,IPHOT - Photography,
"This core course introduces students to the materials, techniques, and practices of professional, commercial, and advertising photography. Focus is on the fundamentals of the studio and the conceptual aspects of professional, commercial, and studio work.",IPHOT 2670 Intro to Commercial Photography,,,3,College of Art and Design,,IPHOT - Photography,
"This core course introduces students to the materials, techniques, and practices of professional, commercial, and advertising photography. Focus is on the fundamentals of the studio and the conceptual aspects of professional, commercial, and studio work. The final outcome of this course is a professional level commercial portfolio.",IPHOT 3025 Commercial Studio,,,3,College of Art and Design,,IPHOT - Photography,
"Students explore the nature and possibilities of artist's books as a medium for photographers. Sequencing, theme, techniques for binding books and various forms are considered. Using photographic images and words, students create their own artist's books.",IPHOT 3110 Visual Books,,,3,College of Art and Design,,IPHOT - Photography,
"This core course examines the practices and philosophies of documentary photography, both historically and with an emphasis on current concerns. Areas of study include: creation and execution of a documentary essay, editing, portfolio preparation and presentation, and a discussion of the related field of photojournalism. There is a strong emphasis on shooting. Students meet in groups and individually with professors to work towards incorporating the language, skills, and practice of the documentary photographer/photojournalist.",IPHOT3115 Documentary Photography,,,3,College of Art and Design,,IPHOT - Photography,
"This course is for students who have taken Visual books, or who have had previous experience in making books. It gives students the opportunity to further develop the skills and techniques learned in Visual Books. This course is useful to students in developing their own writing skills, using writing with other mediums, and as a way to continue creating and inventing their own unique books. The course includes field trips to important collections, as well as visits from book artists in the Boston area.",IPHOT 3120 Visual Books II,,,3,College of Art and Design,,IPHOT - Photography,
"Bringing together majors throughout the college this class will expand upon basic book binding skills to explore new methods of presentation that go beyond conventional techniques of traditional book design and structure. Students will engage in a variety of unusual contemporary practices, such as cut paper, cutting-edge textiles, text & image, and advanced 3-D objects. Students will create work generated by their individual projects, which will investigate conceptually based ideas, embracing alternative materials that challenge the very concept of the book. This studio class will be comprised of demonstrations, critique, survey and field trips to studios, galleries and permanent collections.",IPHOT 3130 Artist's Books,,,3,College of Art and Design,,IPHOT - Photography,
"Photography students meet together as a class to produce an integrated portfolio and to develop technical expertise, insight into their media and personal vision. Finished portfolios are evaluated by faculty members and other photography professionals.",IPHOT 3160 Junior Year Portfolio,,,3,College of Art and Design,,IPHOT - Photography,
"This course is an introduction to the fundamentals of color photography and color theory. We will explore the ways in which color materials respond to light as well as the cognitive, psychological, cultural, and sensory experiences of light and color. Through the use of color analog and digital materials, we will investigate the special problems and possibilities color presents to the artist/photographer. Class time will include lecture, discussion, critique and darkroom.",IPHOT 3201 Color Photography,,,3,College of Art and Design,,IPHOT - Photography,
