description,title,Notes,Cross Listed Courses,credits,college,Corequisite,department,Prerequisite
"This workshop-based course introduces students to the art and craft of writing for children and young adults. By studying the elements that underlie children's and teen literature, students will gain a fuller understanding of what it means to write for these age groups. Students will balance readings that focus on universal themes, common approaches and the essentials of writing, with two research papers in the form of craft annotations, and the preparation of a manuscript, consisting of either two picture books, two short stories or an excerpt from a middle grade or young adult novel.",CCRWT 2400 Art and Craft of Writing Children's and Young Adult Literature,,,3,College of Liberal Arts and Sciences,,CCRWT - Creative Writing,CWRIT 1101 . 
"In CCRWT 2430, students will workshop and edit creative work: fiction, poetry, scripts, essays of their own, as well as the submissions for Commonthought. Students will develop a supportive critical approach in the workshop atmosphere, sharpen their editing skills, learn layout, choose artwork, and assume leadership/editorial roles for the publication of Commonthought.",CCRWT 2430 Magazine Production,,,3,College of Liberal Arts and Sciences,,CCRWT - Creative Writing,CWRIT 1101 . 
"This course is designed as an advanced seminar for students who have completed preliminary study of poetry and are prepared to develop their mastery of the genre. As such, this course will balance an in-depth reading load of the major figures of poetry from the Renaissance to today with intensive individual writing and revision assignments culminating in a portfolio of 20 pages that might be used in part for admission to a graduate program or as the basis for submissions to magazines and/or publishers.",CCRWT 3000 Advanced Poetry,,,3,College of Liberal Arts and Sciences,,CCRWT - Creative Writing,"CCRWT 2310 Art and Craft of Poetry, at least one upper division (3000 or 4000) level CLITR or CHUMS course "
"This course is a continuation of CCRWT 2090 The Art and Craft of Scriptwriting, and is meant for students with a serious interest in and aptitude for the genre. Students will advance their understanding of the form through continued study of master works, regular writing assignments focusing on specific issues of craft, and regular in-class writing workshops, receiving and offering informed critique. Students will have the opportunity to work for much of the semester on conceiving, drafting, revising, and shaping one, full-length dramatic work, encountering and learning to solve challenges associated with writing full-length pieces, including common third-act problems, character development/growth, and tone consistency issues.",CCRWT 3001 Advanced Scriptwriting,,,3,College of Liberal Arts and Sciences,,CCRWT - Creative Writing,"CCRWT 2090 Art and Craft of Scriptwriting, at least one upper division (3000 or 4000) level CLITR or CHUMS course "
"This advanced non-fiction seminar will focus on the three major sub-genres of non-fiction writing: personal essay, the literary memoir, and research-based reporting. Unlike works of fiction, poetry, and drama, non-fiction has a special responsibility of telling a story in an accurate and truthful way: the truth, the whole truth, nothing but the truth. That being said, as soon as one tries to 'translate' her or his personal experience from life to language, many problems of accuracy, art, craft, ethics, and methodologies arise. Alongside our consideration of craft within the course texts, we will also be discussing these hot button issues within the world of non-fiction writing.",CCRWT 3100 Advanced Creative Non-Fiction,,,3,College of Liberal Arts and Sciences,,CCRWT - Creative Writing,"CCRWT 2000 The Art and Craft of Creative Non-Fiction, at least one upper division (3000 or 4000) level CLITR or CHUMS course "
"The Advanced Short Fiction Seminar refines fiction-writing skills developed in The Art and Craft of Short Fiction and prepares the student for graduate-level study in creative writing. Students will be expected to produce a portfolio of at least three short stories. At least 20 pages of this portfolio should be polished enough for inclusion as a writing sample in a graduate school application, or for use in querying magazines, publishers, or literary agents in the pursuit of publication.",CCRWT 3201 Advanced Short Fiction,,,3,College of Liberal Arts and Sciences,,CCRWT - Creative Writing,"CCRWT 2300 The Art and Craft of Short Fiction, at least one upper division (3000 or 4000) level CLITR or CHUMS course "
"This workshop is designed to allow burgeoning writers to explore their lives through autobiographical writing across three major genres: Fiction, non-fiction and poetry. As such, students will be expected to explore the wealth and depth of their unique experience in order to craft works of writing both in and between the three modes. In our individual processes, we will develop strategies of composition and revision that extend, deepen, question and meditate on the authors' real and made autobiographical identities. Extensive reading models across genres intended to guide the students through various nodes and strategies of autobiographic writing will support student writing. The aim of the class is to put together a portfolio of writing that will serve as a sort of photo album of a life.",CCRWT 3300 Autobiographical Writing,,,3,College of Liberal Arts and Sciences,,CCRWT - Creative Writing,"At least one 2000-level CCRWT course, one upper division (3000 or 4000) level CLITR or CHUMS course "
"The Genre Fiction Seminar refines fiction writing skills developed in The Art and Craft of Short Fiction through the discussion, practice, and critique of short stories in a popular genre: science fiction, fantasy, horror, crime/detective, mystery, or suspense/thriller. By studying and practicing those elements that comprise the genre, students will gain a fuller understanding of the nature of short stories and they will engage in a deeper connection with their own writing of the form.",CCRWT 3400 Genre Fiction Seminar,,,3,College of Liberal Arts and Sciences,,CCRWT - Creative Writing,CCRWT 2300 
"This is an advanced writing seminar focused on children's literature. Throughout the semester, we will review the elements of craft that underlie this area of fiction, as well as the genres that comprise the children's book and magazine market. Students will balance an intense reading load focused on universal themes, common approaches and the essentials of writing, with the preparation of two craft annotations, a comprehensive research paper and weekly class-room critiques of student manuscripts.",CCRWT 3450 Advanced Writing Children's and Young Adult Literature,,,3,College of Liberal Arts and Sciences,,CCRWT - Creative Writing,CCRWT 2400 
This course focuses on a specific topic in Creative Writing.,CCRWT 3888 Selected Topics in Creative Writing,,,3,College of Liberal Arts and Sciences,,CCRWT - Creative Writing,
"This course combines a common reading and workshop agenda with ongoing work on an individual creative project in a students primary genre of study. In addition to class meetings facilitated by a primary Course Instructor, this class offers a unique opportunity for students to work individually with a second Faculty Reader who has specific expertise in the students genre. This allows students to gain multiple critical perspectives during the revision process. The class culminates with students giving a public reading and defending their work in a question and answer session.",CCRWT 4000 Senior Seminar in Creative Writing,Restricted to Creative Writing Majors ,,3,College of Liberal Arts and Sciences,,CCRWT - Creative Writing,6 credits of 3000-level CCRWT courses.
"The student prepares a manuscript in their chosen genre of study for submission to publications and/or MFA programs in Creative Writing, working individually with the guidance of an appropriate faculty member. A thesis project proposal, including project description and potential goals for submission / application of manuscript, must be submitted to the department for approval in the semester previous to enrollment. The thesis project is available only to Creative Writing majors who have completed 90 credits, including at least 6 credits of CCRWT courses at the 3000 level. This course may not be elected in the same semester as CLITR 4340, Senior Seminar with Critical Methods. For more detailed guidelines, contact the Humanities Division.",CCRWT 4349 Senior Thesis in Creative Writing,,,4,College of Liberal Arts and Sciences,,CCRWT - Creative Writing,6 credits of 3000-level CCRWT courses 
,CCRWT 4999 *Independent Study in research for personal projects,,,3,College of Liberal Arts and Sciences,,CCRWT - Creative Writing,
This course focuses on a specific topic in Creative Writing.,CCRWT 5888 Selected Topics in Creative Writing,,,3,College of Liberal Arts and Sciences,,CCRWT - Creative Writing,
This course focuses on a specific topic in Dance.,CDANC 1888 Selected Topics in Dance,,,3,College of Liberal Arts and Sciences,,CDANC - Dance,
"This course is designed for training in the fundamental skills of modern dance technique. Students will focus on body awareness and alignment, as well as learning movement combinations that will enhance their understanding of spatial relationships and design. The second objective will be the exploration of creativity and expression through original movement. Students will be expected to work improvisationally and collaboratively in this course. Lastly, through class lecture time, discussion, and readings, students will discuss the historical perspective on the growth of modern dance in the United States. Emphasis will be on the early modern dance pioneers.",CDANC 2000 Modern Dance I,,,3,College of Liberal Arts and Sciences,,CDANC - Dance,
This course is a continuation of work done in Modern Dance I. The course includes a greater emphasis on elements of choreography and an understanding of motion.,CDANC 2002 Modern Dance II,,,3,College of Liberal Arts and Sciences,,CDANC - Dance,
"This course is designed for training in the fundamental skills of swing dance technique. Students will focus on body awareness and alignment, as well as learning movement combinations that will enhance their understanding of proprioception and spatial relationship. The second objective will be the exploration of the dynamics of lead and follow (action and reaction) as they apply to movement. Lastly, through class lecture, discussion, readings, and videos, students will discuss the social/historical perspective of swing dancing in the United States.",CDANC 2005 Swing Dance,,,2,College of Liberal Arts and Sciences,,CDANC - Dance,
"This is a performance oriented dance class in which students will work collaboratively and independently, under the direction of the instructor, to create an ensemble work to be performed at the end of the semester in the Marran Theater. This course focuses on the creative process, as well as performance skills. We will examine other artists' creative processes in the context of developing our own. Readings, video viewings, and written assignments will help students reflect on their experiences from class, as they work to create an ensemble work and develop their own creative style.",CDANC 3190 Advanced Performance Workshop,,,3,College of Liberal Arts and Sciences,,CDANC - Dance,CDANC 2000 or 2001 or permission of instructor
This course focuses on a specific topic in dance.,CDANC 3888 Selected Topics in Dance,,,3,College of Liberal Arts and Sciences,,CDANC - Dance,
This course focuses on a specific topic in drama.,CDRAM 1888 Selected Topics in Drama,,,3,College of Liberal Arts and Sciences,,CDRAM - Drama,
"This course emphasizes the development of acting skills and practical play production in theatre. The goal is to enhance abilities of self-expression and confidence within the theatrical traditions of cooperation, organization, and discipline. A significant proportion of class time will be devoted to projects in which students take part in a variety of ways, including make-up application, directing, design, and set construction, using various media, acting, and stage and house management.",CDRAM 2042 Play Production Projects,,,4,College of Liberal Arts and Sciences,,CDRAM - Drama,
"This course emphasizes the development of acting skills and practical play production in the theater, specifically concentrating on Shakespeare. Students will do an in-depth study of the Elizabethan world, Shakespeare's language, the role of music and dance in the production, and touch on the explosive authorship question. A significant portion of class time will be devoted to Linklater Voice Work, sound and movement, text work, and projects in which students take part in a variety of ways, including design and set construction, sound and light design, acting, and stage and house management.",CDRAM 2050 Play Production: Shakespeare,,,4,College of Liberal Arts and Sciences,,CDRAM - Drama,
"This course is an introduction to the basic principles of acting with an emphasis on voice production and self-scripted autobiographical storytelling. Group and individual exercises are designed to stimulate and develop imagination, physical and sensory awareness, creativity, and the capacity for ensemble work. Techniques for accessing emotional and psychological truth are practiced as the fundamentals of the actor's creative process. Voice work is drawn from Kristin Linklater's Freeing the Natural Voice. Students will perform original material which is based on experiences from their own lives.",CDRAM 2060 Introduction to Voice and Acting,,,3,College of Liberal Arts and Sciences,,CDRAM - Drama,
"This course will introduce students to basic movement and improvisational technique essential to the actor's development. Material covered will include [1] the fundamentals of yoga, balance work, and weight exchange with an emphasis on contact improv and authentic movement skills, [2] basic mime technique and the rudiments of stage combat, and [3] basic character development through movement. Beginning actors will acquire tools which they can directly apply to their work in the Play Production class as well as any other acting experiences.",CDRAM 2070 Movement and Improvisation for the Actor,,,3,College of Liberal Arts and Sciences,,CDRAM - Drama,
"Geared to students who enjoy theater and would like to delve more deeply 'behind the scenes,' this course explores the art and craft of directing and stage management. By studying the philosophy, strategies, and technical concepts of both directing and stage managing, students will gain an understanding of the creativity, discipline, and skills required for these two professional roles. Regular reading, writing, and group assignments will allow students to combine theory with practice as they direct and stage manage scenes from various plays. Students will gain a deeper appreciation of the ways in which theater artists work - and how they work together - to make a play come alive onstage.",CDRAM 2080 Art & Craft of Directing & Stage Management,,,3,College of Liberal Arts and Sciences,,CDRAM - Drama,
"Second-level study and practical experience in the challenges of creating characterization with emphasis on developing vocal and physical skill in acting. Students will continue to build on the craft of acting through the use of exercises, assignments, scene work, play analysis, scansion and theatre attendance.",CDRAM 3000 Acting II,,,3,College of Liberal Arts and Sciences,,CDRAM - Drama,CDRAM 2060 (or equivalent) or permission of the instructor 
This course focuses on a specific topic in drama.,CDRAM 3888 Selected Topics in Drama,,,3,College of Liberal Arts and Sciences,,CDRAM - Drama,
"The student serves as a course assistant to the faculty member who has accepted them. The course includes both studying the process of planning, implementing, and evaluating the course curriculum, and assisting with the preparation and teaching of the course. The course is recommended for students interested in studying a particular subject in more depth, and for those wishing to participate in the planning and teaching process. See Course Assistantships on page xx for details.",CDRAM 4089 Practicum in Curriculum and Procedures,,,3,College of Liberal Arts and Sciences,,CDRAM - Drama,
"An independent study offers students an opportunity to explore a topic not available through the current course offerings, or to explore a subject in greater depth than is possible in a regular course. For more information, see Independent Study guidelines.",CDRAM 4999 Independent Study,,,1-9,College of Liberal Arts and Sciences,,CDRAM - Drama,"30 credit hours, 3.0 cumulative GPA and permission of the instructor and Division Chair "
"This course introduces students to basic economic principles and explores selected contemporary social and political issues in an economic framework. Basic models and principles are explored, as well as topics such as income distribution, taxation, inflation, unemployment, environmentalism, and economic stagnation and growth.",CECON 1101 Introduction to Economics,,,3,College of Liberal Arts and Sciences,,CECON - Economics,
"Microeconomics examines the economic behavior of individual actors - individuals, households, businesses, nonprofit organizations, governments - in order to understand choice in the face of scarcity and the allocation consequences of these choices.This examination is set in the broader context of concern for human well-being.The course covers the basic model of the competitive market, as well as alternative models of market power.",CECON 2101 Microeconomics,,,3,College of Liberal Arts and Sciences,,CECON - Economics,
"Macroeconomics is the study of aggregate economic behavior - determinants of total output and income, determinants of prices and their rate of change, determinants of growth in the aggregate economy.This includes the effects of government policy to achieve full employment, price stability, and economic growth.The study of macroeconomics is set in the broader context of concern for human well-being.",CECON 2102 Macroeconomics,,,3,College of Liberal Arts and Sciences,,CECON - Economics,
This course focuses on a specific topic in economics.,CECON 3888 Selected Topics in Economics,,,3,College of Liberal Arts and Sciences,,CECON - Economics,
"This course introduces aspiring teachers to the role of the school in a multicultural society and helps them develop a professional identity. Issues related to mainstreaming and inclusion are addressed. Through a variety of means which include site visits, speakers and panelists, and case studies, students are introduced to five areas of education: early childhood, elementary, special, middle, and secondary education.Issues related to the integration and inclusion of students with special needs in regular education environments are addressed.Students also expand and develop their critical thinking skills. Field visits/experiences are incorporated into the course throughout the semester.Both a grade of C and successful completion of the field experience are required to advance in the major.","CEDUC 1352 Teaching, Learning and Social Responsibility","Both a grade of C or higher in this course and the successful completion of the early field experience are prerequisites for CEDUC 2351, 2352, 2353 or CSPED 2354",,4,College of Liberal Arts and Sciences,,CEDUC - Education,
"This certificate-specific course lays the groundwork for those preparing to teach in preschools, child care centers, kindergartens, and grades 1-2. The focus is on provision of developmentally appropriate experiences in inclusive settings. Included are strategies for observation and assessment as these are related to the planning of integrated curriculum experiences which are relevant to the needs of children and families with diverse backgrounds. Also considered are the role of play in children's learning, various philosophical models that have impacted the field of early childhood education, and a historical perspective on current programs. A one-day a week field experience is an integral part of this course.Both a grade of C+ and successful completion of the field experience are required to advance in the major.",CEDUC 2351 Early Childhood Education,,,4,College of Liberal Arts and Sciences,,CEDUC - Education,CEDUC 1352 
"The linking of theory and practice, begun in the student's freshman year, is continued with a focus on the elementary school curriculum. Students develop an understanding of the philosophical and historical foundations of education which have influenced the nature of schools today. The academic, social, and emotional needs of all children in our rapidly changing, multicultural society are considered as students learn to plan and teach effective lessons to meet the developmental needs of learners. They also design an interdisciplinary unit of study which can be taught in their field settings. Emphasis is placed on learning the skills of evaluation which are applied in all of their teaching. They learn to reflect critically about their effectiveness and to redesign teaching approaches, based on concrete data. A field experience of one day a week for approximately 10 weeks of the semester is integrated into the course.Both a grade of C+ and successful completion of the field experience are required to advance in the major.",CEDUC 2352 Elementary Education,,,4,College of Liberal Arts and Sciences,,CEDUC - Education,CEDUC 1352 
"This course provides a perspective of the middle school and the high school by examining their historical/philosophical foundations and current reform movement. Emphasis will be placed on curriculum frameworks, curriculum and instruction, structure, and models of assessment. Culture, language, and other aspects of social location will also be considered in light of the adolescent population it serves. The various roles that teachers may perform such as advisor, team leader, and researcher will also be discussed. Field experiences will provide important experiential contexts for understanding ""life"" in the middle and secondary schools.Both a grade of C+ and successful completion of the field experience are required to advance in the major.",CEDUC 2353 Middle and High School Education,,,4,College of Liberal Arts and Sciences,,CEDUC - Education,CEDUC 1352 
"This is a foundational course that provides an understanding of fundamental principles and methods of instruction in reading, writing, listening, and oral communication in early childhood and elementary school settings. Students will explore pedagogy and assessment to meet the needs of diverse students using a balanced literacy framework. Through cognitive apprenticeship, students will analyze, construct, and reflect on instructional methods for teaching phonemic awareness, phonics, vocabulary, fluency, comprehension, guided reading, and writing. Students will synthesize their knowledge through classroom observation and the administration of an informal reading inventory to pinpoint the specific instructional needs of a student. Throughout the course, students will reflect on the implications of a sociocultural view on literacy learning with an eye toward equity, social justice, inclusion, critical literacy, and multicultural education. Students will learn to draw from the Massachusetts English Language Arts frameworks and the Literacy Common Core in order to meet the objectives of the course.",CEDUC 2401 Literacy Learning,This course has assigned to it specific competencies which students must fulfill in order to receive a passing grade.,,3,College of Liberal Arts and Sciences,,CEDUC - Education,CEDUC 1352 . A grade of C+ or higher in this course is a prerequisite to student teaching.
"This course focuses on the research and instructional strategies relevant to content area reading in 5-12 classrooms. The major emphasis is placed on the teaching of reading in the content areas including the introduction of subject area vocabulary, pre-reading skills and activities, building comprehension skills, organizing information, and critical reading. Students examine a variety of methods for determining readability of subject area texts and supplementary materials. The course also includes the stages of the writing process and how those stages help to inform the students' understanding of the content area. Students learn to assess informally the reading and writing ability of pre-adolescents and adolescents. In addition, students learn to design and implement appropriate instructional strategies.",CEDUC 2402 Content Area Reading in Grades 5-12,,,3,College of Liberal Arts and Sciences,,CEDUC - Education,CEDUC 2353 . A grade of C+ or higher in this course is a prerequisite to student teaching. 
