description,title,Notes,Cross Listed Courses,credits,college,Corequisite,department,Prerequisite
"This course surveys the history of the English language from its earliest times to the present, with attention to linguistic structure and form as well as to the social and political forces that have created and are creating the language. With attention to grammatical structure and etymology, the course examines language change though a wide variety of English language texts, including Caedmon's Hymn and the King James Bible. The course also addresses some of the crucial questions that the digital era has brought to the English language.",CLITR 3320 History of the English Language,,,3,College of Liberal Arts and Sciences,,CLITR - Literature,CLITR 1100 
"This course focuses on the close reading and analysis of significant works of American literature from the end of World War II to the present. Due attention will be given to distinguishing the different elements--cultural, literary, personal and historical--that shape the work of writers in this period.",CLITR 3328 Contemporary American Literature,,,3,College of Liberal Arts and Sciences,,CLITR - Literature,CLITR 1100 
"This course explores the works of authors representing the many ethnic communities now comprising the United States: African American, Native American, and Asian American, among others. We will focus on certain questions: what are that group's shared experiences and values, and how do these affect the kind of literature that group writes? What pre-existent literary traditions does that group bring with it, and how are these reflected in the literature? What aspects of the American experience are treated in this literature?",CLITR 3329 Contemporary Ethnic Literature,,,3,College of Liberal Arts and Sciences,,CLITR - Literature,CLITR 1100 
"This course is designed to develop in the student an appreciation of the art and craft of poetry. It will focus on how poets use sound, rhythm, imagery, and other poetic devices to achieve a variety of purposes and effects. Attention will also be given to the evolution of poetic style from the Renaissance through the late twentieth century. Readings will be drawn from a wide variety of British and American poets.",CLITR 3336 British and American Poetry,,,3,College of Liberal Arts and Sciences,,CLITR - Literature,CLITR 1100 
"This course allows students to read and study short stories and novellas of different literatures. They read such characteristic forms of this genre as the fantastic tale, the literary fairy tale, the classical novella and the mystery tale. Students focus upon such central questions as construction of character, the treatment of space and place, narrative point of view, and symbolism.",CLITR 3337 Short Fiction and Novella,,,3,College of Liberal Arts and Sciences,,CLITR - Literature,CLITR 1100 
In this course students read works by and about women to explore the various ways their experience is depicted in literature. Contemporary literary theory dealing with women in literature focuses on certain topics that will guide the course: women and their work in the world; their ascribed place in the social construct; their sustaining friendships with other women; their different biographies or life paths; the distinctive female mind and how it finds expression in literature; and women and their relationships with men.,CLITR 3338 Women in Literature,,,3,College of Liberal Arts and Sciences,,CLITR - Literature,CLITR 1100 
"In this class, students read widely in the work of one major author in the literary tradition. Complementary contemporary texts may supplement the primary readings. At the end of the course, students investigate more recent literature influenced by the major author. The subject of the course changes each year; the course can be taken more than once.",CLITR 3400 Major Authors,,,3,College of Liberal Arts and Sciences,,CLITR - Literature,CLITR 1100 
"This course will examine the ways in which New York City, as the new center of the art world, served as a sort of laboratory for the avant-garde experimentation that defines the art and literature of that time. We will contextualize the New York bohemian tradition and the cultural milieu of the 50s, examine the shift from Paris to New York as ""center,"" analyze the various ""strains"" of the New York avant-garde in the 1950s, consider the multiplicity of art forms influenced by this avant-garde exchange (music, film dance), uncover the lesser known artists and writers of the time (African Americans in the New York School, female painters and poets etc.) as well as consider how these major movements ceded to Pop Art in the visual realm and the Beat Generation in the literary.",CLITR 3500 The New York School and the American Avant-Garde in the 1950s,,,3,College of Liberal Arts and Sciences,,CLITR - Literature,CLITR 1100 
"The Bildungsroman, often defined as the novel of self-development, involves the growth of a young person from adolescence to maturity. The Bildungsroman takes its name from the German bildung (education or development), combined with roman (novel). The term originated in Germany in the latter half of the 18th century with Goethes Wilhelm Meister's Apprenticeship. While the genre has taken on attributes characteristic of specific eras and cultures, critics argue that it shares a defining pattern: a protagonist struggles for intellectual and psychological growth in a society experienced as hostile or indifferent to his or her sensibility and understanding. For this course, we will read examples of the Bildungsroman from various periods and cultures. Novels will be examined not only in relation to the genre, but with respect to the larger societal and cultural dimensions presented in each work. We will also read examples of the Kunstlerroman, a sub-genre of the Bildungsroman that focuses on the development of an individual in the process of becoming an artist.",CLITR 3670 Bildungsroman: Novel of Self-Development,,,3,College of Liberal Arts and Sciences,,CLITR - Literature,CLITR 1100 
This course focuses on a specific topic in literature.,CLITR 3888 Selected Topics in Literature,,,3,College of Liberal Arts and Sciences,,CLITR - Literature,"CLITR 1100 PLUS upperclass standing, OR one 2000-level CLITR course, OR permission of the instructor "
"Through the study of the works of one major author, students engage with a variety of critical techniques to develop their own critical voices and analytical research skills. This writing-intensive seminar prepares students for the work of the seminar paper in CLITR 4340.",CLITR 3900 Junior Writing Seminar on Works of a Major Author,,,3,College of Liberal Arts and Sciences,,CLITR - Literature,Open only to English Majors; 6 credits of 2000-level CLITR courses 
"The student serves as a course assistant to the faculty member who has accepted them. The course includes both studying the process of planning, implementing, and evaluating the course curriculum, and assisting with the preparation and teaching of the course. The course is recommended for students interested in studying a particular subject in more depth, and for those wishing to participate in the planning and teaching process. See Course Assistantships on page xx for details.",CLITR 4089 Practicum in Curriculum and Procedures,,,3,College of Liberal Arts and Sciences,,CLITR - Literature,
This course combines a common reading and discussion agenda with ongoing work on an individual senior project. Students will read critical pieces representing the range of different theoretical approaches to the study of literature and see how these explicate and illuminate the reading done in common.,CLITR 4340 Senior Seminar with Critical Methods,,,3,College of Liberal Arts and Sciences,,CLITR - Literature,6 credits of 3000-level CLITR or CHUMS courses OR permission of the instructor 
"The student chooses a subject for investigation and writes an extensive essay of about forty pages, working individually with the guidance of an appropriate faculty member. A thesis proposal, including project description and preliminary bibliography, must be submitted to the department for approval in the semester previous to enrollment. The thesis project is available only to English majors who have completed 90 credits, including at least 6 credits of CLITR or CHUMS courses at the 3000 level. This course may not be elected in the same semester as CLITR 4340, senior seminar with critical methods. For more detailed guidelines, contact the Humanities Division.",CLITR 4349 Senior Thesis in Literary Criticism,,,4,College of Liberal Arts and Sciences,,CLITR - Literature,6 credits of CLITR or CHUMS courses at the 3000-level 
"An independent study offers students an opportunity to explore a topic not available through the current course offerings, or to explore a subject in greater depth than is possible in a regular course. For more information, see Independent Study guidelines.",CLITR 4999 Independent Study,,,1-9,College of Liberal Arts and Sciences,,CLITR - Literature,"30 credit hours, 3.0 cumulative GPA and permission of the instructor and Division Chair "
"In this class, students read widely in the work of one major author in the literary tradition. Complementary contemporary texts may supplement the primary readings. At the end of the course, students investigate more recent literature influenced by the major author. The subject of the course changes each year; the course can be taken more than once.",CLITR 5400 Major Authors,,,3,College of Liberal Arts and Sciences,,CLITR - Literature,
This course focuses on a specific topic in literature.,CLITR 5888 Selected Topics in Literature,,,3,College of Liberal Arts and Sciences,,CLITR - Literature,
"This course will focus on the importance of mathematics in the modern world. Topics will include logic and problem solving, dealing with data, modeling, and other real world applications. Students will enhance their ability to use concepts, procedures, and intellectual processes specific to quantitative reasoning. As well, students will engage in versatility in approaching and solving problems. Each student will complete an individualized project to study a particular aspect of mathematics in further detail. This course is identical in content and workload to CMATH 1010, and it includes an additional hour of classroom time each week in the lab. Placement in/waiver from this class depends on SAT or ACT math or Lesley Math Assessment scores.",CMATH 1009 Quantitative Reasoning with Lab,This course does not fulfill the General Education Mathematics requirement for the College of Liberal Arts and Sciences.,,3,College of Liberal Arts and Sciences,,CMATH - Mathematics,
"This course will focus on the importance of mathematics in the modern world. Topics will include logic and problem solving, dealing with data, modeling, and other real world applications. Students will enhance their ability to use concepts, procedures, and intellectual processes specific to quantitative reasoning. As well, students will engage in versatility in approaching and solving problems. Each student will complete an individualized project to study a particular aspect of mathematics in further detail. Placement in/waiver from this class depends on SAT or ACT math or Lesley Math Assessment scores.",CMATH 1010 Quantitative Reasoning,This course does not fulfill the General Education Mathematics requirement for the College of Liberal Arts and Sciences.,,3,College of Liberal Arts and Sciences,,CMATH - Mathematics,
"This course is designed to introduce the student to some beautiful and surprising intersections between the world of mathematics and the world of art and design, as well as to provide practical solutions to mathematical problems encountered by practicing artists. We will look at intersections between mathematics and art over a fairly long historical period and a fairly wide variety of styles, including ancient Greek art and architecture, 20th century geometric art, fractal imagery, and current practices in design. Accompanying each topic in our historical thread will be hands-on development of solutions to mathematical situations encountered by artists, including the use of scale in diagrams and modeling, building three-dimensional objects, shipping and presenting work, and balancing resolution and print size. The class will consist of viewing art work, mathematical lectures, hands-on projects, guest lectures, and videos.","CMATH 1011 Math, Art, and Design",Math Competency course: does not fulfill the General Education Mathematics requirement for the College of Liberal Arts and Sciences.,,3,College of Liberal Arts and Sciences,,CMATH - Mathematics,
"In this course, students will develop a critical consciousness about mathematical identity and the place of mathematics both in our lives and in the world which will allow us to move from reacting to structures outside of ourselves to being empowered actors who create our own identities. We rely heavily on Paulo Freire's notion of ""praxis,"" which Freire defines as ""reflection and action upon the world in order to transform it."" This course puts this idea into practice in the arena of mathematics by starting with reflecting on mathematical identity, education, power, and oppression, followed by taking action through trying new mathematical experiences and reflecting on those new experiences with an eye toward identity, power, and oppression. We continue the cycle by using our critical awareness of mathematics education to design and deliver an educational experience that will address some of issues that we have considered during the semester.",CMATH 1012 Liberation Mathematics,"This course does not fulfill the General Education Mathematics requirement for the College of Liberal Arts and Sciences. Only LCAL students in Individually Designed Degree programs may count this course towards general education math requirement.Additionally, traditional CLAS and LUCAD students require instructor permission to register for this course.",,3,College of Liberal Arts and Sciences,,CMATH - Mathematics,
"This course focuses on the development of problem solving skills, strategies, and heuristics. Within this problem-solving context, the mathematical areas of number theory and functions, sets and logic, and combinatorics and probability are explored. Individual and group problem tasks will permit students to observe, analyze, and contrast problem-solving strategies and attitudes. Each student will keep a learning log noting insights into his/her own problem-solving ability, and written explanations to problem solutions are expected.",CMATH 1501 Problem Solving,,,3,College of Liberal Arts and Sciences,,CMATH - Mathematics,"CMATH 1009 , 1010 or 1011 or 3 credits from CMATH from the 2000-level "
"This course provides a general introduction to the basic concepts of probability and descriptive statistics. Computer-based methods for data collection, calculation, display, and analysis are integrated into the course. Students examine the advantages and limitations of the use of statistics in the investigation of contemporary issues and problems in science, health, education, management, and the social sciences. A research project involving descriptive statistics is required.",CMATH 1522 Introduction to Statistics,,,3,College of Liberal Arts and Sciences,,CMATH - Mathematics,"CMATH 1009 , 1010 or 1011 or 3 credits from CMATH from the 2000-level "
"This course focuses on using functions and algebra to model data and on using these models to make predictions, solve problems, and make decisions. Participants in the course will be generating mathematical data, identifying and describing patterns, developing mathematical models, solving problems, and sharpening the algebraic skills necessary to work with mathematical models. Topics covered include rates of change, linear functions, quadratic functions, exponential functions, logarithms, and trigonometric functions.",CMATH 1590 Patterns and Functions,,,3,College of Liberal Arts and Sciences,,CMATH - Mathematics," class='sc-courselink' href='/en/2016-2017/Undergraduate-Academic-Catalog/Undergraduate-Catalog/College-of-Liberal-Arts-and-Sciences-Courses/CMATH-Mathematics/1000/CMATH-1009'>CMATH1009, 1010or1011or3creditsfromCMATHfromthe2000-level "
This course focuses on a specific topic in mathematics.,CMATH 1888 Selected Topics in Mathematics,,,3,College of Liberal Arts and Sciences,,CMATH - Mathematics,
"Calculus is the mathematical study of change. It provides a tool for exploration of a broad range of phenomena across the physical, biological, and social sciences. This course introduces concepts of limit, continuity, derivative, and the definite integral and draws connections between the graphical ideas of tangents and area and the functional ideas of instantaneous rate of change and net change. This course requires a facility with algebra and functions, including exponential functions, logarithms, trigonometric functions, linear functions, and logarithms.",CMATH 1990 Concepts and Applications of Calculus I,,,3,College of Liberal Arts and Sciences,,CMATH - Mathematics,CMATH 1590 or equivalent coursework in precalculus or college algebra or permission of full-time Mathematics faculty 
"This course is intended to introduce students to discrete mathematics and its importance in today's world. Topics include voting methods and theory, fair division, models for population growth, linear programming, graphs and their applications, combinatorics, probability, and game theory.",CMATH 2140 Discrete Mathematics,,,3,College of Liberal Arts and Sciences,,CMATH - Mathematics,"CMATH 1009 , 1010 or 1011 or 3 credits from CMATH from the 2000-level "
"This course is intended to develop students' visual thinking and spatial relationships. Topics from plane geometry include transformations, tessellations of figures, and symmetry. Topics from solid geometry include three-dimensional symmetry and the platonic solids. Study of these geometric concepts is enhanced through extensive use of hands-on activities and computer applications.",CMATH 2144 Topics in Geometry,,,3,College of Liberal Arts and Sciences,,CMATH - Mathematics,"CMATH 1009 , 1010 or 1011 or 3 credits from CMATH from the 2000-level "
"Number Theory has a deceptively simple description: the study of the counting numbers (a.k.a. positive integers). Course topics include prime numbers and divisibility, Fibonacci Numbers, congruencies (modular arithmetic), Diophantine equations, Euclid's algorithm, cryptography, and additional topics as time permits. Students will be expected to experiment, formulate and test conjectures, then write clear and coherent mathematical justifications of these conjectures.",CMATH 2150 Number Theory,,,3,College of Liberal Arts and Sciences,,CMATH - Mathematics,"CMATH 1009 , 1010 or 1011 or 3 credits from CMATH from the 2000-level "
"This course is a continuation of CMATH 1990 and examines the integral calculus and its applications. Techniques of integration, logarithmic, exponential, and trigonometric functions, as well as partial derivatives and differential equations are among the course topics. Applications of the integral to area and volume are highlighted as well as uses of the calculus in the natural and social sciences.",CMATH 2590 Concepts and Applications of Calculus II,,,3,College of Liberal Arts and Sciences,,CMATH - Mathematics,CMATH 1990 or equivalent 
"Multivariable calculus is an extension of single-variable calculus that allows us to tackle more interesting real-world problems by modeling them with functions of more than one variable. In this course we will learn about multivariate functions: how to visualize them, how to differentiate them, how to optimize them. We will also learn how to integrate multivariate functions over regions of the plane and explore applications of integration to probability. We will end the semester by looking at partial differential equations along with applications. Throughout the course we will emphasize applications drawn from business, economics, statistics, biology, the environment, and the physical sciences.",CMATH 2990 Multivariable Calculus,,,3,College of Liberal Arts and Sciences,,CMATH - Mathematics,CMATH 2590 
"This course paves the way to ""proof-based"" mathematics courses (e.g. Abstract Algebra) and provides a comprehensive introduction to number theory. Major topics include the logic of direct and indirect proofs, divisibility, primality, and factoring, congruence and modular arithmetic. While mainly focusing on abstract topics, we will also investigate the mathematics behind divisibility tests, check digits, and public key cryptography. Class time and homework will engage students in mathematical inquiry: investigating, generalizing, conjecturing, proof and counterexample.",CMATH 3000 Transition to Abstract Mathematics through Number Theory,,,3,College of Liberal Arts and Sciences,,CMATH - Mathematics,
"In this course we focus on the rich historical connections between mathematics and the social context in which it developed. Examples from a variety of historical periods are considered along with the work of key mathematicians and the problems that captured their interest. Through this historical lens, students gain an appreciation for mathematics as a human endeavor and a greater ability to think critically about the development of new knowledge.",CMATH 3001 Mathematics in Context,,,3,College of Liberal Arts and Sciences,,CMATH - Mathematics,3 credits of CMATH from the 2000-level 
"Internships at Lesley are designed to provide students with opportunities to perform research/field work in conjunction with practicing professionals in a supervised field setting. With the help of an advisor and the internship office, a student identifies fieldwork that complements his/her major and interest within that major and his/her own educational and professional objectives. This internship is an important experience, functioning as a catalyst for making important contacts in the workplace, building higher levels of skills to more effectively position you for success in the job market, and positively influencing post graduation employment or the pursuit of graduate school. The seminar is designed to support your work in the field and to provide a framework for analyzing the internship site through its structures, behaviors and cultures. The seminar provides a forum for discussion about organizational change, new trends and patterns, and anticipated issues in global environments.",CMATH 3100 Internship and Seminar,,,3-6,College of Liberal Arts and Sciences,,CMATH - Mathematics,
"Statistical inference draws conclusions from data. The emphasis of this course is on the reasoning of inference - the what and how of making judgments about data. Topics include significance tests involving means and proportions, linear and multiple regression, and one- and two-way analysis of variance. A research project making use of inferential statistics is required.",CMATH 3522 Inferential Statistics,,,3,College of Liberal Arts and Sciences,,CMATH - Mathematics,CMATH 1522 or permission of the instructor 
This course focuses on a specific topic in mathematics.,CMATH 3888 Selected Topics in Mathematics,,,3,College of Liberal Arts and Sciences,,CMATH - Mathematics,
"The student serves as a course assistant to the faculty who has accepted them. The course includes both studying the processes of planning, implementing, and evaluating the course curriculum, and assisting with the preparation and teaching aspects of the course. The course is recommended for students interested in a deeper study of a particular subject, and for those wishing to participate in the planning and teaching process. See Course Assistantships on page xx for details.",CMATH 4089 Practicum in Curriculum and Procedures,,,3,College of Liberal Arts and Sciences,,CMATH - Mathematics,
"This course introduces the study of abstract algebraic systems such as groups, examples of which are abundant throughout mathematics and the sciences. It attempts to understand the process of mathematical abstraction, the formulation of algebraic systems, and the development of an abstract theory from these systems. An important objective of the course is development of skills in abstract mathematical reasoning, including the reading and writing of proofs.",CMATH 4200 Abstract Algebra,,,3,College of Liberal Arts and Sciences,,CMATH - Mathematics,CMATH 2590 or permission of full-time mathematics faculty. 
"Students enrolled in this capstone course perform community-based mathematical research. They work in groups to develop and complete a significant research project based on community needs. Students will be required to use the mathematical tools of algebra, trigonometry, calculus, probability and statistics in order to fit data, construct models, and determine appropriate conclusions. Students will engage in projects that highlight the power of mathematical tools applied in practical situations, as well as the creativity necessary to make the connection between theoretical model and practical solution.",CMATH 4550 Directed Research Capstone: Math,,,3,College of Liberal Arts and Sciences,,CMATH - Mathematics,CMATH 3522 
"An independent study offers students an opportunity to explore a topic not available through the current course offerings, or to explore a subject in greater depth than is possible in a regular course. For more information, see Independent Study guidelines.",CMATH 4999 Independent Study,,,1-6,College of Liberal Arts and Sciences,,CMATH - Mathematics,"30 credit hours, 3.0 cumulative GPA and permission of the instructor and division director. "
,CMUSC 1340Introduction to Piano,,,3,College of Liberal Arts and Sciences,,CMUSC - Music,
