description,title,Notes,Cross Listed Courses,credits,college,Corequisite,department,Prerequisite
"This course will introduce students to the medium of animation as an art form, expose them to its wide range of aesthetic possibilities, and teach them the twelve principles and techniques of animation and some basics of filmmaking. Class projects will focus on easy-to-manipulate mediums, like clay, cut-paper, puppets and found objects. A number of classes will focus on experimental animation where students will be working with paint, collage, sand and photographs within non-narrative structures.",IANIM 1250 Principles of Animation I,,,3,College of Art and Design,,IANIM - Animation / Motion Media,
"This course introduces digital tools to the animation process. Students bring the techniques taught in Principles of Animation I to the digital realm, and explore both 2D and 3D animation tools. Through projects and assignments, the course covers the tools necessary to create exciting animations while introducing a digital workflow.",IANIM 1260 Principles of Animation II,,,3,College of Art and Design,,IANIM - Animation / Motion Media,
"This course focuses on the creation of a short animated film. Students bring their ideas, and the will cover the twelve principles of animation, as well as filmmaking, conceptual thinking, story boarding, story structures, animatics, character design and lip-syncing. Each week, you will work toward finishing your animated film, presenting a complete piece with sound at the end of the semester.",IANIM 1300 Animation Seminar,,,3,College of Art and Design,,IANIM - Animation / Motion Media,
,IANIM xxxx Anime: Roots to Modern Day,,,3,College of Art and Design,,IANIM - Animation / Motion Media,
"This course emphasizes the pre-production and planning process of making an animated film. Students will explore different types of story-telling, using storyboards and pencil tests to experiment with different forms of narrative. We will build your conceptual development skills in order to create the foundation for a successful and exciting project. At the end of the semester, you will be ready to make a complex animation in Sophomore Seminar II.",IANIM 2110 Sophomore Seminar I,,,3,College of Art and Design,,IANIM - Animation / Motion Media,
"This course builds on the conceptual development and storytelling of Sophomore Seminar I. Students will create a short animated piece based on their pre-production work, using the class as a resource for discussion and critique, as well as demonstrations of a wide variety of technical and conceptual tools that expand and enhance your project. At the end of the semester, you will present a final animation that reflects your process and skills as an animator.",IANIM 2120 Sophomore Seminar II,,,3,College of Art and Design,,IANIM - Animation / Motion Media,
"This course includes drawing the dynamic structure of human and animal figures and other lively objects, from the initial quick execution in sequential key poses through a series of revisions. Characters are designed in precisely drawn model sheets, and figures and backgrounds are composed in meaningful, dynamic cinematic sequences expressed in storyboards, from rough to polished.",IANIM 2470 Drawing for Animation,,,3,College of Art and Design,,IANIM - Animation / Motion Media,
"This course includes drawing the dynamic structure of human and animal figures, and other lively objects, from the initial quick execution in sequential key poses through a series of revisions. Characters are designed in precisely drawn model sheets, and figures and backgrounds are composed in meaningful, dynamic cinematic sequences, expressed in storyboards, from rough to polished.",IANIM 2480 Animation Basics,,,3,College of Art and Design,,IANIM - Animation / Motion Media,IANIM 1250 or IANIM 1260 
"Animation Basics II covers more advanced animation techniques, especially for drawn figure animation, including use of exposure sheets, moving backgrounds, digital ink, and paint. It also covers production of short, animated pieces from cinematically meaningful storyboards.",IANIM 2490 Character Animation,,,3,College of Art and Design,,IANIM - Animation / Motion Media,
"In this course, students become familiar with Procreate Painter and Adobe After Effects. Adobe Premiere and Avid Elastic Reality are also used. Together, these programs offer a powerful set of tools to facilitate the creation of a variety of -D animation, whether based on digital video, drawing, or both.",IANIM 2495 Digital Animation: 2D,,,3,College of Art and Design,,IANIM - Animation / Motion Media,
"Experimental Motion Media introduces majors and non-animation students to the cornucopia of animation techniques available to impart the dimension of motion to their artwork. Animation here is a means of creating paintings that move, or music that is purely visual. There is a long history of using animation to produce fine art or experimental film. The animated works of Dada artists like Hans Richter, Viking Eggling, and Walter Ruttman; and the works of modernists like Oscar Fischinger, Len Lye, Robert Breer, Paul Glabiki, as well as contemporary animators are viewed.",IANIM 2500 Experimental Motion Media,,,3,College of Art and Design,,IANIM - Animation / Motion Media,
"Video I is an introductory (yet intensive) course teaching skills, technology and aesthetics that comprise the realm of video production. Students will learn by watching demonstrated techniques and classroom video screenings with discussion. There will be extensive hands-on experience in the operation and handling of DV camcorders, sound recorders, mics, lighting and editing using Final Cut Pro. Each Student will complete a final video project working thru all phases of production from script to screening.",IANIM 2570 Video I,,,3,College of Art and Design,,IANIM - Animation / Motion Media,
"This course will explore the concept of animation as fine art, using fine arts practices and principals to create the illusion of movement and action. Students will explore adventurous techniques and mediums such as, but no limited to, scratch film, motion painting, chalk board animation, pixilation, and paper cut out. Students will face conceptual and aesthetic challenges that they will be asked to work through and find solutions to. Lessons will be enriched through film screenings and in-depth class discussions. All majors are encouraged.",IANIM 2600 Experimental Animation,,,1.5,College of Art and Design,,IANIM - Animation / Motion Media,
"Toys, Props & Products is a course that explores how we think about physical objects. This course will consider industry, culture, markets and studio practice culminating in a complete ready for market toy, prop, or product. Students will be taught how to utilize simple 3D software, as well as a 3D printer to manufacture a prototype. Students will approach this process in a collaborative manner: brainstorming ideas, markets, production, promotion and funding. Each student or group of students will choose a toy, prop, product or line of the aforementioned to develop from sketch to specs to mock up; research and build a shared list of manufacturers and materials, and markets to approach with their developed ideas and mock-ups","IANIM 3600 Toys, Props & Production",,,3,College of Art and Design,,IANIM - Animation / Motion Media,
"This course introduces students to creating 2D games. At a conceptual level, students will examine the whole game building process, including game design, architecture of a game engine, asset creation, and level design. Students will explore some programming by creating an application using Processing (a high level programming environment for artists), design levels, and create all art and sound assets for a 2D side scroller game for the iPhone.",IANIM 3100 Game Production I,,,3,College of Art and Design,,IANIM - Animation / Motion Media,Students should have basic Photoshop knowledge and/or other extensive computer experience.
The course teaches the skills necessary to create appealing and visually distinctive characters for the illustration/animation industry. It utilizes the visual techniques and psychological knowledge to invent and refine professional character designs.,IANIM 3265 Character Design,,,3,College of Art and Design,,IANIM - Animation / Motion Media,
"This course explores various techniques of 3D animation, including clay, objects, puppets, and the animation of people (pixilation). The history and aesthetics of this genre are also examined. Students produce short 3D experiments.",IANIM 3450 Stop Motion Animation,,,3,College of Art and Design,,IANIM - Animation / Motion Media,
"In this course, students become familiar with Procreate Painter and Adobe After Effects. Adobe Premiere and Avid Elastic Reality are also used. Together, these programs offer a powerful set of tools to facilitate the creation of a variety of D animation, whether based on digital video, drawing, or both.",IANIM 3490 Digital Animation: 2D,,,3,College of Art and Design,,IANIM - Animation / Motion Media,
"This course is an introduction to 3D vector-drawn modeling and animation in the program Autodesk Maya. Basic techniques of modeling, lighting, texture mapping, and animation are covered. This powerful application allows the student to create hyper-realistic virtual worlds, which can be navigated with ease.",IANIM 3495 Digital Animation: 3D,,,3,College of Art and Design,,IANIM - Animation / Motion Media,
"The course introduces student animators to story-telling and non-narrative structures in animation and cinema, expressed in written treatments, drawings, storyboards, and animatics. Creation of character personalities and their dramatic environment is also covered. Overall, the course explores methods of provoking the imagination and considers the essential ingredients for producing fresh work, be it lively or thoughtful.",IANIM 3500 Junior Seminar,,,3,College of Art and Design,,IANIM - Animation / Motion Media,
"Promotional Video and Animation is an intensive course that covers the aesthetic and technical skills needed for the production of the short video form, specifically the video promo. In this course, students should gain a thorough understanding and working knowledge of the various elements that are required to create a compelling promotional video or animation. Students will work on collaborative team projects as well as on personal projects. Work may be produced in live-action video and/or animation. Students will view and analyze TV commercials, motivational videos, PSAs, promotional videos, and videos on You Tube. They will learn about the concept creation of successful, compelling video promos; and about professional techniques and tips to create more professional looking and sounding video and animated presentations.",IANIM 3560 Promotional Motion Media,Students should have a working knowledge of advanced cameras and video editing software.,,3,College of Art and Design,,IANIM - Animation / Motion Media,
"This is an intensive course designed to enhance and increase the skills and knowledge of digital video technology and aesthetics that comprise the realm of digital video production. There are five specific areas of focus. Scriptwriting, Camera Technique, Sound Design, Green Screen/Composite Video Effects and Advanced Edit-ing Techniques. Students will complete a set of video projects.",IANIM 3580 Live Action for Animators,,,3,College of Art and Design,,IANIM - Animation / Motion Media,
"Sound is an intensive course that teaches the fundamentals skills of audio acquisition, sound creation, and digital audio mixing techniques. Students are exposed to a brief history of the role of audio in movies, radio, and TV, touching on the technology and aesthetic components that comprise the use of audio. Students learn by watching and listening to demonstrated techniques and classroom video screenings with discussion. There is extensive hands-on experience in the creation, modification, and editing of audio using Final Cut Express and other existing programs.",IANIM 3600 Audio Production & Design,,,3,College of Art and Design,,IANIM - Animation / Motion Media,
"This course is not for the late sleeper! Over the semester, a number of small production teams conceive, design and shoot a 5 to 10 second spot, or otherwise known as a good old commercial. The techniques used are up to each team who take their ideas from product development, through the creative design phase, to the final shoot and post production.",IANIM 4100 Commercials,,,3,College of Art and Design,,IANIM - Animation / Motion Media,IANIM 2490
"This course introduces students to creating 3D interactive applications using a game engine and game level editor. At a conceptual level students will examine the whole game building process, including game design, architecture of a game engine, 3D asset creation, and level design. We will recreate the basic mechanics of a 3D first person adventure game (e.g. The Legend of Zelda: Twilight Princess). Building on the Computer Animation II course and the knowledge gained in class, students will design and create their own interactive application, which can be anything from a simple game to an interactive art show.",IANIM 4110 Game Production II,,,3,College of Art and Design,,IANIM - Animation / Motion Media,
"Success in the animation field depends upon a solid, fundamental knowledge of business standards and practices in order to build a career. This course addresses such issues as strategies in seeking employment, copyright, taxes, contracts, and the studio workplace. Freelance concerns like creating a business plan and making presentations or selling an idea are also dealt with. Students also work together in class with University Career Resource Center personnel on resume, cover letter, and interview skills.",IANIM 4200 Business of Animation,,,3,College of Art and Design,,IANIM - Animation / Motion Media,
"This course is the first of the 2-part Senior Studio, in which you create and complete a final thesis project. Senior Studio I emphasizes pre-production, conceptual development, story, story-boarding and pre-visualization. This course prepares you to complete your final thesis project, and you will continue your work in Senior Studio II.",IANIM 4465 Senior Studio I,,,6,College of Art and Design,,IANIM - Animation / Motion Media,
"This course is an introduction to 3D vector-drawn modeling and animation in the program Autodesk Maya. Basic techniques of modeling, lighting, texture-mapping, and animation are covered. This powerful application allows the student to create hyper-realistic virtual worlds, which can be navigated with ease.",IANIM 4450 Computer Animation II: Maya,,,3,College of Art and Design,,IANIM - Animation / Motion Media,
"Through the internship program Animation majors have the opportunity to work in a professional setting, while gaining important on-the-job experience. Internships provide exposure to a wide range of professional art environments, including, but not limited to, animation studios, publishing, or media-based companies. The department will post opportunities or students may make arrangements on their own with prior approval from the chairperson of the department. (3 credits = 180 hours of work)",IANIM 4880 Internship - Animation,,,3,College of Art and Design,,IANIM - Animation / Motion Media,
"Through the internship program Video & Animation majors have the opportunity to work in a professional setting, while gaining important on-the-job experience. Internships provide exposure to a wide range of professional art environments, including, but not limited to, illustration studios, publishing, or media-based companies. The department will post opportunities or students may make arrangements on their own with prior approval from the chairperson of the department.",IANIM 4882 Internship/Animation,,,2,College of Art and Design,Take concurrently with Internship Seminar ( IANIM 4885 ),IANIM - Animation / Motion Media,
"Through the internship program Video & Animation majors have the opportunity to work in a professional setting, while gaining important on-the-job experience. Internships provide exposure to a wide range of professional art environments, including, but not limited to, illustration studios, publishing, or media-based companies. The department will post opportunities or students may make arrangements on their own with prior approval from the chairperson of the department.",IANIM 4885 Animation Internship Seminar,,,1,College of Art and Design,Take concurrently with Animation Internship ( IANIM 4882 ),IANIM - Animation / Motion Media,
"This is the ultimate opportunity to produce an animated piece prior to graduation and requires a high degree of conceptual and technical understanding. The student works closely with the instructor at all stages in the area of greatest interest. At the end of the semester the students present a final, completed animation to the Senior Jury.",IANIM 4890 Senior Studio II,,,6,College of Art and Design,,IANIM - Animation / Motion Media,
"During this course, students will go through the steps of creating a for-profit business that ideally, is an extension of their personal art. Students must choose a commercially viable product or service to bring to the marketplace, i.e. custom illustrated snowboards, web site designs, or professional photography services. Through this process you will gain knowledge in several key business areas including management (self, time, product), marketing, and finance. The skills learned are easily transferable to any enterprise regardless of whether you ultimately work for yourself, or within an organization.",IAPRO 2100 Business Skills for Artists and Designers,,,3,College of Art and Design,,IAPRO - Professional Development,
"This is a fundamental course designed to familiarize students with many of the tools and methods used by illustrators working in all parts of the field. Students will begin by exploring systematic and informed content and concept creation from visualization to critical analysis. They will learn the ways that composition, color, value, line and shape express ideas; the ways that technique, medium, craftsmanship and presentation influence the viewer and characterize successful work.",IILLU 1250 Illustration Tools & Methods,,,3,College of Art and Design,,IILLU - Illustration,
"An introductory course in Illustration that explores the wide range of illustration practices in contemporary culture. We'll look at and meet working illustrators, as well as address assignments in both traditional and newly evolving areas of the field from comic books, editorial, children's books, to animation, games, toys, mobile devices and web. We'll explore 2D, 3D, and digital mediums including 4D.",IILLU 1240 Illustration Now,,,3,College of Art and Design,,IILLU - Illustration,
"We will study the criteria of Folk Art as well as create works of art in Folk Art traditions. Through critique, we will look at the formal elements of visual art (line, shape, color, composition, contrast, harmony, repetition, etc.) and meaning, purpose and intent as presented in art works representing a variety of cultures and/or national expressions. In looking at art in the context of the culture and the people that produced it, we will understand more about each, and ultimately draw parallels to the ways we each communicate visually through making objects in our own lives. This course includes studio work, a museum visit, and reading and writing assignments. Students are required to minimally purchase and/or scavenge materials as necessary. The course culminates with a final presentation and studio project.",IILLU 1300 Folk Art & Craft,,,3,College of Art and Design,,IILLU - Illustration,
"This course is a thorough study of the human skeletal and muscular systems. Through lectures and drawings from the figure, skeleton and imagination, students explore the complex issues of figure composition.",IILLU 2100 Anatomy and Figure Drawing,,,3,College of Art and Design,,IILLU - Illustration,
"This class is a follow up to Anatomy & Figure Drawing: It allows students to apply their gained knowledge and acquired drawing skills to create figures in dynamic, active poses. The class will focus on drawing figurative comps (composites) through the direct process of working from a model, as well as indirectly through anatomical and visual research. Emphasis is placed on capturing and exaggerating action in short poses with line drawing, building anatomical form on top and honing skills to create a fluid figure in action and in context.",IILLU 2110 The Dynamic Figure,,,3,College of Art and Design,,IILLU - Illustration,
"An introductory projects course to working sequentially. It includes the basics of illustrating for different book formats, as well as exposure to excellent examples. Students interpret a selected story or narrative in order to develop an idea into a series of images.",IILLU 2130 Sequential Projects,,,3,College of Art and Design,,IILLU - Illustration,
"This course introduces students to the process, terminology and context of letterpress printing. After developing a solid foundation in traditional letterpress techniques such as typesetting, inking and printing on fine papers, we begin to explore experimental techniques and applications, like pressure printing, linoleum cuts, photopolymer plates, layering colors, and combining with digital media. Our course structure is a mixture of lectures, readings, typesetting, hand-printing, design and illustration. The relationship between text and image is central to letterpress and, thus, our projects combine various artistic elements, and may include posters, broadsides, calendars, coasters, cards, fine art and finally, small books.",IILLU 2160 Letterpress Studio,,,3,College of Art and Design,,IILLU - Illustration,
"Illustration is primarily a figurative genre that expresses narrative storytelling and conceptual themes. This class will focus on the basic structure in drawing, linear perspective, light and shade techniques, composition in illustration and indirect picture making using reference. Students are required to demonstrate a firm grasp of the fundamental principals in drawing both directly and indirectly. We will practice drawing character designs, caricature creations, environmental landscape drawing and other pre-production drawing techniques. On site drawing, museum visits and drawing from life with be presented to strengthen the visual vocabulary of each student. Homework assignments will be given to apply each theory discussed or used in class.",IILLU 2221 Drawing for Illustration: Indirect,,,1.5,College of Art and Design,,IILLU - Illustration,
Students learn to develop and utilize an online presence for their work as well as how to network and promote their work in the web environment.,IILLU 2225 Web Promotion,,,1.5,College of Art and Design,,IILLU - Illustration,"Must have taken any Foundation Digital Elective: IFNDN 1110, IFNDN 1120 or IFNDN 1581 "
"Drawing can be done with numerous tools and in many different mediums. This course explores the wide range of drawing styles through different centuries and cultures by practicing many of them in class. Natural, personal drawing vocabulary and calligraphy styles are stressed.",IILLU 2230 Mixed Media Drawing,,,1.5,College of Art and Design,,IILLU - Illustration,
"In a fast growing gaming and computer animation market, the ability to create characters is essential. This course delves into the field, including the creation of characters for the Editorial and Children's Book markets. The works of prominent character artists are widely explored.",IILLU 2240 Character Design Drawing,,,1.5,College of Art and Design,,IILLU - Illustration,
"Illustration is still primarily a figurative medium in which to communicate ideas and concepts. This is a good old fashion figure drawing class where progress occurs through tackling problems with proportion, anatomy, line, and volume in order to freely interpret the figure.",IILLU 2250 Life Drawing,,,1.5,College of Art and Design,,IILLU - Illustration,
"A beginning class in the working process of creating illustration, from interpreting written material to creating thumbnails, roughs, sketches, and comps. Each student assembles a portfolio of step-by-step approaches to solving a wide variety of illustration assignments. There is an emphasis on drawing, conceptual development, and working with art direction.",IILLU 2300 Principles of Illustration,,,3,College of Art and Design,,IILLU - Illustration,
"Students will create a variety of narrative pieces through the use of digital tools such as videos, blogs and social media. Students will learn how to work with digital still and video cameras and their accessories so they can effectively pursue their projects. By working with software both online and on the computer, students will work independently and/or collaboratively developing time-based, media rich content. As a student in this course, you will be guided through these processes in support of your ideas so that you may create content that will tell the stories that interest you.",IILLU 2351 Digital Storytelling,,,1.5,College of Art and Design,,IILLU - Illustration,
This course covers fundamental techniques and develops skills in the use of transparent media in the context of strong composition and illustrative expression.,IILLU 2420 Techniques: Composition & Transparent Media,,,3,College of Art and Design,,IILLU - Illustration,
