category,credits,description,title
Education,4,"Examines the pedagogy, curricula, and materials for teaching mathematics in elementary classrooms where children construct understanding. Addresses the issues of equity and excellence while exploring the breadth and depth of mathematics learning through culturally responsive practice. Addresses the teachers role in creating an effective learning environment and explores the use of both hands-on and on-screen manipulatives. Discusses a range of embedded assessment strategies. Prerequisites: HDP 120/121 or HPD 130, EDU 255, and MAT 141 or MAT 131 with simultaneous enrollment in MAT 132.",EDU 330: Elementary Mathematics 
Education,2,Introduction to a wide range of multicultural picture books for children. Guides development and application of criteria for appropriate book selection. Focuses on effective strategies for reading aloud to young children. May be taken as a sequence with EDU 332 or separately.,EDU 331: Multicultural Picture Books 
Education,0,"Consolidates professional background in theory and practice of teaching reading in grades Pre-K - 8. Addresses core concepts and instructional practices for phonological and phonemic awareness, emergent literacy, phonics, vocabulary, comprehension, and reading assessment. Builds upon the professional knowledge developed in EDU 327 or EDU 337. Prerequisite: EDU 327 or EDU 337.",EDU 335/RDG 535: Reading Theory and Practice
Education,4,"Explores the practices and content of science and engineering. Develops understanding of Elementary science concepts and topics appearing in the Massachusetts Science and Technology/Engineering Curriculum Frameworks and the New Generation Science Standards. Explores teaching strategies that build childrens understanding of science concepts and proficiency in science practices of science inquiry. Prerequisites: EDU 306, EDU 330 & EDU 337. Corequisites: EDU 316, EDP 317.",EDU 336: Elementary Science/Technology
Education,4,"Analyzes stages of reading development during grades pre-K to 8. Focuses on balanced instruction and assessment of oral language, phonemic awareness, word identification, phonics, structural analysis, and fluency. Develops skills for guided reading instruction. Includes supervised off-campus sessions assessing and teaching developing readers. Prerequisites: completion of the WLCE, EDU 255, and HDP 120/122 or HDP 130/131.",EDU 337: Teaching Reading in Grades preK-8
Education,2,"Extends foundational knowledge gained in EDU 337. Focuses on strategies for developing vocabulary, improving comprehension, and teaching writing. Reading informational text and the instruction of English language learners are central themes of the course. Includes observation and analysis of a classroom literacy program. Prerequisite: EDU 337.",EDU 338: Teaching Non-fiction Literacy 
Education,4,"Explores how young children learn to read and write in the context of a multilingual society. The course examines how teaching strategies, classroom environments, writing and reading materials, and assessments support the childs literacy learning. Students will look at the ways in which current literacy research informs instructional practices. Offered in Singapore programs only.",EDU 340: Developing Literacy for Young Children in a Multilingual Society 
Education,2,"Examines formal and informal assessment of development in all children from birth to age eight. Emphasizes ecological approach, basing curriculum and teaching on comprehensive assessment. Topics include screening, referral, IEP and IFSP processes, disabilities, family involvement, culturally competent assessment. Identifies and addresses critical issues in assessment of young children. Prerequisite: HDP 120/121 or HDP 130. Taken concurrently with EDP 456 & 457.",EDU 341: Assessing Children with/without Special Needs- Birth-8
Education,2,Addresses current issues in the teaching of science to children ages 3-8 (grades PreK-2). Prepares students to address the Massachusetts Science and Technology/Engineering Curriculum Frame-works and other related documents as they apply to teaching children in grades PreK through 2. Introduces students to important elements in young childrens science including choosing appropriate topics; guiding childrens inquiry; and deepening childrens science understanding through encouraging representation and other forms of communication. Prerequisite: HDP 120/121 and 122/123 or HDP 130/131 and one science course.,EDU 351: Teaching and Learning Science in Early Childhood Classrooms
Education,4,"Learn fundamental skills and strategies to take full advantage of educational technology. Evaluate the use of a variety of electronic media for the classroom and early childhood education, design lessons and curricula, and create appropriate learning environments using technological means. Gather the information needed to use technology in the assessment process and data analysis. Offered in Singapore programs only.",EDU 352 : Information Technology in Early Childhood Education
Education,2,"Accompanies Northern Ireland Service Learning Program. Pre-trip sessions provide foundation for trip: history of The Troubles, how children are affected, efforts to promote healing with children and adults, broader implication for all children. In Belfast sessions, expert practitioners connect theory to student experiences. Post-trip sessions explore implication for students professional work. Pre-requisite: Admission into Northern Ireland Service Learning Pro-gram by application only.",EDU 355/555: Helping Children Heal-N. Ireland Lessons
Education,4,"Promotes ways to build trusting inter-professional relationships and achieve cultural consistency through effective communication in settings/institutions involving parents and professionals. Leader-ship and research activities include conducting environmental scans, examining alliance building strategies, and designing professional development and actions plans that are inclusive and ad-dress community assets and needs.",EDU 365: Supporting Families with Infants and Toddlers in Home and Community Settings
Education,2,"Examines programs and services for infants and toddlers who have special learning and developmental needs and their families within a family-centered framework. Recommended practices for pro-grams based on special education lens and policy including the process for developing and implementing the IFSP through a transdisciplinary model will be studied. Prerequisites: HDP 120/121 and 122/123 or HDP 130/131, HDP 227, HDP 257, EDU 365, EDU 390.",EDU 366: Supporting Infants and Toddlers w/Special Needs and their Families
Education,2,"Explores effective adult interactions. across roles and relationships. Cultural and critical theories provide the foundations for analysis and practical application of communication skills. Communication skill-building focuses on use of culturally competent approaches, reflective practices, self-assessment, providing and receiving feed-back and setting achievable goals. Emphasis is on cultivating expertise for successful collaboration. Prerequisites: HDP 120/121 and 122/123 or HDP 130/131.",EDU 367: Foundations in Communication and Collaboration 
Education,4,"Examines research, theory and quality indicator of the care and education of infants and toddlers in home and community settings and application to curriculum and program development. Through family-centered and relationship-based frameworks, focuses on early health and development and environmental design within the context of family and community. Prerequisites: HDP 120/122 and 121/123 or HDP 130/131, HDP 227, HDP 257.",EDU 390: Curriculum and Program Development for Infants and Toddlers
Education,4,"Exposure to a variety of theories, perspectives, and case examples of effective leadership. Addresses issues that include the deferences between leadership and management, the competencies demonstrated by effective leaders, and how leadership skills are developed. Learners are expected to draw on and examine their personal leadership experiences. Offered in Singapore programs only.",EDU 402: Interpersonal Skills of Leadership 
Education,2,"Promote ways to build trusting inter-professional relationships and achieve cultural consistency through effective communication in settings/institutions involving parents and professionals. Leader-ship and research activities include conducting environmental scans, examining alliance building strategies and designing professional development and action plans that are inclusive and address community assets and needs.",EDU 420: Advancing Communication and Collaboration
Education,4,"Focuses on developing, maintaining, and evaluating child care classrooms and programs. Assess staff, evaluate curriculum, communicate with parents, implement health care policies, and advocate for quality care. Discussions of research on children in group settings and the role of child care in society. Prerequisite: 300 hour practicum in Early Childhood concentration. Recommended elective for Birth-5 students. Taken concurrently with or following Integrated Practicum II.",EDU 427: Child Care Management and Administration
Education,4,"Focus on children as active learners in developmental domains and content areas. Design, adapt, implement and assess inclusive, integrated curriculum that is developmentally, culturally, linguistically and individually appropriate. Emphasizes curriculum development and assessment responsive to children with diverse cultural, cognitive, social, racial, ethnic, religious, class and linguistic back-grounds. Prerequisites: Pass WLCE, pass MTEL Literacy and Communication tests, EDU 250, 255, 305, 320 and 327. Corequisites: EDP 437 and MLE 301.",EDU 436: Teaching and Learning in the Primary Grades 
Education,2,"Examines theories of causation; historical and social contexts affecting learning; neurodevelopmental, behavioral, and motivation issues; and curriculum and instructional strategies for inclusive classrooms. Students use informal and standardized assessments to inform and evaluate instruction, including impact of teaching on student learning. Prerequisites: EDU 316, EDP 317, EDU 336, and EDU 338. Corequisite: EDU 446 and EDP 447.",EDU 445: Meeting Diverse Learning Needs
Education,4,"Focuses on classroom issues, events, and interactions among children, families, teachers, and communities. Provides a framework for developing classroom climates that are responsive to students from diverse backgrounds, and for helping children become responsible for their learning. Emphasizes effective communication and reflective practice. Prerequisites: EDU 316, EDP 317, EDU 336, and EDU 338. Corequisites: EDU 445, EDP 447 and MLE 303.",EDU 446: Elementary Teaching and Learning 
Education,4,"Extends knowledge of creating learning environments that foster childrens development through collaborative play. Emphasizes interactive teaching, formal and informal assessment, and individualized learning goals developed using IFSPs and IEPs. Concentrates on inter-professional collaboration with specialists from education, health, and social service perspectives and partnerships with families from diverse backgrounds. Prerequisites: EDP 437 and EDU 436. Corequisite: EDP 457.",EDU 456: Teaching and Curriculum in Diverse Early Childhood Settings (PreK-K)
Education,1,"For non-licensure inclusive classroom teachers. Reflect on teaching and learning experiences throughout the program; explore is-sues related to educational philosophies, public policy, leadership in the field, societal pressures affecting very young children and their families. Complete professional portfolio demonstrating evidence of meeting Wheelock College Education Standards. Open to seniors, usually in final semester.",EDU 462: Capstone: Pre-K-K
Education,1,"For inclusive classroom teachers and Birth-5 Specialists. Explore issues related to education philosophies, education reform, societal pressures affecting children and families, leadership in the field. Open to seniors, usually in the final semester.",EDU 464: Seminar in Policy Advocacy and Leadership in ECE
Education,1,"For inclusive classroom teachers. Reflect on teaching and learning experiences throughout program; explore issues related to educational philosophies, education reform, societal pressures affecting children and families, leadership in the field. Complete profession-al portfolio demonstrating evidence of having met Wheelock College Education Standards. Open to seniors, usually in final semester. Requires passage of Massachusetts Literacy and Communication, Early Childhood Subject, and Foundations of Reading Tests for Educator Licensure.",EDU 465: Capstone: Early Education Initial Licensure
Education,4,"Explores issues related to social justice and early education policy in a cultural context. Analyses the process of change, leadership theories and the meaning of advocacy. Emphasis is placed on understanding leadership skills and applying them across roles and domains in the field. A community action project focuses on the local early childhood sector and concludes the Capstone.","EDU 474: Policy, Advocacy and Leadership in ECE"
Education,4,"Assemble and present evidence of achieving Wheelock Education Standards. Develop a professional portfolio, integrating all aspects of teaching and learning, to support them as lifelong learners. An approach for documenting professional growth, encouraging re-flection and self-evaluation, and peer mentoring. Discussion of the integration of the portfolio and implications in relation to each course.",EDU 480: Portfolio Development and Presentation
Education,2,"Construct and defend web-based program exit portfolio addressing the Wheelock Education Standards, and reflecting on experiences in the program. Seminar provides a collaborative space to reflect on experiences in the program, share artifacts and drafts of analytic/reflective essays. Selected educational policies are discussed. Taken in last semester of the Education Studies program.",EDU 481: Capstone: Education Studies
Education,4,"Provides the foundation to plan, build, implement, manage and grow an organization that provides a service or product for children and families. Gain an understanding of the realities of entrepreneurship, including the pitfalls encountered and the lessons learned by other entrepreneurs. Topics to be reviewed include how to think analytically about organizational systems, how leaders play a critical role in shaping an organization, how to determine and marshal the financial resources necessary for a start-up business, and what to do to improve the likelihood of success. Offered in Singapore programs only.",EDU 483: Entrepreneurship in Early Childhood Education Context
Education,1,"Construct web-based program exit portfolios demonstrating their achievements of the Wheelock Education Standards, State and ACEI standards. Seminar provides a collaborative space to discuss artifacts and drafts of analytic/reflective essays. Selected educational policies are addressed. Prerequisites: Passage of Communication and Literacy Massachusetts Tests for Educator Licensure. Completion of EDU 446, EDP 447, and EDU 445 strongly recommended, but may be taken concurrently.",EDU 486: Elementary Ed: Portfolio Development
Education,1,"Present and defend web-based program exit portfolios demonstrating their achievement of the Wheelock Education Standards, State and the ACEI standards. Prerequisites: Passage of the Massachusetts Literacy and Communication (Reading and Writing subtests), General Curriculum (Multi- subject and Math sub-tests), and Foundations of Reading Tests for Educator Licensure. Completion of EDU 446, EDP 447, and EDU 445 strongly recommended, although they may be taken concurrently.",EDU 487: Elementary Ed Capstone
Education,2,"Design curriculum for early childhood social studies, arts, and multicultural teaching. Principles of curriculum development, assessment, and historical events that are part of early childhood curriculum. Using national and state standards and frameworks to in-form teaching and develop ability to find and adapt curriculum to provide appropriate learning experiences. Prerequisite: EDU 520 or permission of the instructor.",EDU 502: Curriculum for ECE Social Studies and Arts 
Education,3,"Introduces the critical study of race, culture, and identity. Explores theories to help students examine their own socialization and understanding of race, ethnicity, culture, and identity. Considers political, social, cultural, historical, economic, and power dynamics as a context for interpreting interpersonal and structural relationships.",EDU 505: Racial and Cultural Identities
Education,4,"Examines social theory and role of ideology to examine their orientation to race ethnicity, culture and identity in education. Considers political, social, cultural, historical, economic, and power dynamics as a context for exploring curriculum, educational pedagogy, and structures that influence educational opportunity and school achievement. Prerequisites: EDU 255, EDU 505 or permission of instructor.",EDU 506: Racial/Cultural Identities Advanced
Education,2,"Refines skills in designing and assessing curriculum for early childhood classrooms emphasizing science, technology, and health. Strengthen knowledge of science content that is part of early childhood curriculum. Integrate technology into ongoing curriculum and support beginning computer literacy skills. Practice using national and state standards and frameworks to inform teaching. Prerequisites: EDU 520: Intro to Inclusive Early Childhood Education and EDU 502 Curriculum for Social Studies and the Arts (For ECE DOE licensure students only).","EDU 515: Curriculum for ECE Science, Tech and Health "
Education,3,"Historical, legal, theoretical foundations of care and education for young children and their families. Application of principles to educational models. Curriculum design and assessment, strategies for developmentally appropriate learning opportunities for all young children, including those with special needs and those from diverse cultural, ethnic and linguistic backgrounds. Course requirements include 25 hours of pre-practicum field experience.",EDU 520: Introduction to Inclusive ECE
Education,3,"Design curriculum for early childhood social studies, arts, multi-cultural teaching. Principles of curriculum development and assessment and historical events that are part of early childhood curriculum. Using national and state standards and frameworks to in-form teaching and develop ability to find and adapt curriculum to provide appropriate learning experiences. Prerequisite: EDU 520 or permission of the instructor.",EDU 522: Curriculum for EC Social Studies and Arts 
Education,3,"Refine skills in designing and assessing curriculum for early child-hood classrooms emphasizing science, technology, and health. Strengthen knowledge of science content that is part of early child-hood curriculum. Integrate technology into ongoing curriculum and support beginning computer literacy skills. Practice using national and state standards and frameworks to inform teaching. Pre-requisites: EDU 520 and EDU 502 or permission from the instructor.","EDU 525: Curriculum for ECE Science, Tech and Health"
Education,2,"Explores effect of special needs on children birth to age eight. Introduces legislation, rights, services, stereotypes that affect children, families, and communities. Major areas of special needs are examined. Emphasis is on understanding children as individuals with varying performance and rates of development rather than members of a disability group.",EDU 528: Impact of Special Needs: ECE
Education,3,"Examines contemporary influences on pedagogy, curricular choices, and materials. Addresses the teachers role in creating an effective learning environment, and emphasizes strategies to maximize understanding mathematics for all children. Discusses a variety of assessment strategies.",EDU 535: Mathematical Learning for Diverse Learners
Education,3,"Examines fundamentals of elementary inquiry-based science pro-grams. Through direct experiences, focuses on the nature of scientific inquiry, selected concepts from across scientific domains, and basic instructional approaches. Includes design and implementation of a unit of study and assessment of student learning. Considers literacy and mathematics, and cultural influences in science.",EDU 545: Elementary Science 
Education,3,"Explore social studies subject matter including historical narrative and legacy. Develop, implement, and assess inclusive curricula; analyze pre-existing curricula; learn and compare city, state and national standards; and document implicit and explicit social studies learning.",EDU 546: ELE History and Social Sciences
Education,3,"Examines and applies current research and quality indicators for the care and education of infants and toddlers in a variety of settings. Through a family-centered and relationship-based frame-work, construct individualized, routine based activities and learning opportunities that are play-based and developmentally responsive to the unique needs of each infant, toddler and his/her family. Offered in the Singapore Program only.",EDU 560: Developing Infant and Toddler Programs
Education,3,"Deepens knowledge of curriculum development and assessment for young children and presents them as interconnected processes that necessitate knowledge of child development, DAP, theories of teaching and learning, and pedagogical content knowledge. Links assessment and standards to individualized instruction and introduces documentation to explore and capture teaching and learning. Offered in the Singapore program only.",EDU 561: EC Curriculum Planning and Assessment
Education,3,"Examines the elements of high-quality early childhood programs, including family communication and collaboration; designing the learning environment; utilizing technology; and addressing issues of national accreditation, accountability to identified standards, and evaluation. Techniques for staff supervision, mentoring, and evaluation are introduced. Prerequisite EDU 561. Offered in the Singapore program only.",EDU 562: EC Program Development and Evaluation
Education,2,"Provides individualized guided experience for Peace Corps Masters International (PCMI) students to learn the history, customs and values of the host community and the social, political and educational factors where they will complete their service in order to start a needs assessment project. Prerequisites: RES 723 or 725 or SWK 530 or other RES courses with approval of program coordinator and advisor.",EDU 601: Peace Corp Project Foundation I
Education,2,Provides individualized guided experience for PCMI students to continue to learn about their host community and the educational setting in order create and implement a needs assessment and initial design for a community-based project in collaboration with host-country community colleagues. Prerequisites: RES 723 or 725 or SWK 530 or other RES courses with approval of program coordinator and advisor.,EDU 602: Peace Corp Project Foundation II
Education,2,Provides individualized guided experience for PCMI students to implement the community-based project designed in EDU 602 in collaboration with host-country colleagues. Prerequisites: EDU 601 and 602.,EDU 603: Peace Corp Project Implementation I
Education,2,"Provides individualized guided experience for PCMI students to complete the implementation, evaluation and Sustainability of the community-based project started in EDU 602 in collaboration with host-country colleagues. Prerequisites: EDU 601 and 602.",EDU 604: Peace Corp Project Implementation II
Education,3,"Explores algebraic thinking for the elementary classroom. Uses tables, graphs, and rules to recognize, extend, analyze and describe linear and non-linear patterns. Concepts of integers, variable, function, inequality and equation are developed through investigations using current technology and trends consistent with NCTM, Common Core, and MCFM. Offered online only.","EDU 622 : Patterns, Functions and Algebra"
Education,3,"Offers participants an opportunity to build their own mathematical knowledge as well as pedagogical knowledge. Using a wide range of physical and virtual models, they will explore number theory and computational strategies that illuminate the NCTM Number and Operations content strand. Offered online only.",EDU 624 : Number and Operations
Education,3,"Focuses on data collection and organization; measures of central tendency and variance; subjective, theoretical, experimental, and conditional probability; simulation; counting principles; mathematical expectation. Includes techniques and technology in elementary teaching and learning of data analysis and probability developed by NCTM, Common Core and MCFM. Offered online only.",EDU 626 : Data Analysis and Probability
Education,3,Extends and enhances both content knowledge and pedagogical knowledge for all participating teachers. Participants will use both physical and virtual modes as they analyze the characteristics and properties of geometric shapes; use coordinate geometry; apply transformations and use both visualization and geometric modeling to solve problems. Offered online only.,EDU 628 : Geometry and Measurement
Education,3,"Uses scientific inquiry in life science through hands-on investigations. Begins with characteristics of living things followed by examination of the various structures (and their function) found in plants and animals, adaptations in response to the environment, and how life science concepts are taught in the elementary class-room. Offered online only.",EDU 630 : Inquiry into Life Science
