category,credits,description,title
Human Development,3,"Examines interrelationships among language, race, culture, ethnicity and identity. Focuses on dialectal diversity within English and its relationship to the development of academic language proficiency in multi-lingual school contexts. Explores pragmatic aspects of language use including stylistic variation, code-switching and intercultural communication. Encourages students to examine their own linguistic biases.","HDF 702: Language, Literacy and Culture"
Human Development,4,"Explores the social, economic and political dimensions of inequality in American Society. Looks at how people of color, white women and gays and lesbians are systematically discriminated against in work, education, media and government programs. Analyzes whiteness as a social construct. Focus on social change and activism. General Education: Perspectives on Diversity and Self and Society or Ethics and Social Justice. Introductory.",HDS 106: Sociology of Minority Groups
Humanities,4,"Introduces the diversities and similarities of cultures throughout the world from simple homogeneous groups to complex contemporary civilizations, including our own. Emphasis will be placed on the development of personality and the role of the family in the total cultural complex. General Education: Perspectives on Diversity, also Self and Society or Ethics and Social Justice. Introductory.",HDA/PSG 121: Anthropology and Globalization
Humanities,4,"Examines the social and cultural construction of masculinity in the United States using the theories and methods of Anthropology. Topics include race, class, ethnicity, and religion; popular images of American men (e.g., movies, magazines, sports, jokes); relation-ship of US manhood to sexuality, war, and women. Some comparison to other cultures. General Education: Perspectives on Diversity, Self and Society or Historical Perspectives. Intermediate.",HDA/AST 225 : Anthropology of American Men
Humanities,4,"Explores the social and cultural aspects of health and illness. Emphasis is on the varied ways that illness is defined and treated throughout the world. Readings draw upon the disciplines of sociology and anthropology. Topics include witchcraft, faith-healing, and alternative medicine in the U.S. Special focus on the inequities of health care and outcomes. General Education: Perspectives on Diversity, Self and Society or Ethics and Social Justice. Intermediate.",HDA/PSG 226 (formerly HDS 225) : Perspectives on Global Health
Humanities,4,"Analyzes how culture, gender relationships, social power deferences, and human physiology shape how we define sex, sexual, and sexuality in American culture. Explores how the science of human sexuality is used to reproduce and reinforce inequalities. Draws on sociological, anthropological and sociobiological theories. Intermediate.",HDA 256: Sex and Culture
Humanities,4,"Investigates different religious traditions in the United States, past and present, while studying social science theories of religion. Topics include: Why does religion exist; how different religions assimilate or resist citizenship; the tension between religious freedom and the common good; consumerism and religion; religions in Boston; what does religion do for us that so many Americans are religious; does truth matter, and are there fake religions? General Education: Perspectives on Diversity. Historical Perspectives or Self and Society. Intermediate.",HDA/AST 258: Religion in America
Humanities,4,"Investigates the organizations, functions and diversity of families in selected non-Western societies and in the United States. . Focus-es on marriage, kinship, childhood, parenting, gender, motherhood, and fatherhood. farming societies, and market based societies. Pre-requisite: HDP 120-121 or HDP 130. General Education: Perspectives on Diversity, Self and Society or Historical Perspectives. Intermediate.",HDA 266: Anthropology and the Family 
Juvenile Justice and Youth Advocacy,4,"Overview of delinquent behavior and juvenile justice system responses to delinquency. Considers current issues (e.g., gangs, girls, police, corrections) from perspectives of individuals, families, communities, and society. Explores history of juvenile justice in America, the nature of justice, punishment, rehabilitation, and the goals and effectiveness of our juvenile justice system. Includes a juvenile court experiential component. Prerequisite: HDP 120-121 or HDP 130. Introductory",JJA 201: Intro to Juvenile Justice and Delinquency
Juvenile Justice and Youth Advocacy,4,"Explores the history of the juvenile court, juvenile court structure, legislation, case law, and the adjudication process. Special topics include the constitutional rights of juveniles, police and youth, immaturity and Highlights important and emerging policy issues. Prerequisite: JJA 201. Intermediate",JJA 301: Juvenile Courts and Law
Juvenile Justice and Youth Advocacy,4,"Examines individual, environmental and developmental explanations of juvenile delinquency. Explores the influence of risk and resiliency factors such as individual traits, family characteristics, peers, schools, community, race, and social class. Focuses on theories and applied approaches to prevention of delinquency. Review of community-based and custodial corrections for juvenile offenders. Prerequisite: JJA 201. Intermediate.","JJA 302: Delinquency: Causes, Prevention and Intervention"
Juvenile Justice and Youth Advocacy,4,"Study core competencies of youth workers. Explores direct and policy oriented advocacy for court involved or at risk youth and their families from strengths-based and positive youth development approaches. Special focus on substance abuse, trauma, schools, youth activism, leadership, and civic engagement. Field assignments expose students to advocacy practices in a community setting and the importance of working collaboratively with providers and systems. Prerequisites: JJA 201, JJA 301 and JJA 302. Advanced.",JJA 380: Youth Work and Youth Advocacy
Juvenile Justice and Youth Advocacy,4,"Integrate conceptual frameworks with practical applications of concepts and skills learned throughout the JJYA major. A community-based integrative service learning project and written assignments allow students to demonstrate their attainment of pro-gram competencies. Prerequisites: JJP 401 or SWK 452, and JJA 402.",JJA 403 : Senior Integrative Seminar in JJYA
Juvenile Justice and Youth Advocacy,4,"Integrate conceptual frameworks, self-reflection, and skill development with the practicum experience. Focus on professional development for work with youth and families. Taken concurrently with JJP 401 Practicum in Juvenile Justice for non-Social Work Majors. Restricted to concentrators in Juvenile Justice and Youth Advocacy, senior standing or permission. Prerequisite: JJA 380, Research Methods, completion of WLCE requirement before placement process begins.",JJA 404: Practicum Seminar in JJYA
"Leadership, Policy and Administration",3,"Topics include: observation, communication, supervising and mentoring skills; adult development and learning; knowledge about teaching, learning and curriculum; and societal changes. Examines issues such as selecting and assigning mentors, differentiating teacher roles, empowering teachers, evaluation responsibilities, resource and time allocation and coordination for mentoring. Prerequisite: two or more years of teaching experience in grades K-6.",LPA 706: Role of the Mentor Teacher
"Leadership, Policy and Administration",3,"Examines organizational models and systems theory in educational settings. A focus on strategic planning and effective management and leadership will develop participants ability to manage group dynamics and mentoring, as well as promote positive organization-al change. Learners will apply theories of organization through the use of case studies and field experiences. Offered in Singapore programs only.",LPA 720 : Leadership for Organizational Change in Educational Settings
Life Sciences,4,"Living outdoors in a semester-long journey in New England, we focus on the relationships between plants, animals, fungi and geology. Emphasizing hands-on observation, field identification techniques and nature journal writing, students will understand the relationships between seasonal ecosystems and effects from animals and humans. Offered only within the Kroka partnership.",LSC 110: New England Ecology
Life Sciences,4,"Provides a multidisciplinary introduction to a broad spectrum of environmental issues. Examines interactions between humans and natural systems at local, regional and global scales. Analyzes environmental problems as well as the costs and benefits of prospective solutions, from scientific, political, policy, management and environmental justice perspectives. General Education: Investigations in Science and Technology. Introductory. Lab fee.",LSC 140: Introduction to Environmental Challenges
Life Sciences,4,"Covers plants and animals, and their relationships with various environments. Special attention will be given to species native to New England. Topics include structures and functions, diversity, growth, development, adaptation, reproduction, evolutionary processes, identification and animal behavior. Activities include observation, lab work, lab reports, readings, discussion and field trips. Hands-on approach. Routine use of technology. General Education: Investigations in Science and Technology. Introductory. Lab fee.",LSC 151: Introduction to Plants and Animals
Life Sciences,4,"Introduces metabolic pathways of carbohydrates, fats, and proteins and importance of vitamins and minerals in the body from ingestion to utilization. Includes dietary nutritional requirements, nutritional components of foods, balanced diets, analyzing diets, variations in nutritional requirements with aging, and understanding of nutritional issues in health and disease. Moderate use of technology. General Education: Investigations in Science and Technology. Introductory. Lab fee.",LSC 152: Nutrition
Life Sciences,4,"Studies the structure and function of cells and organs within body systems emphasizing mechanisms that allow the body to maintain a balanced metabolism. Topics include nutrition, illness, and cur-rent research. Technology use occasional. General Education: Investigations in Science and Technology. Introductory. Lab fee.",LSC 153: Human Biology
Life Sciences,2,"Provides a forum for different disciplines and interests to assess and evaluate current environmental topics. Provides a service-learning component and encourages student and faculty interaction with local, regional, and national environmental advocates. Develop applied research skills as well as oral and written skills. In Ad-dresses environmental issues from a scientific basis, as well as socioeconomic and political aspects.",LSC 201: Environmental Forum 
Life Sciences,4,"Engages in theory, principles, and practices of Sustainability. Includes discussions on maintaining ecological and environmental health, creating economic welfare, and ensuring social justice. Course can be taken with an optional (with additional cost) component featuring travel to Cuba. Intermediate.",LSC 240: Sustainability Through Community Engagement
Life Sciences,4,Addresses the biological functions of the human body. An introduction to cellular processes will be followed by consideration of the organ systems. Emphasis will be given to neural and endocrine homeostatic control. Technology use occasional. General Education: Investigations in Science and Technology. Prerequisite: 100 level LSC course or permission of the instructor. Intermediate.,LSC 250: Human Physiology
Life Sciences,4,"Provides fundamental and first-hand knowledge of tropical-ecosystems in terms of biological, ecological and evolutionary principles. Examines socioeconomic consequences of development, ecotourism and conservation issues. Comparisons will be made between neotropical systems and local temperate environment. Field studies and a service-learning project will be completed while in Belize. Prerequisite: Introductory level LSC or PSC course, or by permission of the instructor. Intermediate.",LSC 252: Tropical Ecology
Life Sciences,4,"Learn marine flora and fauna and their interrelationships with the physical, chemical, and geological factors in the marine system. Attention given to gaining comprehensive knowledge of basic ecological systems, food chains, taxonomy, pollution, and biological resources of the ocean. Technology use occasional. General Education: Investigations in Science and Technology. Prerequisite: 100 level LSC course or permission of the instructor. Intermediate.",LSC 254: Introduction to Marine Biology
Life Sciences,4,"Covers an overview of the biology of dinosaurs including comparative anatomy of vertebrates, evolutionary theory, geological time, fossil formation, cladistics, extinction theories and a survey of the major groups of dinosaurs, including birds. Also touches on critique of portrayal of dinosaurs in fiction, film and childrens books. Intermediate.",LSC 258: Dinosaur Biology
Life Sciences,4,"Considers reproductive physiology and endocrinology related to sexuality, menstrual and ovarian cycles, pregnancy, fetal development, labor, delivery, and nursing. Analyzes factors that maintain normal conditions for development, regulation and assessment. Technology use occasional. General Education: Investigations in Science and Technology. Prerequisite: HS biology or LSC 153 or permission of the Instructor. Intermediate.",LSC 280: Biology of Reproduction
Life Sciences,4,"Explores the fundamental characteristics of diseases and the mechanisms by which they arise. Reviews the structure and function of the body followed by emphasis of the role of the immune system in disease and repair. Considers the ecology, history and pathophysiology of a selection of infectious and genetic diseases. Technology use extensive. Prerequisite: LSC 153 or permission of the Instructor. Advanced.",LSC 302: Human Diseases
Life Sciences,4,"Focuses on chromosome structure and function, the basis and con-sequences of mutation, and metabolic pathways regulated through gene action. Topics include population genetics, genetic diseases, gene manipulation and current issues in human genetics. Technology use extensive. Prerequisite: LSC 153 or LSC 250 . Advanced.",LSC 305: Human Genetics
Life Sciences,4,"Studies New England flora and fauna with emphasis on habitat and field identification techniques. Local geology is also covered. Includes trips to representative habitats, designing and teaching a class at a local school and, as the culminating project, submitting a field guide of the Muddy River. Prerequisite: LSC 151. Advanced.",LSC 330: New England Ecology
Literature,4,"Introduces students to the history, art and writings of Latinos in the United States by studying the contributions of Mexicans, Puerto Ricans, Cubans and Dominicans. Topics covered include Latino approaches to space, identity, and sexuality. Readings include short stories, poetry, biographies and academic essays. Knowledge of Spanish is helpful, but not required. General Education: Perspectives on Diversity, Self & Society or Languages and Literature. Introductory.",LIT 140: Latino Literature & Culture in the US
Literature,4,"Explores the work of women writers from the 18th century to the present, including poetry, essays, short fiction, drama, and novels. Emphasis on female identity, creativity, coming of age, race, and feminist literary criticism. General Education: Languages and Literatures. Introductory.",LIT 145: Women in Literature
Literature,4,Introduction to the work of a major Russian author. Russian literature has long responded to two fundamental questions: What is to be done? Who is to blame? Consider how the author under consideration addresses these questions as well as their own responses. General Education: Critical Thinking and Languages and Literatures. Introductory.,LIT 147: Questioning Russian Authors
Literature,4,"Introduces students to the short story genre and methods employed by authors to craft successful short stories. Focuses on elements of short fiction such as character, plot, point of view, description, and style, and how these elements contribute to a storys effect. Re-quires students to engage in both analytical and creative writing. General Education: Languages and Literatures OR Creativity and the Arts. Introductory.",LIT 150: Introduction to the Short Story
Literature,4,"Introduces students to close reading and critical analysis of literary texts from major genres of literature (lyric poetry, drama, novel, short story). Considers historical context of themes that are adapted, transformed, and rethought at critical moments in literary history. General Education: Languages and Literature. Completion of or exemption from ENG 120.). Introductory.",LIT 170: Introduction to Literature
Literature,4,"Compares cinematic and literary treatment of a story. Emphasis on literary and film history, and on comparing language, structure and technique of film and fiction. Works may include Shakespeare, 19th novels such as Frankenstein, or recent works, such as Be-loved. Integrated Humanities course. General Education: Languages and Literatures. Prerequisite: Completion of or exemption from ENG 120. Introductory.",LIT 180: Film and Fiction
Literature,4,"Examines exemplary responses to the Holocaust in a variety of genres by writers and filmmakers. Reviews the basic historical background and examines testimonials by death camp survivors as well as imaginative responses in various media: poetry, short story, graphic novel, and film. Intermediate.",LIT 212: Literature of the Holocaust
Literature,4,"Surveys American literature from beginnings to the present. Includes study of Native American narratives and poetry, Puritan writers, American Renaissance, modernism, Harlem Renaissance, and contemporary writers. Emphasis on distinctive themes of American literature, such as individualism, democracy, and equality. General Education: Upper Level Writing (after ENG 121, ) and Languages and Literatures or Self and Society. Prerequisite: Completion of or exemption from ENG 120. Intermediate.",LIT 215: Survey of American Literature
Literature,4,"Analyzes literature of the Caribbean in cultural and historical con-texts. May include writers from Jamaica, Trinidad, Haiti, Barbados, Guyana, Cuba, Guadeloupe, Puerto Rico. Emphasizes concerns of island writers, including Indian cultures, slave life, African heritage, folk material, colonialism, and independence movements. General Education: Languages and Literatures AND Perspectives on Diversity. Integrated Humanities course. Global Perspectives course. Intermediate.",LIT 226: Literature and History of the Caribbean
Literature,4,"Introduces literature of English Renaissance of 16th century, beginning with English revisions of Italian poetry, placing achievements of Wyatt, Sidney, Shakespeare, and Spenser in context of tumultuous changes in religion, renaissance humanism, power of the court, growth of London, Tudor style, a female monarch, voyages of discovery, and influences of classical literature. Integrated Humanities course. General Education: Upper-Level Writing (after ENG 121,) and Languages and Literatures or Historical Perspectives. Integrated Humanities course. Intermediate.",LIT 240: The Renaissance in England
Literature,4,"Surveys Native American literature from oral narratives, to 19th century autobiography and speeches, to contemporary novels and poetry. Topics include ways of telling stories and writing, identity, and connections to tribal and American history. General Education: Upper Level Writing and Perspectives on Diversity and Languages and Literatures. Intermediate.",LIT 245: Native American Literature
Literature,4,"Surveys African-American literature from slave narratives through contemporary novels and poetry. Topics, periods, and genres include slave narratives, late nineteenth-century novels, poetry of the Harlem Renaissance, the 1960s, and contemporary drama, fiction and poetry. General Education: Languages and Literatures AND Perspectives on Diversity. Intermediate.",LIT 246: African-American Literature
Literature,4,"Studies the achievement of a single author. Selected works by one writer are studied to consider the authors artistic development, vision of reality, persistent themes, and value to 21st century readers. May be repeated for credit. General Education: Languages and Literatures and Upper-Level Writing (after ENG 121). Intermediate.",LIT 249: Major Author
Literature,4,"Studies Shakespeares plays in historical context and on stage and screen. Emphasizes plays as reflections of Renaissance culture in England. Focuses on language of the plays, genre (comedy, tragedy, history, romance), and gender roles. May focus on comedy or tragedy, analysis of one play in historical context, or Shakespeare films. General Education: Creativity and the Arts or Languages and Literatures. Intermediate.",LIT 262: Shakespeare
Literature,4,"Introduction to the epic poems of the ancient world. Topics include changing nature of heroism, oral vs. literate poetry, social function of the epic, myth and epic, representation of evil and the monstrous, and gender. Considers the historical and cultural contexts in which epics were composed. General Education: Upper Level Writing and Languages and Literatures. Intermediate.",LIT 263: The Epic: Heroes and Monsters
Literature,4,"Offers opportunity for intensive study of selected novels. Novels are studied in historical context, and differing critical approaches to the works are reviewed. May be repeated for credit. Prerequisite: One course in literature or permission of the instructor. Intermediate.",LIT 288/388: Studies in the Novel
Literature,4,"Examines epics and romances in medieval literature from the 10th to the 14th century. Focuses on changing ideals of heroism and in-creasing importance of romantic love to those ideals. Considers chivalric society, the role of women, the function of kinship, church, and feudalism in organizing social ties. General Education: Upper Level Writing (after ENG 121) and Languages and Literatures. Intermediate.",LIT 301: Medieval Literature: Epic and Romance
Mathematics and Math/Science,4,"Applies mathematics to understanding social and personal issues, with some sections focusing on a theme. Mathematical concepts include percentages, ratios and proportions, probability, descriptive statistics, and functions. Emphasizes mathematical process; uses mathematical software. Meets three periods per week, with an additional study group led by a math leader. General Education: Foundations of Knowledge and Inquiry Mathematics. Introductory.",MAT 120: Quantitative Reasoning 
Mathematics and Math/Science,4,"Deepens understanding of Number and Operation; Algebraic Thinking; Geometry and Measurement; and Probability and Data Analysis. Emphasizes problem-solving, justifying reasoning, mathematical communication, representation, and mathematical connections. Intended for prospective teachers. Three-semester sequence, meets three periods per week, with an additional study group led by a math leader. General Education: Foundations of Knowledge and Inquiry Mathematics.","MAT 130/131/132: Concepts and Processes I, II, and III"
Mathematics and Math/Science,4,"Two semester intensive version of the Concepts and Processes Sequence (Math 130/131/132), intended for well-prepared students. Meets three periods per week, with an additional study group led by a math leader. Prerequisite: Passing Entry Exam. General Eduction: Foundations of Knowledge and Inquiry Mathematics. Introductory.",MAT 140/141: Intensive Concepts and Processes I and II
Mathematics and Math/Science,4,"Studies trigonometry, complex numbers, polynomials, rational functions and analytics geometry. Focuses on problem solving, constructing mathematical models, mathematical reasoning, asking questions, and making connections between topics. Offered for OnCampus Boston students who intend to major in science, engineering or a business-related field..",MAT 165: Precalculus
Mathematics and Math/Science,4,"Develops understanding of elementary statistical techniques needed in behavioral sciences. Includes frequency distributions, graphs, measures of central tendency and variability, percentiles and standard scores. Emphasis on sampling theory, hypothesis testing and drawing conclusions about a population from sample data. Includes study group. General Education: Foundations of Knowledge and Inquiry Mathematics. Prerequisites: MAT 120. Introductory.",MAT 170: Statistics for the Behavioral Sciences
Mathematics and Math/Science,4,"Uses crochet, quilts, temari and other fiber arts to explore pattern, symmetry, curvature and other mathematical concepts from spherical, hyperbolic and two- and three- dimensional Euclidean geometries, as well as topics from graph theory and algebra. Includes hands-on projects and computer designs. No experience necessary. General Education: Fulfills Quantitative Reasoning and Mathematical Thinking. Introductory.","MAT 186: Math with Crochet, Quilts and Temari"
Mathematics and Math/Science,4,"Studies mathematical ideas in literate and oral cultures. Expands students understanding of numbers, arithmetic operations, patterns and geometry concepts. Emphasizes reasoning and problem solving and recognizing the contributions of different cultures to the development of mathematics. Possible topics include numbers systems, geometry, games, and calendars. General Education: Fulfills Foundations of Knowledge and Inquiry Mathematics. Introductory.",MAT 187: Mathematics from Many Cultures
