category,credits,description,title
Physical Science,4,"Investigates solar, wind, hydro, tidal and geothermal energy via physics and the carbon cycle, nuclear and fuel cell energy via chemistry. Uses laboratory experimentation, readings, real and virtual field trips to learn about Green Energy through the lens of physics and chemistry, developing skills in representation, analysis and interpretation. Prerequisite: Introductory level PSC or LSC course, or by permission of the instructor. Intermediate.",PSC 256: Investigating Green Energy
Political Science and Global Studies,4,"Explores the basics of Globalization: what it is and how to under-stand it as an economic, political and cultural phenomenon. Analyses what globalization means in practice, and why it takes the form it does and places the global economy in its historical con-text, and considers political and institutional factors. General Eduction: Self and Society or Ethics and Social Justice. Introductory.",PSG 101: Issues in Globalization
Political Science and Global Studies,4,"Introduces the diversities and similarities of cultures throughout the world from simple homogeneous groups to complex contemporary civilizations, including our own. Emphasis will be placed on the development of personality and the role of the family in the total cultural complex. General Education: Perspectives on Diversity and Self and Society or Ethics and Social Justice. Introductory.",PSG/HDA 121: Anthropology and Globalization
Political Science and Global Studies,4,"Explores globalization as a gendered process and a discourse on gender. The course critically analyses the subordination of women as a consistent feature of globalization. Utilizing and critiquing multiple theoretical frameworks, we take historical and social/cultural approaches to studying the role of women in the mod-ern world system. General Education: Perspectives on Diversity and Self and Society or Ethics and Social Justice. Introductory.",PSG 130: Women and Globalization
Political Science and Global Studies,4,"Delve into the world of Black Widows and Demon Lovers. Using empirical research, case studies, and drama, course separates fact from fiction to examine the motivations, forms and conditions under which women behave violently. Focus areas include: gender and violence, recruitment and suicide bombers. General Education: Fulfills Ethics and Social Justice and Perspectives on Diversity. Introductory.",PSG 135: Bombs and Bombshells
Political Science and Global Studies,4,"Discover a world of thieves, pirates and great vampire squids. From violent land grabs in Africa to sweltering sweatshops in Asia, follow corrupt moneygrubbers as they scour the globe in an effort to dispossess, pillage, swindle and exploit for profit. Examines how global capitalism intersects with greed, corruption and resistance. General Education: Perspectives on Diversity, Ethics & Social Justice OR Historical Perspectives. Introductory.",PSG 140: Global Greed and Corruption
Political Science and Global Studies,4,"Explore the foundations of the concepts of justice, liberty, power and equality. Join the debates over when revolutions are justified, why religious tolerance really matters, what gives governments authority over their citizens, and where real political power actually resides. Is there any country that really has it all? Introductory.",PSG 145: Introduction to Political Theory|
Political Science and Global Studies,4,"Combating pornography, sexual harassment, domestic violence and other forms of oppression takes place on the streets and through legislations. Explore the pathways to victories on gay marriage, equal pay and reproductive rights, and learn what obstacles remain for those groups whose equal rights have been denied. General Education: Fulfills Perspectives on Diversity and Upper Level Writing (after ENG 120), Ethics and Social Justice or Self and Society. Limited to juniors and seniors only. Intermediate.","PSG 220: Issues in Policy, Law and Gender"
Political Science and Global Studies,4,"Explores the social and cultural aspects of health and illness. Emphasis on the varied ways that illness is defined and treated throughout the world. Readings draw upon the disciplines of sociology and anthropology. Topics include witchcraft, faith-healing, and alternative medicine in the U.S.. Special focus on the inequities of health care and outcomes. General Education: Perspectives on Diversity and Self and Society or Ethics and Social Justice. Intermediate.",PSG/HDA 226 (Formerly HDS 225): Perspectives on Global Health
Political Science and Global Studies,4,"Explores the complications and advantages of increased media exposure and visibility and problematize what these representations tell us about politics more generally. Drawing on scholarship from sociology, politics, psychology and history the course considers the interrelationships between the social constructs of sexuality, representations, gay marriage, AIDS, transnational identities, pivotal court cases, social movements and violence. Open to sophomores and above. General Education: Self and Society and Perspectives on Diversity. Intermediate.",PSG 230: LGTB Politics in Film
Political Science and Global Studies,4,"Explore the worlds bloodiest wars, nagging conflicts and ongoing hostilities while learning tactics to prevent and resolve them. From the conflicts in Northern Ireland, South Africa, Israel and Palestine to the Sudan, students actively participate in solving simulated conflicts and learn lessons from cases where resolution efforts have tragically failed. Open to Sophomores and above. General Education: Fulfills Perspectives on Diversity, Ethics and Social Justice or Self and Society.",PSG 235: Theory and Practice of Conflict Resolution
Political Science and Global Studies,4,"Examines contexts where legislative attempts for change fail and grassroots movements emerge to influence change. Critically ex-amines movements such as the uprisings in Egypt, LGBT movements and the US civil rights movement. General Education: Up-per Level Writing, Historical Perspectives or Ethics and Social Justice. Intermediate.",PSG 240: Social Movements
Political Science and Global Studies,4,"Explores the global sex trafficking industry and impact on victims, consumers and culture. Examines the historical, economic, political and gendered dynamics of the industry, and the ways organizations work to combat the problem. Focus on the activism of survivors working to end the demand for trafficked women and children. Intermediate.",PSG 250: Politics of Sex Trafficking
Political Science and Global Studies,4,"Explores the processes and outcomes of globalization and analyzes basic Human Rights literature and its application to the global economy. Students will also discover how their daily actions and interactions impact the lives of others, particularly those in impoverished nations. Prerequisite: HDP 120-121, 122-123 or HDP 130/131. General Education: Perspectives on Diversity and Self and Society or Ethics and Social Justice. Advanced.",PSG/HDA 350: Globalization and Human Rights
Political Science and Global Studies,4,"Explore the enchanted, perverted, topsy-turvy world of capital-ism. From its mysterious invisible hand to its insatiable were-wolf-like hunger for labor, this course probes the inner workings of the global economy and surveys competing explanations of it. Students emerge with a powerful set of tools for understanding contemporary capitalism. Gen Education: Fulfills Upper Level Writing (after ENG 120), Self and Society or Historical Perspectives. Prerequisites: Junior or Senior standing. Advanced.",PSG 380: Capitalism and its Discontents
Interprofessional Studies,4,"Introduces the psychological study of human behavior and experience. The history, scope and methods of contemporary psychology are described. Topic include: perception, learning, memory, intelligence, emotion, language and thought, social interaction in small and large groups, behavior and mood disorders and treatment, psychology and health. General Education: Self and Society. Introductory.",HDP 102: Introduction to Psychology
Interprofessional Studies,4,"Provides an introduction to theories and research on how individuals are influenced by others. Topics include social perception, affiliation and interpersonal attraction, altruism, aggression, stereotyping and prejudice, group dynamics and conflict resolution. The application of social psychological knowledge to current social problems will be discussed. General Education: Self and Society. Introductory.",HDP 104: Social Psychology
Interprofessional Studies,3,"Studies major developmental shifts from conception through the end of early childhood across social, emotional, biological, and cultural domains. Emphasis on competing theoretical perspectives, the role of sociocultural contexts, and cultural diversity. Particular connections between theory, research, and practice. General Education: Foundations of Knowledge and Inquiry Human Growth and Development. Introductory.",HDP 130: Human Growth and DevelopmentTheory
Interprofessional Studies,3,"Studies major developmental shifts from middle childhood through the end of late adulthood across social, emotional, biological, and cognitive domains. Emphasis on competing theoretical perspectives, the role of sociocultural contexts, and cultural diversity. Particular connections between theory, research, and practice. General Education: Foundations of Knowledge and Inquiry Human Growth and Development. Introductory.",HDP 131: Human Growth and Development IITheory
Interprofessional Studies,4,"Deals with contemporary theories of personality and their historical derivations, with emphasis on the psychoanalytic, behavioristic, humanistic, cognitive and interpersonal approaches. Attention is given to the major issues involved in the differing conceptualization of personality. Prerequisite: HDP 120/121 or HDP 130. Intermediate.",HDP 220 : Theories of Personality
Interprofessional Studies,4,"Provides overview of the nature of psychopathology. Examines the etiology, classification, and treatment of emotional disturbance. Attends to the criteria for defining abnormal behavior and to the physiological, interpersonal, and cultural factors involved. Prerequisite: HDP 120/122-121/123 or HDP 130/131. Intermediate.",HDP 223: Abnormal Psychology
Interprofessional Studies,4,"Provides an overview of emotional development throughout the life span. Explores implications of theory and research for curriculum development, social programs and policy. Prerequisite HDP 120/121 or HDP 130 or introductory level psychology course or the equivalent. HDP 264, HDS 264, or, for students double-majoring in Human Development and Social Work, SWK 268. Intermediate.",HDP 224: Theories of Emotional Development
Interprofessional Studies,4,"Provides an overview of strength-based approaches in psychology that explore the origins of happiness, optimism, gratitude and hope of individuals, communities and nations. Introduces participants to theory, research and practice of positive psychology. Prerequisite HDP 120/121 or HDP 130 or introductory level psychology course or the equivalent. Intermediate.",HDP 226: Positive Psychology
Interprofessional Studies,4,"Surveys theory and research on language development from birth through school-age. Examines the various components of signed and spoken language and their acquisition. Considers bilingualism, relationships between oral and written language, atypical language development, and the sociocultural context of childrens language use. Prerequisite: HDP 120/121 or HDP 130.",HDP 227 : Language Development
Interprofessional Studies,4,"Integrates theory, research and practical experience about the first three years of life through a transdisciplinary approach. Considers development across domains and the impact of parent-child relationships, peer relationships, and early socialization patterns on young childrens development. Observing and recording an infant or young childs behavior and development required. Prerequisite: HDP 120/122-121/123 or HDP 130/131. Intermediate.",HDP 257: Infant and Toddler Behavior and Development
Interprofessional Studies,4,"Introduces scientific methods of inquiry in psychology. Examines research design, selection of measures, data collection, descriptive analyses, and research ethics. Individual research projects are required. Prerequisite: HDP 120/121 or HDP 130.",HDP 264: Research Methods
Interprofessional Studies,4,"Examines contemporary theory and research on motivational factors in learning among children K-12. Explores family, school, societal, and cultural influence on childrens beliefs and attitudes about learning. Topics include conceptions of effort and ability, teacher expectancies, intrinsic motivation, gender influences, tracking, and cross-cultural differences in achievement motivation. Prerequisite: HDP 120/122-121/123 or HDP 130/131. Intermediate.",HDP 265 : Achievement Motivation 
Interprofessional Studies,4,"Understand the effects of brand marketing and screen media expo-sure on young childrens development, imagination and play. Course discussion is based on research focusing on the consequences of exposure, including obesity, impairment of neurological development, aggression, childs distorted sense of reality, and vulnerability to commercialism and materialism. Prerequisites: HDP 120-123 or HDP 130-131; recommended: HDP 257. Intermediate.","HDP 280: Infants, Toddlers, and the Media"
Interprofessional Studies,4,"Examines impact of print and electronic media (radio, television, video games, computers and the Internet) on childrens development. Explores curriculum and policy responses to childrens fascination with the media. Prerequisite: HDP 120/121 or HDP 130. Intermediate.",HDP 282: Children and the Media
Interprofessional Studies,4,"Provides an introduction to characteristics of individuals with various exceptional conditions. Explores areas of human functioning impacted by these conditions. Includes overview of social, educational, and political context of the development of exceptional children. General Education: Self and Society. Intermediate.",HDP 290: Children with Special Needs
Interprofessional Studies,4,"Provides an overview of child and adult psychotherapy. Discusses psychoanalytic, client-centered, cognitive, behavioral, narrative, couples, and family systems approaches to counseling. Explores impact of gender, class and race on therapeutic relationships. Uses case studies in print and video and role play to illustrate different forms of psychotherapy. Prerequisite: HDP 120/122-121/123 or HDP 130/131. Advanced.",HDP 301: Counseling Psychology
Interprofessional Studies,4,"Pursues three objectives: to reconstruct the stages or phases of political understanding children bring to the political process; to explore how childrens political beliefs and attitudes are shaped by their political environment (e.g., race, class, nationality, historical circumstances, societys level of development); and to develop strategies for childrens political empowerment Prerequisite: HDP 120/122-121/123 or HDP 130/131. Offered in conjunction with HDF 791. Advanced.",HDP 316: Childrens Political Lives
Interprofessional Studies,4,"Examines nature of media-its violence, sexism, racism and commercialism; why it is this way; how it shapes childrens development, attitudes and behavior, families, and society; how to develop broad-based media literacy which incorporates conflict resolution, anti-racism, anti-sexism efforts into professional settings and everyday life; policy and advocacy issues. (Advanced Psychology, Advanced American Studies, Advanced Communications). Pre-requisite: One course in Human Development.",HDP/ AST 323: Media Madness
Interprofessional Studies,4,"Explores the dynamics of autobiographical memory and the development of identity. Topics include memories from personal experiences, public events, childhood amnesia, individual, gender, and cultural differences; life transitions, traumatic events, eyewitness testimony, collective memories, mad memory disorders. (Advanced Psychology, Advanced Children, Family, and Culture; open to honors, juniors and seniors). General Education: Perspectives on Diversity and Upper Level Writing (after ENG 121).","HDP 325: Memory, Identity, and Development"
Interprofessional Studies,4,"Examines the psychological experiences of Asian Americans, including the historical, sociopolitical, and cultural influences that shape personality and mental health. Explores foundational concepts, such as culture, ethnicity, and race, as they pertain to diverse Asian Americans, and considers cultural competence, intervention and prevention strategies in working with Asian Americans. Pre-requisites: HDP 120-121/ HDP 122-123 or HDP 130/131. General Education: Self and Society and Ethics and Social Justice and Perspectives on Diversity. Advanced.",HDP 327: Asian American Psychology
Interprofessional Studies,4,"Interdisciplinary investigation of the historical, ideological, structural, cultural, and individual manifestations of race and racism in society. Examines how the intersection of race with social class, gender, ethnicity, identity, and sexuality shapes the human experience, and how these factors operate as systems of power and inequality which differentially advantage and disadvantage groups. Gen Education: Perspectives on Diversity and Ethics and Social Justice. Prerequisites: HDP 120/122 or HDP 130/131.",HDP 330: Psychology of Race
Interprofessional Studies,4,"Explores a key question about human development: what is the role of experience in development? Examines cognition in children and adults who area deaf and/or blind. Considers how limited sensory experience affects the development of language, spatial representation, and theory of mind. Psychology Focus. Prerequisites: HDP 120/122 - 121-123 OR HDP 130/131; AND ENG 121. Advanced.",HDP 335: Cognition in the Deaf and Blind
Interprofessional Studies,4,"Examines critically why racial and ethnic differences in academic achievement in the U.S. continue by investigating societal, cultural and familial factors. Explores the roles of institutional racism, cultural beliefs and parental socialization practices. Scrutinizes inter-national achievement differences, and analyzes cutting edge solutions to close the achievement gap. Prerequisites: HDP 120- 123 or HDP 130-131. Advanced.",HDP 354: The Achievement Gap
Interprofessional Studies,4,"Uses sociocultural frameworks to examine the practices of non-parental caretaking of young children within the United States and worldwide. Focus on both center-based and less formal practices of child care. Students examine ways to become sensitive in working with children of cultures other than their own. General Education: Upper Level Writing (after ENG 121). Prerequisite: HDP 264, or, for students double-majoring in Human Development and Social Work, SWK 268 or HDS 264. Offered in conjunction with HDF 658. Advanced.",HDP 358: Cross-Cultural Perspectives on Child Care
Interprofessional Studies,4,"Explores the meaning and development of play from infancy through adulthood through theories, research, and application. Examines value of play in therapeutic, educational and medical settings; how the environment (including toys and media) influences play; how to support play, integrate it into professional work, and advocate for play. Prerequisite: HDP 120/122-121/123 or HDP130/131. Advanced.",HDP 362: The Meaning and Development of Play
Interprofessional Studies,4,"Draws on disciplines of psychology, education, biology and sociology to provide a multidisciplinary perspective of adolescent development. Examines risk and protective factors within home, school and community that shape development within and across the contexts of race, ethnicity, gender, sexual orientation and socioeconomic status. Prerequisite: HDP 120/122 or HDP 130. Advanced.",HDP 366: Adolescent Development
Interprofessional Studies,4,"Examines development from the transition into adulthood through old age. Theory and research from different psychological approaches are presented. Topics include changes in cognitive, mor-al, psychosocial, interpersonal and physical development; and typical adult developmental tasks in the context of culture. Open to juniors and seniors. Offered in conjunction with HDF 515. Advanced.",HDP 368: Adult Development 
Interprofessional Studies,2,"Introduces major approaches to understanding and programming for young children with emotional problems. Examines psycho-educational, behavioral, and ecological perspectives concerning the assessment and treatment of children with emotional problems. Emphasis on utilizing these perspectives to alert students to issues and skills in identifying emotional problems. Prerequisite: HDP 120/122-121/123 or HDP 130/131. Fulfills requirement of advanced course upon completion of HDP 380. Advanced.",HDP 379: Emotional Problems of Children
Interprofessional Studies,2,"Further examines major approaches to understanding and programming for young children with emotional problems whose needs range from mild to severe focusing on medical and sociological models. Students may study one model in-depth. Skills for working with disturbed children are fostered through observation of field sites, case studies and simulations. Prerequisite: HDP 379. Advanced.",HDP 380: Seminar in Emotional Problems of Children
Interprofessional Studies,4,"Surveys linguistic theory and first- and second-language acquisition research. Analyzes a speakers unconscious knowledge of language by examining the structure of English and other languages. Follows the development of this knowledge in infants, children, and adults. Considers the sociopolitical context of becoming and being bilingual. Prerequisite: HDP 120/122-121/123 or HDP 130/131. General Education: Upper Level Writing (after ENG 121), Languages and Literatures. Advanced.",HDP 382: Nature of Linguistic Knowledge
Reading/Language and Literacy,0,Demonstrate candidate reflection on and analysis of applied practice as a reading specialist. Course provides an addendum process that builds on the completed RDP609 portfolio and the EDU708 portfolio components. Benefits alumnae/I of graduate programs who are applying for initial licensure.,RDG 099: Teacher of Reading Capstone
Reading/Language and Literacy,3,"Addresses factors affecting literacy development and instruction of ELLs learning to read and write in English. Develops skills in assessing components of learners reading and writing competence; teaching early, later and advanced reading skills; lesson planning; progress monitoring. Participants implement an assessment and tutoring project with an ELL student.",RDG 530: Teaching Literacy to English Language Learners
Reading/Language and Literacy,0,"Consolidates professional background in theory and practice of teaching reading in grades Pre-K- 8. Addresses core concepts and instructional practices for phonological and phonemic awareness, emergent literacy, phonics, vocabulary, comprehension, and reading assessment. Builds upon the professional knowledge developed in EDU 327, EDU 337 or RDG 537. Prerequisite: EDU 327 or EDU 337 or RDG 537.",RDG 535/ EDU 335: Reading Theory and Practice
Reading/Language and Literacy,3,"Analyzes stages of reading development in grades Pre K-8. Focuses on phonological awareness, print concepts, word identification, vocabulary, fluency, and comprehension. Participants administer literacy assessments to children, interpret assessment data, and plan engaging, small group instruction.",RDG 537: Teaching Reading 
Reading/Language and Literacy,3,Introduces broad range of multicultural literature. Focuses on criteria for making appropriate book selections. Examines literary theme and genre. Explores strategies for using childrens literature to promote literacy development.,RDG 558: Multicultural Childrens Literature
Reading/Language and Literacy,3,Examines childrens literature written by and about African Americans. Explores the literatures cultural and historical context. Dis-cusses strategies for using the literature effectively with children to enhance their literacy development.,RDG 560: African American Childrens Literature
Reading/Language and Literacy,3,"Provides theoretical constructs in multisensory literacy approaches to aid the reading specialist, special educator, or classroom teacher meet the complex challenges in instructing students with language-based learning differences. Includes introduction to the Wilson Language Program and the Lindamood-Bell Lips and Visualizing and Verbalizing programs. Prerequisites: RDG 537 or permission of the instructor.",RDG 601: Multisensory Approaches for Teaching Literacy
Reading/Language and Literacy,3,"Examines reading comprehension, writing, and vocabulary skills critical for success in academic content areas. Investigates the impact of text difficulty, background knowledge, and understanding of text structure on comprehension of nonfiction text. Develops skill at teaching vocabulary, metacognitive, and study skills in the context of theme-based units.",RDG 618: Literacy Across the Curriculum
Reading/Language and Literacy,3,Develops skill at diagnosing literacy needs through formal and in-formal assessments and planning research-based instruction. Twice-weekly tutorial sessions with struggling emergent readers in an off-campus laboratory setting. Emphasizes importance of readers cultural and linguistic backgrounds. (Requires permission of the instructor).,RDG 622: Individualized Instruction in Literacy
