category,credits,description,title
Academic Support,0,Prepare for a range of required MTEL exams. Includes a review and introduction to test-taking strategies and crafting of an individual MTEL plan.,"ACD 300/500: MTEL Strategies: Plan, Prepare, Pass"
Academic Support,0,"Reviews content included in the Early Childhood Subject Test (MTEL). Includes test taking strategies and available test preparation resources. Topics include test-taking strategies, Child Development, Science, Math, Social Studies, Language Arts and Reading.",ACD 306/506: MTEL preparationEarly Childhood Education review
Academic Support,0,"This course reviews Reading, the subject matters related to the Communication & Literacy Subject Test in the Massachusetts Tests for Educator Licensure (MTEL).",ACD 313/513: MTEL Prep: Communication and Literacy Skills Reading Subtest
Academic Support,0,"This course reviews Writing, the subject matters related to the Communication & Literacy Subject Test in the Massachusetts Tests for Educator Licensure (MTEL).",ACD 314/514: MTEL Prep: Communication and Literacy Skills Writing Subtest
Academic Support,0,"Reviews Reading and Writing, the subject matters related to the Communication and Literacy Subject Test in the Massachusetts Tests for Educator Licensure (MTEL).",ACD 315/515: MTEL Preparation Communication and Literacy Skills Test
Academic Support,0,"This course reviews the subject matters related to the General Curriculum I: Multi-Subject Test in the Massachusetts Tests for Educator Licensure (MTEL). Topics include: English Language Arts - Literature, English Language Arts - Structure and Writing Process, U.S. and Massachusetts History, U.S. Government, World History/Geography, Physical Science, Earth and Space Science, and Life Science. $15 cancellation fee for students who register but do not attend.",ACD 316/516: MTEL Prep GC
Academic Support,0,Reviews Mathematics content and test objectives related to the General Curriculum: Mathematics subtest (MTEL). Typically meets for 3 sessions; Student should enroll in this course based on the suggestion of instructor and performance in the math sequence. Otherwise students should enroll in ACD 318/518 for preparation for the General Curriculum: Mathematics Subject subtest.,ACD317/517: MTEL Preparation: General Curriculum: Mathematics Sub Test 
Academic Support,0,Reviews Mathematics content and test objectives related to the General Curriculum: Mathematics Subject (MTEL).,ACD 318/518 : MTEL Preparation: General Curriculum: Mathematics Sub Test
Academic Support,0,"Designed to review the mathematical concepts that may be assessed on the General Curriculum: Mathematics subtest MTEL. Covers number theory, geometry and measurement, probability and statistics, numbers and operations, functions and algebra, and open response problems.",ACD 320/520: MTEL Preparation: Intensive Math Content Review
Academic Support,0,"This intensive MTEL Preparation module is designed to support students in developing a deep understanding of the Foundations of Reading Test, which includes Foundations of Reading Development, Development of Reading Comprehension, and Reading Assessment and Instruction. Students will understand the requirements of and draft sample open responses that integrate knowledge and understanding, analyze multiple choice questions, and implement strategies to ensure success on the test. Homework and additional resources will be provided and students will be invited to subsequent workshops to fine tune misconceptions and gain additional practice prior to taking the test. Due to the nature of this course, all students MUST attend the full-day session BEFORE attending a workshop. $15 cancellation fee for students who register but do not attend.",ACD 340/540: MTEL Prep: Foundations of Reading
Academic Support,0,"Designed to help graduate students develop the writing skills they need to succeed in both their academic and professional lives. Re-views fundamentals like grammar, sentence structure, idea development, and organization while teaching specific writing strategies for graduate school assignments. Introduces best practices for re-search and citation.",ACD 501: Building a Foundation for Graduate Writing
Academic Support,0,"Reviews the subject matter included in the Massachusetts Tests for Educator Licensure Reading Specialist test. Topics include introduction and test-taking strategies, reading development, assessment, reading instruction, roles of the reading specialist. Enrollment is limited to students enrolled in the masters program in Teacher of Reading. Prerequisite: RDG 618. Corequisite: RES 722 and RDP 609.",ACD 507: MTEL PreparationReading Specialist Subject Review
American Studies,4,"Delves into the world of Black Widows and Demon Lovers. Using empirical research, case studies, and drama, course separates fact from fiction to examine the motivations, forms and conditions under which women behave violently. Focus areas include: gender and violence, recruitment and suicide bombers. General Education: Fulfills Ethics & Social Justice AND Perspectives on Diversity. Introductory.",AST 135: Bombs and Bombshells
American Studies,4,"Introduction to a multicultural analysis of media theory, content, and effects. Explores how racial and racist perceptions of people of color shape cultural norms, attitudes, and practices. Covers a wide range of media forms such as Hip-Hop, advertisements, movies, and reality TV. General Education: Self and Society and Perspectives on Diversity. Introductory.",AST 140: Media and Race in American Society
American Studies,4,In this seminar learn how to learn. Introduction to the skills and attitudes of critical inquiry. Learn and practice these skills and attitudes by using them in the study of an American Leader such as Eleanor Roosevelt. General Education: Critical Thinking and Self and Society. Introductory.,AST 145: American Leaders: A Critical Inquiry
American Studies,4,"Analyzes institutional development of American national government, Massachusetts politics, emphasizing the presidency, Congress, and the Supreme Court. Topics include interaction of the three branches of government, the history of politics in the United States, political parties, and interest groups. Focuses on current events and public policy issues. Introductory.",AST 150: Introduction to American Government
American Studies,4,"Introduction to interdisciplinary American Studies. Explores the history, reality, ideology and meaning of American identity. American identities as shaped by such factors as place, work, family, political systems, religion and education. Focus on how American identities both shared and individual are formed by race, class, gender and ethnicity. General Education: Perspectives on Diversity, Self and Society or Historical Perspectives. Introductory.",AST 160 : American Identities
American Studies,4,"Places immigrant narratives into the broader context of immigration policies that shaped immigrant communities. Analyzes current rise in hate crimes and growing anti-immigrant sentiment. Topics include how immigration policies have been influenced by economic interests, demand for labor, war, colonization, nativism, and xenophobia. Uses oral histories, poetry, and multi-media resources. General Education: Upper Level Writing, Perspectives on Diversity, AND Historical Perspectives. Intermediate.",AST 220: Coming to America
American Studies,4,"Examines the social and cultural construction of masculinity in the United States using the theories and methods of Anthropology. Topics include race, class, ethnicity, and religion; popular images of American men (e.g., movies, magazines, sports, jokes); relation-ship of US manhood to sexuality, war, and women. Some comparison to other cultures. General Education: Perspectives on Diversity, Self and Society or Historical Perspectives. Intermediate.",AST/HDA 225 : Anthropology of American Men
American Studies,4,"Explores how gender influences and shapes political campaigns, ideologies and candidates. Sets gender within the wider historical framework of America as a multicultural society. Examines role of women change agents in American politics such as Eleanor Roosevelt and Hilary Rodham Clinton. Topics include abortion, affirmative action, gay marriage and civil rights. General Education: Self and Society or Ethics and Social Justice.",AST 256: Gender and Politics
American Studies,4,"Analyzes history and meaning of race in America. Interdisciplinary, including fiction, philosophy, historic documents, laws, and popular culture. Focus on Native American, African American, Asian American, and Latino experiences. Topics include Indian removal policies, slavery, creation of whiteness, eugenics, immigration exclusion laws, 1960s civil rights movements, and con-temporary meanings of race. General Education: Perspectives on Diversity and Upper Level Writing (after ENG 121) and Ethics and Social Justice or Historical Perspectives. Intermediate.",AST 257: Race in America
American Studies,4,"Investigates different religious traditions in the United States, past and present, while studying social science theories of religion. Topics include: Why does religion exist; how different religions assimilate or resist citizenship; the tension between religious freedom and the common good; consumerism and religion; religions in Boston; what does religion do for us that so many Americans are religious; does truth matter, and are there fake religions? General Education: Perspectives on Diversity also Historical Perspectives or Self and Society. Intermediate",AST/HDA258: Religion in America
American Studies,4,"Provides examples, context, theories, and methodologies for understanding the development and meaning of American popular culture. Particular focus on gender, race, and ethnicity. Emphasis on analysis of culture from different mediums, including popular literature, film, music, and television. Organized historically, and by medium. General Education: Perspectives on Diversity and Up-per Level Writing (after ENG121) and Historical Perspectives. Prerequisite: AST 160 or by permission of instructor. Intermediate/Advanced.",AST 265/365: Studies in American Popular Culture
American Studies,4,"A travel/study course on West African culture, history and spirituality with a 2-week international service learning component. Study and experience 2 West African countries, Ghana and Bnin that have been pivotal historically and culturally to the development of the US and other countries in the Americas. General Education: Perspectives on Diversity Intermediate.","AST 290: History, Culture and Spirituality of West Africa"
American Studies,4,"Examines nature of media-its violence, sexism, racism and commercialism; why it is this way; how it shapes childrens development, attitudes and behavior, families, and society; how to develop broad-based media literacy which incorporates conflict resolution, anti-racism, anti-sexism efforts into professional settings and everyday life; policy and advocacy issues. (Advanced Psychology, Advanced American Studies, Advanced Communications). Pre-requisite: One course in Human Development.",AST 323/HDP 323: Media Madness
American Studies,4,"Explores the processes and outcomes of globalization and analyzes basic Human Rights literature and its application to the global economy. Students will also discover how their daily actions and interactions impact the lives of others, particularly those in impoverished nations. Prerequisite: HDP 120-121, 122-123 or HDP 130-131 or HDA/PSG 121. General Education: Perspectives on Diversity, also Self and Society or Ethics and Social Justice. Advanced.",AST/HDA 350 : Globalization and Human Rights
American Studies,4,"Explores the richness of scholarship in American Studies. Using theories and methodologies adopted in the social sciences and the Humanities, students examine specific time periods, such as the 1950s or specific topics, such as the social construction of white-ness or the nature of work in capitalism. Prerequisites: AST 160 and at least one intermediate AST course or by permission of instructor. Advanced.",AST 403 : Senior Seminar in American Studies
American Studies,4 to 6,"Builds upon students focus and provides experience in a field of the students choice. Students gain deeper understanding of role of cultural institutions in American Society, such as museums, media organizations and activist based organization. Location decided in consultation with advisor. Placements are 10 hours a week. Discussion group accompanies fieldwork. Open to American Studies majors only. Prerequisite: juniors and seniors only. Advanced.",AST 410: Internship in American Studies
Arts,4,"Introduces the world of arts and the vocabularies of music, theatre and visual arts. Using a multi-disciplinary approach, offers opportunity to be creator, performer, audience member, critic. General Education: Creativity and the Arts. Introductory. Typically offered as a First-Year Seminar. Offered: fall only",AMT 101 : Introduction to the Arts
Arts,4,"Explores the experience associated with art, and considers the nature of artistic expression and of creativity. Through reading of selected philosophical texts, pursues an understanding of how we produce, perceive, and respond to art. Field trips to museums or performances. Required for Arts Majors. General Education: Up-per Level Writing (after ENG 121) Intermediate. Prerequisite: ENG 121 and one course in the arts or philosophy. Offered: fall only",AMT/PHL 254 : Aesthetics: Philosophy of the Arts
Arts,4,"Offers professional experience in an arts field of the students choice. Provides a context for understanding the meaning of the arts in peoples lives. Placements for the internship are 150 hours per semester. Open to Arts Majors only. Advanced. Prerequisite: Arts Major, Junior or Senior Status, permission of department chair. Offered: fall and spring",AMT 412: Internship in the Arts
Autism,4,"Situates contemporary understandings of autism in multiple fields. Analyzes research in multiple developmental domains. Studies the autism spectrum ranging from profound to mild, often mixed in any one individual. Explores the emergence of expert-advocates with autism and their families, of self-reports across the life-span, and of myriad cultural depictions. Counts as an Advanced Human Development course for the following Human Development majors: Child, Family and Culture; Counseling Psychology; and Developmental Psychology. Prerequisite: One semester of HGD and HDP 290 Children with Special Needs (may be taken concurrently). Advanced.",AUT 320: Foundations of Development in Autism
Autism,4,"Explores impact of persons with autism spectrum disorder on family development. Highlights benefits of including people with autism and family members as life-long participants, experts, and partners of the diagnostic/intervention team. Examines efforts to implement advocacy in service of community and policy change. Analyzes cases of collaboration in service delivery. Prerequisites: HDP 290 Children with Special Needs AND AUT 320 Foundations of Development in Autism. Advanced.",AUT 321: Family Community and Interprofessional Collaboration
Autism,4,Reviews the process of screening fro and diagnosing Autism. Dis-cusses evidence-based practices. Studies intervention designed to promote childrens communication and social skills and to address challenging behaviors. Explores instructional strategies used in educational settings for children with Autism and how to collaborate with parents and families. Prerequisite: AUT 320. Advanced.,AUT 322: Assessment and Intervention in Autism
Autism,4,"Employs cross-disciplinary perspective to address current and emerging issues of evaluation, research, policy, and advocacy related to individuals with autism and families across the lifespan in home, school, communities. Students will study multidisciplinary research and policy literature and complete a comprehensive project for presentation to the College and/or professional community. Corequisite: AUT 322 Assessment and Intervention, or AUT 321 Family Community and Interprofessional Collaboration in Autism. Advanced.",AUT 350: Advanced Study in Autism
Autism,3,"Employs cross-disciplinary perspective to address issues of evaluation, research, policy, and advocacy related to individuals with autism and families across the lifespan in home, school, and communities. Study empirical literature regarding the diagnostic criteria, biological and genetic influences, and an overview of evidence-based practice as treatment for autism.",AUT 510: Fundamentals of Autism
Autism,3,"Reviews effective evidence-based practices for individuals with autism, matches individuals strengths and needs for practices. Emphasizes assessing, implementing and evaluating appropriate interventions and support for children with social and communication challenges. Underscores recognizing the diversity of individuals with autism and the importance of positive psychology in improving their quality of life and learning outcomes. Prerequisite: AUT 510.",AUT 520: Autism: Interventions and Supports
Autism,3,"Examines effective practices for assessing and supporting challenging behavior for individuals with autism. Positive behavioral interventions and supports are emphasized and the functional behavioral assessment and analysis process will be covered in detail. There is a focus on prevention, the use of self-management techniques and teaching socially appropriate behavior. Prerequisite: AUT 510.",AUT 530: Autism: Positive Behavior supports
Child Life,4,"Introduces students to the history and development of the U.S. health care system from a family-centered care perspective, including identification of the organizations and professional disciplines serving children and their families. Focuses on the psychosocial, financial and emotional costs of health care and introduces students to the profession of Child Life. Course is open to second-semester first-year students and first-semester second-year students. Course required for application to Child Life dual degree.",CLF 210: Child and Family Health Systems
Child Life,4,"Examines the impact of acute and chronic illness on development of children with special healthcare needs. Studies neurological, genetic, metabolic, orthopedic, and developmental disorders of children with special healthcare needs.",CLF 255: Children with Special Healthcare Needs
Child Life,4,"Examines the values, attitudes, and approaches of family-centered care for pediatric patients. Studies quality and innovation in family-centered policy, programs, practice, and design. Students will learn the essential elements of building partnerships among physicians, staff, patients and families to create a mutually beneficial outcome.",CLF 257: Family Centered Healthcare
Child Life,4,Explores ways in which Child Life Specialists developmentally serve children across the life span and from diverse cultural environments. Focuses on the child and familys responses to medical care and the philosophy of family-centered care. Students complete a minimum 100 hour semester long child life practicum in a health care setting. Enrollment limited to accepted Child Life dual degree seniors. Prerequisite: LSC 153 or LSC 302.,CLF 350: Role of the Child Life Specialist
Child Life,4,"Explores relationships between child life play activities and child development theories, stressing the acquisition of practical skills needed for child life programming. Enrollment limited to accepted Child Life dual degree seniors.",CLF 421: Child Life Methods and Materials
Child Life,3,"Introduces research and literature on the psychosocial needs of children and families in health care settings. Focuses on theories of development, play, preparation, coping and delivery of family-centered care in the context of health care. This is the first in a required three course sequence for matriculated child life students. Open to matriculated child life students.",CLF 632: Child and Family in Health Care
Child Life,3,"Provides skills to plan, implement, document, and assess develop-mentally appropriate child life interventions including coping with medical procedures, family-centered care, ethics, expressive activities, crisis intervention, and pain management. Open to matriculated Child Life students.",CLF 670: Clinical Issues in Child Life 
Child Life,3,"Provides skills to plan, implement, document, and assess Child Life program objectives and strategic planning, including child health systems, alternative settings, grant writing, professional presentations, group dynamics, interdisciplinary collaboration, and supervision. Open to matriculated Child Life students.",CLF 770: Child Life Program Development 
Child Life,3,"Provides a 200 hour supervised internship opportunity for advanced studies degree students in a community, outpatient, or primary care setting with focus on developing skilled based on the Child Life Competencies. Students participate in a weekly process seminar at the college. Prerequisite: CLF 632. CLF 670 must be taken concurrently.",CLP 670: CL Internship/Seminar I 200-hour
Child Life,6,Provides a 400 hour internship opportunity under the direct super-vision of a certified Child Life Specialist in a hospital setting with focus on developing skills based on the Child Life Competencies. Participate in weekly process seminar at the college. Prerequisite: CLF 632. CLF 670 must be taken concurrently.,CLP 671: CL Internship/Seminar I 400-hour
Child Life,3,"Provides a second 200 hour supervised internship opportunity for advanced standing and combined degree students in a community, outpatient, primary care, or alternative setting with focus on continuing to develop and refine skills based on the Child Life Competencies. Students participate in weekly process seminar at the college.",CLP 672: CL Internship/Seminar II 200-hour
Child Life and Family Studies,4,"A 150-hour supervised practicum in a human services organization and a bi-weekly seminar. Undertake responsibilities suited to sites priorities and needs and students knowledge, skills, and learning goals. Explore organizational dynamics, community contexts, re-sources, and direct service goals. Open to students with junior or senior status who are completing Human Services minor program. Prerequisite: Completion of WLCE, CFS 340 and GPA of 2.0.",CFP 420: Practicum and Seminar in Human Services
Child Life and Family Studies,3,"A 150-hour supervised practicum in urban or suburban settings serving children and families, ranging from early childhood home visiting, school, health or social service, center-based consultations or workshops, to program development and public policy. Collaborate as interdisciplinary team member. Participate in monthly individual and group supervision and seminar. Offered: fall and spring. (Open only to students enrolled in the Certificate in Family and Parenting Services.)",CFP 603: Practicum and Seminar I: Family Studies
Child Life and Family Studies,4,"Explores developmental understandings of death and how children cope with grief and loss. Prepares students to help children with life-threatening conditions and to facilitate the bereavement needs of children who experience the death of a sibling, parent, relative, or friend. Prerequisite: HDP 120-123 or HDP 130-131.",CFS 240: Helping Children with Grief and Loss
Child Life and Family Studies,4,"Critically examines relationships between U.S. public policies and human services across the lifespan in health, mental health, education and social welfare. Identifies occupations and practitioners roles, responsibilities and challenges. Explores partnerships that build upon clients strengths. Opportunities to advocate for social change. Course is open to juniors and seniors only. Prerequisite: HDP 120-123 of HDP 130-131.",CFS 340: Introduction to Human Services
Child Life and Family Studies,3,"Examines procedures for formal and informal assessment of physical, cognitive and language development in children ages birth to 3. Critical issues in early developmental assessment are identified and addressed. Prerequisite: A course in infant and toddler behavior and development.",CFS 504: Assessment of Development in B-3
Child Life and Family Studies,3,"Provides an introduction to psychopathology, DSM IV assessment, differential diagnosis and clinical work with children and adolescents.",CFS 510: Child and Adolescent Mental Health
Child Life and Family Studies,3,"Examines topics including parenthood, adult development and caregiving, child-rearing practices, challenges for children and their parents, parents involvement in their childs learning and the dynamics of family life. Parenting education materials and family support services explored.",CFS 614: Perspectives on Parenting
Child Life and Family Studies,3,Examines theories about loss and bereavement and individual responses to various types of losses. Prepares students to provide bereavement interventions for individuals and groups.,CFS 617 : Bereavement Care
Child Life and Family Studies,3,"Introduction to contemporary and controversial issues related to the lives of children and families, using the ecological approach as a framework. Interdisciplinary faculty guest speakers select specific issues for analysis and discussion.",CFS 618: Contemporary Issues in Child and Family Studies 
